Sheet: Input Params
A1: Input Parameters
A2: VinMin | B2: 4
A3: VinNominal | B3: 5
A4: VinMax | B4: 6
A5: VoutBoost | B5: 180 | C5: 170v is Ignition Voltage of IN12 Nixie Tube
A7: IN-12 Digit Current | B7: 0.0025 | C7: Current per lit digit
A8: IN-12 Comma Current | B8: 0.0003 | C8: Current per lit comma
A9: Number of Tubes | B9: 4
A10: Output Current Min | B10: of:=([.B7]+[.B8])*4 -> 0.0112
A11: Output Current Design Max | B11: 0.015
A13: Duty Cycle and Inductor Calculations
A14: Duty Cycle CCM | B14: of:=1-(VIN/VOUT) -> 0.972222222222222 | C14: It is clear that duty cycle in CCM mode is not achievable. CCM mode is not really suitable anyway since boost in CCM needs a minimum load and we’re going to use PWM dimming.
A16: Inductor Selector
A17: Use Manual Input? | B17: No
A19: Manual Input
A20: Inductance | B20: 0.000082
A21: Coil Resistance | B21: 0.1
A23: Inductor Model | B23: SDR1307-820KL
A24: Inductance | B24: of:=VLOOKUP([.$B$23];[Components.$M$4:.Q11];2;0) -> 0.000082
A25: Coil Resistance | B25: of:=VLOOKUP([.$B$23];[Components.$M$4:.Q12];3;0) -> 0.14
A27: Calculation Figures
A28: Inductance | B28: of:=IF([.$B$17]="Yes";[.B20];[.B24]) -> 0.000082
A29: Coil Resistance | B29: of:=IF([.$B$17]="Yes";[.B21];[.B25]) -> 0.14
A31: Switching Characteristics(DCM)
A32: Switching Frequency(Hz) | B32: 40000
A34: Duty Cycles
A35: Switch Duty | B35: of:=1/VIN*SQRT(2*[.B28]*(VOUT-VIN)*[.$B32]*IOUT) -> 0.829939756849857
A36: Diode Duty | B36: of:=(VIN/(VOUT-VIN))*[.B35] -> 0.0237125644814245
A37: Total Duty | B37: of:=[.B35]+[.B36] -> 0.853652321331282
A39: FET Selection
A40: FET Model | B40: IPL65R070C7
A42: RDS On | B42: of:=VLOOKUP([.$B$40];[Components.$B$4:Components.$H$21];2;FALSE()) -> 0.07
A43: C_OSS | B43: of:=VLOOKUP([.$B$40];[Components.$B$4:Components.$H$21];3;FALSE()) -> 0.000000000048
A44: VG_Typ | B44: of:=VLOOKUP([.$B$40];[Components.$B$4:Components.$H$21];4;FALSE()) -> 12
A45: VG_Th | B45: of:=VLOOKUP([.$B$40];[Components.$B$4:Components.$H$21];5;FALSE()) -> 3.5
A46: Q_G | B46: of:=VLOOKUP([.$B$40];[Components.$B$4:Components.$H$21];6;FALSE()) -> 0.000000064
A47: R_G | B47: of:=VLOOKUP([.$B$40];[Components.$B$4:Components.$H$21];7;FALSE()) -> 0.85
A49: Inductor/FET Currents
A50: Peak Current | B50: of:=(VIN*Duty)/(FSW*IND) -> 1.30129927032208
A51: RMS Current | B51: of:=[.B50]*SQRT([.B35]/3) -> 0.68444703032152
A52: RMS Diode Current | B52: of:=[.B50]*SQRT([.B36]/3) -> 0.115692663962506 | C52: Might be a bad assumption
A54: FET Conduction Losses | B54: of:=[.B51]^2*[.B42] -> 0.0327927416121163
A55: FET Switching Losses | B55: of:=FSW*(([.B43]*(VOUT)^2)+VOUT*([.F51]/(1-[.B35]))*(([.B46]*[.B47])/([.B44]-[.B45]))) -> 0.062208
A57: Inductor Conduction Losses | B57: of:=[.B51]^2*[.B29] -> 0.0655854832242326
A59: Topology Option | B59: Non-Synchronous
E60: Synchronous
A61: Diode Losses | E61: MOSFET Losses
A62: Diode Select | B62: 1N4004 | E62: FET Model | F62: IPL65R070C7
A63: Diode Vfwd | B63: of:=LOOKUP([.B62];[Components.$J$4:Components.$J$12];[Components.$K$4:Components.$K$12]) -> 1.1
A64: Diode Loss(Simple) | B64: of:=IOUT*[.B63] -> 0.0165 | E64: RDS On | F64: of:=VLOOKUP([.$B$40];[Components.$B$4:Components.$H$21];2;FALSE()) -> 0.07
E65: C_OSS | F65: of:=VLOOKUP([.$B$40];[Components.$B$4:Components.$H$21];3;FALSE()) -> 0.000000000048
E66: VG_Typ | F66: of:=VLOOKUP([.$B$40];[Components.$B$4:Components.$H$21];4;FALSE()) -> 12
E67: VG_Th | F67: of:=VLOOKUP([.$B$40];[Components.$B$4:Components.$H$21];5;FALSE()) -> 3.5
E68: Q_G | F68: of:=VLOOKUP([.$B$40];[Components.$B$4:Components.$H$21];6;FALSE()) -> 0.000000064
E69: R_G | F69: of:=VLOOKUP([.$B$40];[Components.$B$4:Components.$H$21];7;FALSE()) -> 0.85
E71: FET Conduction Losses | F71: of:=[.B52]^2*[.B64] -> 0.000220849076163232
E72: FET Switching Losses | F72: of:=FSW*(([.F65]*(VOUT)^2)+VOUT*([.B52]/(1-[.B36]))*(([.F68]*[.F69])/([.F66]-[.F67]))) -> 0.067668602852643
A77: Summary Of Losses
C78: % of Total Losses
A79: Inductor Conduction | B79: of:=[.B57] -> 0.0655854832242326 | C79: of:=[.B79]/[.$B$86] -> 0.370359034333937
A80: Inductor Core | C80: of:=[.B80]/[.$B$86] -> 0
A81: FET Conduction | B81: of:=[.B54] -> 0.0327927416121163 | C81: of:=[.B81]/[.$B$86] -> 0.185179517166968
A82: FET Switching | B82: of:=[.B55] -> 0.062208 | C82: of:=[.B82]/[.$B$86] -> 0.351286499316863
A83: Diode | B83: of:=IF([.$B$59]="Synchronous";0;[.B64]) -> 0.0165 | C83: of:=[.B83]/[.$B$86] -> 0.0931749491822313
A84: Sync FET Conduction | B84: of:=IF([.$B$59]="Non-Synchronous";0;[.F71]) -> 0 | C84: of:=[.B84]/[.$B$86] -> 0
A85: Sync FET Switching | B85: of:=IF([.$B$59]="Non-Synchronous";0;[.F72]) -> 0 | C85: of:=[.B85]/[.$B$86] -> 0
A86: Total Losses | B86: of:=SUM([.B79:.B83]) -> 0.177086224836349
A87: Efficiency | B87: of:=(VOUT*IOUT)/(VOUT*IOUT+[.B86]) -> 0.93844945510925

Sheet: Min Inductance
B2: Minimum Inductance for CCM Mode
B3: Switching Frequency | C3: Minimum Inductance
B4: 50000 | C4: of:=((VIN)/(2*IOUT*[.B4]))*DutyCCM*(1-DutyCCM) -> 0.0000900205761316873
B5: 60000 | C5: of:=((VIN)/(2*IOUT*[.B5]))*DutyCCM*(1-DutyCCM) -> 0.0000750171467764061
B6: 70000 | C6: of:=((VIN)/(2*IOUT*[.B6]))*DutyCCM*(1-DutyCCM) -> 0.0000643004115226338
B7: 80000 | C7: of:=((VIN)/(2*IOUT*[.B7]))*DutyCCM*(1-DutyCCM) -> 0.0000562628600823045
B8: 90000 | C8: of:=((VIN)/(2*IOUT*[.B8]))*DutyCCM*(1-DutyCCM) -> 0.0000500114311842707
B9: 100000 | C9: of:=((VIN)/(2*IOUT*[.B9]))*DutyCCM*(1-DutyCCM) -> 0.0000450102880658436
B10: 110000 | C10: of:=((VIN)/(2*IOUT*[.B10]))*DutyCCM*(1-DutyCCM) -> 0.0000409184436962215
B11: 120000 | C11: of:=((VIN)/(2*IOUT*[.B11]))*DutyCCM*(1-DutyCCM) -> 0.000037508573388203
B12: 130000 | C12: of:=((VIN)/(2*IOUT*[.B12]))*DutyCCM*(1-DutyCCM) -> 0.0000346232985121874
B13: 140000 | C13: of:=((VIN)/(2*IOUT*[.B13]))*DutyCCM*(1-DutyCCM) -> 0.0000321502057613169
B14: 150000 | C14: of:=((VIN)/(2*IOUT*[.B14]))*DutyCCM*(1-DutyCCM) -> 0.0000300068587105624
B15: 160000 | C15: of:=((VIN)/(2*IOUT*[.B15]))*DutyCCM*(1-DutyCCM) -> 0.0000281314300411523
B16: 170000 | C16: of:=((VIN)/(2*IOUT*[.B16]))*DutyCCM*(1-DutyCCM) -> 0.0000264766400387315
B17: 180000 | C17: of:=((VIN)/(2*IOUT*[.B17]))*DutyCCM*(1-DutyCCM) -> 0.0000250057155921354
B18: 190000 | C18: of:=((VIN)/(2*IOUT*[.B18]))*DutyCCM*(1-DutyCCM) -> 0.0000236896252978124
B19: 200000 | C19: of:=((VIN)/(2*IOUT*[.B19]))*DutyCCM*(1-DutyCCM) -> 0.0000225051440329218
B20: 210000 | C20: of:=((VIN)/(2*IOUT*[.B20]))*DutyCCM*(1-DutyCCM) -> 0.0000214334705075446
B21: 220000 | C21: of:=((VIN)/(2*IOUT*[.B21]))*DutyCCM*(1-DutyCCM) -> 0.0000204592218481107
B22: 230000 | C22: of:=((VIN)/(2*IOUT*[.B22]))*DutyCCM*(1-DutyCCM) -> 0.0000195696904634103
B23: 240000 | C23: of:=((VIN)/(2*IOUT*[.B23]))*DutyCCM*(1-DutyCCM) -> 0.0000187542866941015
B24: 250000 | C24: of:=((VIN)/(2*IOUT*[.B24]))*DutyCCM*(1-DutyCCM) -> 0.0000180041152263375
B25: 260000 | C25: of:=((VIN)/(2*IOUT*[.B25]))*DutyCCM*(1-DutyCCM) -> 0.0000173116492560937
B26: 270000 | C26: of:=((VIN)/(2*IOUT*[.B26]))*DutyCCM*(1-DutyCCM) -> 0.0000166704770614236
B27: 280000 | C27: of:=((VIN)/(2*IOUT*[.B27]))*DutyCCM*(1-DutyCCM) -> 0.0000160751028806584
B28: 290000 | C28: of:=((VIN)/(2*IOUT*[.B28]))*DutyCCM*(1-DutyCCM) -> 0.0000155207889882219
B29: 300000 | C29: of:=((VIN)/(2*IOUT*[.B29]))*DutyCCM*(1-DutyCCM) -> 0.0000150034293552812
B30: 310000 | C30: of:=((VIN)/(2*IOUT*[.B30]))*DutyCCM*(1-DutyCCM) -> 0.0000145194477631754
B31: 320000 | C31: of:=((VIN)/(2*IOUT*[.B31]))*DutyCCM*(1-DutyCCM) -> 0.0000140657150205761
B32: 330000 | C32: of:=((VIN)/(2*IOUT*[.B32]))*DutyCCM*(1-DutyCCM) -> 0.0000136394812320738
B33: 340000 | C33: of:=((VIN)/(2*IOUT*[.B33]))*DutyCCM*(1-DutyCCM) -> 0.0000132383200193658
B34: 350000 | C34: of:=((VIN)/(2*IOUT*[.B34]))*DutyCCM*(1-DutyCCM) -> 0.0000128600823045268
B35: 360000 | C35: of:=((VIN)/(2*IOUT*[.B35]))*DutyCCM*(1-DutyCCM) -> 0.0000125028577960677
B36: 370000 | C36: of:=((VIN)/(2*IOUT*[.B36]))*DutyCCM*(1-DutyCCM) -> 0.0000121649427204983
B37: 380000 | C37: of:=((VIN)/(2*IOUT*[.B37]))*DutyCCM*(1-DutyCCM) -> 0.0000118448126489062
B38: 390000 | C38: of:=((VIN)/(2*IOUT*[.B38]))*DutyCCM*(1-DutyCCM) -> 0.0000115410995040625
B39: 400000 | C39: of:=((VIN)/(2*IOUT*[.B39]))*DutyCCM*(1-DutyCCM) -> 0.0000112525720164609
B40: 410000 | C40: of:=((VIN)/(2*IOUT*[.B40]))*DutyCCM*(1-DutyCCM) -> 0.0000109781190404497
B41: 420000 | C41: of:=((VIN)/(2*IOUT*[.B41]))*DutyCCM*(1-DutyCCM) -> 0.0000107167352537723
B42: 430000 | C42: of:=((VIN)/(2*IOUT*[.B42]))*DutyCCM*(1-DutyCCM) -> 0.0000104675088525218
B43: 440000 | C43: of:=((VIN)/(2*IOUT*[.B43]))*DutyCCM*(1-DutyCCM) -> 0.0000102296109240554
B44: 450000 | C44: of:=((VIN)/(2*IOUT*[.B44]))*DutyCCM*(1-DutyCCM) -> 0.0000100022862368541
B45: 460000 | C45: of:=((VIN)/(2*IOUT*[.B45]))*DutyCCM*(1-DutyCCM) -> 0.00000978484523170514
B46: 470000 | C46: of:=((VIN)/(2*IOUT*[.B46]))*DutyCCM*(1-DutyCCM) -> 0.00000957665703528588
B47: 480000 | C47: of:=((VIN)/(2*IOUT*[.B47]))*DutyCCM*(1-DutyCCM) -> 0.00000937714334705076
B48: 490000 | C48: of:=((VIN)/(2*IOUT*[.B48]))*DutyCCM*(1-DutyCCM) -> 0.00000918577307466197
B49: 500000 | C49: of:=((VIN)/(2*IOUT*[.B49]))*DutyCCM*(1-DutyCCM) -> 0.00000900205761316873

Sheet: Duty Cycle & Currents
D1: Duty Cycle for Frequency Vs Inductance
D2: Inductance
D3: 0.00001 | E3: 0.000012 | F3: 0.000015 | G3: 0.000018 | H3: 0.000022 | I3: 0.000027 | J3: 0.000033 | K3: 0.000039 | L3: 0.000047 | M3: 0.000056 | N3: 0.000068 | O3: 0.000082
C4: 20000 | D4: of:=1/VIN*SQRT(2*[.D$3]*(VOUT-VIN)*[.$C4]*IOUT) -> 0.204939015319192 | E4: of:=1/VIN*SQRT(2*[.E$3]*(VOUT-VIN)*[.$C4]*IOUT) -> 0.224499443206436 | F4: of:=1/VIN*SQRT(2*[.F$3]*(VOUT-VIN)*[.$C4]*IOUT) -> 0.250998007960223 | G4: of:=1/VIN*SQRT(2*[.G$3]*(VOUT-VIN)*[.$C4]*IOUT) -> 0.27495454169735 | H4: of:=1/VIN*SQRT(2*[.H$3]*(VOUT-VIN)*[.$C4]*IOUT) -> 0.303973683071413 | I4: of:=1/VIN*SQRT(2*[.I$3]*(VOUT-VIN)*[.$C4]*IOUT) -> 0.336749164809655 | J4: of:=1/VIN*SQRT(2*[.J$3]*(VOUT-VIN)*[.$C4]*IOUT) -> 0.372290209379726 | K4: of:=1/VIN*SQRT(2*[.K$3]*(VOUT-VIN)*[.$C4]*IOUT) -> 0.404722126896961 | L4: of:=1/VIN*SQRT(2*[.L$3]*(VOUT-VIN)*[.$C4]*IOUT) -> 0.444297197830461 | M4: of:=1/VIN*SQRT(2*[.M$3]*(VOUT-VIN)*[.$C4]*IOUT) -> 0.484974226119286 | N4: of:=1/VIN*SQRT(2*[.N$3]*(VOUT-VIN)*[.$C4]*IOUT) -> 0.534415568635496 | O4: of:=1/VIN*SQRT(2*[.O$3]*(VOUT-VIN)*[.$C4]*IOUT) -> 0.586856030044848
C5: 30000 | D5: of:=1/VIN*SQRT(2*[.D$3]*(VOUT-VIN)*[.$C5]*IOUT) -> 0.250998007960223 | E5: of:=1/VIN*SQRT(2*[.E$3]*(VOUT-VIN)*[.$C5]*IOUT) -> 0.27495454169735 | F5: of:=1/VIN*SQRT(2*[.F$3]*(VOUT-VIN)*[.$C5]*IOUT) -> 0.307408522978788 | G5: of:=1/VIN*SQRT(2*[.G$3]*(VOUT-VIN)*[.$C5]*IOUT) -> 0.336749164809655 | H5: of:=1/VIN*SQRT(2*[.H$3]*(VOUT-VIN)*[.$C5]*IOUT) -> 0.372290209379726 | I5: of:=1/VIN*SQRT(2*[.I$3]*(VOUT-VIN)*[.$C5]*IOUT) -> 0.412431812546026 | J5: of:=1/VIN*SQRT(2*[.J$3]*(VOUT-VIN)*[.$C5]*IOUT) -> 0.45596052460712 | K5: of:=1/VIN*SQRT(2*[.K$3]*(VOUT-VIN)*[.$C5]*IOUT) -> 0.495681349255749 | L5: of:=1/VIN*SQRT(2*[.L$3]*(VOUT-VIN)*[.$C5]*IOUT) -> 0.544150714416512 | M5: of:=1/VIN*SQRT(2*[.M$3]*(VOUT-VIN)*[.$C5]*IOUT) -> 0.5939696961967 | N5: of:=1/VIN*SQRT(2*[.N$3]*(VOUT-VIN)*[.$C5]*IOUT) -> 0.654522726878143 | O5: of:=1/VIN*SQRT(2*[.O$3]*(VOUT-VIN)*[.$C5]*IOUT) -> 0.718748913042656
C6: 40000 | D6: of:=1/VIN*SQRT(2*[.D$3]*(VOUT-VIN)*[.$C6]*IOUT) -> 0.289827534923789 | E6: of:=1/VIN*SQRT(2*[.E$3]*(VOUT-VIN)*[.$C6]*IOUT) -> 0.317490157327751 | F6: of:=1/VIN*SQRT(2*[.F$3]*(VOUT-VIN)*[.$C6]*IOUT) -> 0.354964786985977 | G6: of:=1/VIN*SQRT(2*[.G$3]*(VOUT-VIN)*[.$C6]*IOUT) -> 0.388844441904472 | H6: of:=1/VIN*SQRT(2*[.H$3]*(VOUT-VIN)*[.$C6]*IOUT) -> 0.429883705204094 | I6: of:=1/VIN*SQRT(2*[.I$3]*(VOUT-VIN)*[.$C6]*IOUT) -> 0.476235235991626 | J6: of:=1/VIN*SQRT(2*[.J$3]*(VOUT-VIN)*[.$C6]*IOUT) -> 0.526497863243527 | K6: of:=1/VIN*SQRT(2*[.K$3]*(VOUT-VIN)*[.$C6]*IOUT) -> 0.572363520850167 | L6: of:=1/VIN*SQRT(2*[.L$3]*(VOUT-VIN)*[.$C6]*IOUT) -> 0.6283311228962 | M6: of:=1/VIN*SQRT(2*[.M$3]*(VOUT-VIN)*[.$C6]*IOUT) -> 0.68585712797929 | N6: of:=1/VIN*SQRT(2*[.N$3]*(VOUT-VIN)*[.$C6]*IOUT) -> 0.755777745107647 | O6: of:=1/VIN*SQRT(2*[.O$3]*(VOUT-VIN)*[.$C6]*IOUT) -> 0.829939756849857
B7: Frequency | C7: 50000 | D7: of:=1/VIN*SQRT(2*[.D$3]*(VOUT-VIN)*[.$C7]*IOUT) -> 0.324037034920393 | E7: of:=1/VIN*SQRT(2*[.E$3]*(VOUT-VIN)*[.$C7]*IOUT) -> 0.354964786985977 | F7: of:=1/VIN*SQRT(2*[.F$3]*(VOUT-VIN)*[.$C7]*IOUT) -> 0.396862696659689 | G7: of:=1/VIN*SQRT(2*[.G$3]*(VOUT-VIN)*[.$C7]*IOUT) -> 0.434741302385683 | H7: of:=1/VIN*SQRT(2*[.H$3]*(VOUT-VIN)*[.$C7]*IOUT) -> 0.480624593627917 | I7: of:=1/VIN*SQRT(2*[.I$3]*(VOUT-VIN)*[.$C7]*IOUT) -> 0.532447180478965 | J7: of:=1/VIN*SQRT(2*[.J$3]*(VOUT-VIN)*[.$C7]*IOUT) -> 0.588642506110458 | K7: of:=1/VIN*SQRT(2*[.K$3]*(VOUT-VIN)*[.$C7]*IOUT) -> 0.639921870231046 | L7: of:=1/VIN*SQRT(2*[.L$3]*(VOUT-VIN)*[.$C7]*IOUT) -> 0.702495551587339 | M7: of:=1/VIN*SQRT(2*[.M$3]*(VOUT-VIN)*[.$C7]*IOUT) -> 0.766811580507233 | N7: of:=1/VIN*SQRT(2*[.N$3]*(VOUT-VIN)*[.$C7]*IOUT) -> 0.844985206971104 | O7: of:=1/VIN*SQRT(2*[.O$3]*(VOUT-VIN)*[.$C7]*IOUT) -> 0.927900856772964
C8: 100000 | D8: of:=1/VIN*SQRT(2*[.D$3]*(VOUT-VIN)*[.$C8]*IOUT) -> 0.458257569495584 | E8: of:=1/VIN*SQRT(2*[.E$3]*(VOUT-VIN)*[.$C8]*IOUT) -> 0.501996015920445 | F8: of:=1/VIN*SQRT(2*[.F$3]*(VOUT-VIN)*[.$C8]*IOUT) -> 0.561248608016091 | G8: of:=1/VIN*SQRT(2*[.G$3]*(VOUT-VIN)*[.$C8]*IOUT) -> 0.614817045957576 | H8: of:=1/VIN*SQRT(2*[.H$3]*(VOUT-VIN)*[.$C8]*IOUT) -> 0.679705818718657 | I8: of:=1/VIN*SQRT(2*[.I$3]*(VOUT-VIN)*[.$C8]*IOUT) -> 0.752994023880668 | J8: of:=1/VIN*SQRT(2*[.J$3]*(VOUT-VIN)*[.$C8]*IOUT) -> 0.832466215530697 | K8: of:=1/VIN*SQRT(2*[.K$3]*(VOUT-VIN)*[.$C8]*IOUT) -> 0.904986187739901 | L8: of:=1/VIN*SQRT(2*[.L$3]*(VOUT-VIN)*[.$C8]*IOUT) -> 0.993478736561583 | M8: of:=1/VIN*SQRT(2*[.M$3]*(VOUT-VIN)*[.$C8]*IOUT) -> 1.08443533693808 | N8: of:=1/VIN*SQRT(2*[.N$3]*(VOUT-VIN)*[.$C8]*IOUT) -> 1.19498953970317 | O8: of:=1/VIN*SQRT(2*[.O$3]*(VOUT-VIN)*[.$C8]*IOUT) -> 1.31224997618594
C9: 150000 | D9: of:=1/VIN*SQRT(2*[.D$3]*(VOUT-VIN)*[.$C9]*IOUT) -> 0.561248608016091 | E9: of:=1/VIN*SQRT(2*[.E$3]*(VOUT-VIN)*[.$C9]*IOUT) -> 0.614817045957576 | F9: of:=1/VIN*SQRT(2*[.F$3]*(VOUT-VIN)*[.$C9]*IOUT) -> 0.687386354243376 | G9: of:=1/VIN*SQRT(2*[.G$3]*(VOUT-VIN)*[.$C9]*IOUT) -> 0.752994023880668 | H9: of:=1/VIN*SQRT(2*[.H$3]*(VOUT-VIN)*[.$C9]*IOUT) -> 0.832466215530696 | I9: of:=1/VIN*SQRT(2*[.I$3]*(VOUT-VIN)*[.$C9]*IOUT) -> 0.922225568936364 | J9: of:=1/VIN*SQRT(2*[.J$3]*(VOUT-VIN)*[.$C9]*IOUT) -> 1.01955872807799 | K9: of:=1/VIN*SQRT(2*[.K$3]*(VOUT-VIN)*[.$C9]*IOUT) -> 1.10837719211467 | L9: of:=1/VIN*SQRT(2*[.L$3]*(VOUT-VIN)*[.$C9]*IOUT) -> 1.21675798744039 | M9: of:=1/VIN*SQRT(2*[.M$3]*(VOUT-VIN)*[.$C9]*IOUT) -> 1.32815661727072 | N9: of:=1/VIN*SQRT(2*[.N$3]*(VOUT-VIN)*[.$C9]*IOUT) -> 1.46355731011806 | O9: of:=1/VIN*SQRT(2*[.O$3]*(VOUT-VIN)*[.$C9]*IOUT) -> 1.60717142831747
C10: 200000 | D10: of:=1/VIN*SQRT(2*[.D$3]*(VOUT-VIN)*[.$C10]*IOUT) -> 0.648074069840786 | E10: of:=1/VIN*SQRT(2*[.E$3]*(VOUT-VIN)*[.$C10]*IOUT) -> 0.709929573971954 | F10: of:=1/VIN*SQRT(2*[.F$3]*(VOUT-VIN)*[.$C10]*IOUT) -> 0.793725393319377 | G10: of:=1/VIN*SQRT(2*[.G$3]*(VOUT-VIN)*[.$C10]*IOUT) -> 0.869482604771366 | H10: of:=1/VIN*SQRT(2*[.H$3]*(VOUT-VIN)*[.$C10]*IOUT) -> 0.961249187255833 | I10: of:=1/VIN*SQRT(2*[.I$3]*(VOUT-VIN)*[.$C10]*IOUT) -> 1.06489436095793 | J10: of:=1/VIN*SQRT(2*[.J$3]*(VOUT-VIN)*[.$C10]*IOUT) -> 1.17728501222092 | K10: of:=1/VIN*SQRT(2*[.K$3]*(VOUT-VIN)*[.$C10]*IOUT) -> 1.27984374046209 | L10: of:=1/VIN*SQRT(2*[.L$3]*(VOUT-VIN)*[.$C10]*IOUT) -> 1.40499110317468 | M10: of:=1/VIN*SQRT(2*[.M$3]*(VOUT-VIN)*[.$C10]*IOUT) -> 1.53362316101447 | N10: of:=1/VIN*SQRT(2*[.N$3]*(VOUT-VIN)*[.$C10]*IOUT) -> 1.68997041394221 | O10: of:=1/VIN*SQRT(2*[.O$3]*(VOUT-VIN)*[.$C10]*IOUT) -> 1.85580171354593
C11: 250000 | D11: of:=1/VIN*SQRT(2*[.D$3]*(VOUT-VIN)*[.$C11]*IOUT) -> 0.724568837309472 | E11: of:=1/VIN*SQRT(2*[.E$3]*(VOUT-VIN)*[.$C11]*IOUT) -> 0.793725393319377 | F11: of:=1/VIN*SQRT(2*[.F$3]*(VOUT-VIN)*[.$C11]*IOUT) -> 0.887411967464942 | G11: of:=1/VIN*SQRT(2*[.G$3]*(VOUT-VIN)*[.$C11]*IOUT) -> 0.972111104761179 | H11: of:=1/VIN*SQRT(2*[.H$3]*(VOUT-VIN)*[.$C11]*IOUT) -> 1.07470926301023 | I11: of:=1/VIN*SQRT(2*[.I$3]*(VOUT-VIN)*[.$C11]*IOUT) -> 1.19058808997907 | J11: of:=1/VIN*SQRT(2*[.J$3]*(VOUT-VIN)*[.$C11]*IOUT) -> 1.31624465810882 | K11: of:=1/VIN*SQRT(2*[.K$3]*(VOUT-VIN)*[.$C11]*IOUT) -> 1.43090880212542 | L11: of:=1/VIN*SQRT(2*[.L$3]*(VOUT-VIN)*[.$C11]*IOUT) -> 1.5708278072405 | M11: of:=1/VIN*SQRT(2*[.M$3]*(VOUT-VIN)*[.$C11]*IOUT) -> 1.71464281994822 | N11: of:=1/VIN*SQRT(2*[.N$3]*(VOUT-VIN)*[.$C11]*IOUT) -> 1.88944436276912 | O11: of:=1/VIN*SQRT(2*[.O$3]*(VOUT-VIN)*[.$C11]*IOUT) -> 2.07484939212464
C12: 300000 | D12: of:=1/VIN*SQRT(2*[.D$3]*(VOUT-VIN)*[.$C12]*IOUT) -> 0.793725393319377 | E12: of:=1/VIN*SQRT(2*[.E$3]*(VOUT-VIN)*[.$C12]*IOUT) -> 0.869482604771366 | F12: of:=1/VIN*SQRT(2*[.F$3]*(VOUT-VIN)*[.$C12]*IOUT) -> 0.972111104761179 | G12: of:=1/VIN*SQRT(2*[.G$3]*(VOUT-VIN)*[.$C12]*IOUT) -> 1.06489436095793 | H12: of:=1/VIN*SQRT(2*[.H$3]*(VOUT-VIN)*[.$C12]*IOUT) -> 1.17728501222092 | I12: of:=1/VIN*SQRT(2*[.I$3]*(VOUT-VIN)*[.$C12]*IOUT) -> 1.30422390715705 | J12: of:=1/VIN*SQRT(2*[.J$3]*(VOUT-VIN)*[.$C12]*IOUT) -> 1.44187378088375 | K12: of:=1/VIN*SQRT(2*[.K$3]*(VOUT-VIN)*[.$C12]*IOUT) -> 1.56748205731358 | L12: of:=1/VIN*SQRT(2*[.L$3]*(VOUT-VIN)*[.$C12]*IOUT) -> 1.720755647964 | M12: of:=1/VIN*SQRT(2*[.M$3]*(VOUT-VIN)*[.$C12]*IOUT) -> 1.87829710109982 | N12: of:=1/VIN*SQRT(2*[.N$3]*(VOUT-VIN)*[.$C12]*IOUT) -> 2.06978259727924 | O12: of:=1/VIN*SQRT(2*[.O$3]*(VOUT-VIN)*[.$C12]*IOUT) -> 2.2728836309851
D15: Discharge Duty
D16: Inductance
D17: 0.00001 | E17: 0.000012 | F17: 0.000015 | G17: 0.000018 | H17: 0.000022 | I17: 0.000027 | J17: 0.000033 | K17: 0.000039 | L17: 0.000047 | M17: 0.000056 | N17: 0.000068 | O17: 0.000082
C18: 20000 | D18: of:=(VIN/(VOUT-VIN))*[.D4] -> 0.0058554004376912 | E18: of:=(VIN/(VOUT-VIN))*[.E4] -> 0.00641426980589819 | F18: of:=(VIN/(VOUT-VIN))*[.F4] -> 0.00717137165600636 | G18: of:=(VIN/(VOUT-VIN))*[.G4] -> 0.00785584404849573 | H18: of:=(VIN/(VOUT-VIN))*[.H4] -> 0.00868496237346895 | I18: of:=(VIN/(VOUT-VIN))*[.I4] -> 0.00962140470884728 | J18: of:=(VIN/(VOUT-VIN))*[.J4] -> 0.010636863125135 | K18: of:=(VIN/(VOUT-VIN))*[.K4] -> 0.0115634893399132 | L18: of:=(VIN/(VOUT-VIN))*[.L4] -> 0.0126942056522989 | M18: of:=(VIN/(VOUT-VIN))*[.M4] -> 0.013856406460551 | N18: of:=(VIN/(VOUT-VIN))*[.N4] -> 0.0152690162467284 | O18: of:=(VIN/(VOUT-VIN))*[.O4] -> 0.0167673151441385
C19: 30000 | D19: of:=(VIN/(VOUT-VIN))*[.D5] -> 0.00717137165600636 | E19: of:=(VIN/(VOUT-VIN))*[.E5] -> 0.00785584404849573 | F19: of:=(VIN/(VOUT-VIN))*[.F5] -> 0.0087831006565368 | G19: of:=(VIN/(VOUT-VIN))*[.G5] -> 0.00962140470884728 | H19: of:=(VIN/(VOUT-VIN))*[.H5] -> 0.010636863125135 | I19: of:=(VIN/(VOUT-VIN))*[.I5] -> 0.0117837660727436 | J19: of:=(VIN/(VOUT-VIN))*[.J5] -> 0.0130274435602034 | K19: of:=(VIN/(VOUT-VIN))*[.K5] -> 0.01416232426445 | L19: of:=(VIN/(VOUT-VIN))*[.L5] -> 0.0155471632690432 | M19: of:=(VIN/(VOUT-VIN))*[.M5] -> 0.0169705627484771 | N19: of:=(VIN/(VOUT-VIN))*[.N5] -> 0.0187006493393755 | O19: of:=(VIN/(VOUT-VIN))*[.O5] -> 0.0205356832297902
C20: 40000 | D20: of:=(VIN/(VOUT-VIN))*[.D6] -> 0.00828078671210825 | E20: of:=(VIN/(VOUT-VIN))*[.E6] -> 0.00907114735222145 | F20: of:=(VIN/(VOUT-VIN))*[.F6] -> 0.0101418510567422 | G20: of:=(VIN/(VOUT-VIN))*[.G6] -> 0.0111098411972706 | H20: of:=(VIN/(VOUT-VIN))*[.H6] -> 0.0122823915772598 | I20: of:=(VIN/(VOUT-VIN))*[.I6] -> 0.0136067210283322 | J20: of:=(VIN/(VOUT-VIN))*[.J6] -> 0.0150427960926722 | K20: of:=(VIN/(VOUT-VIN))*[.K6] -> 0.0163532434528619 | L20: of:=(VIN/(VOUT-VIN))*[.L6] -> 0.0179523177970343 | M20: of:=(VIN/(VOUT-VIN))*[.M6] -> 0.0195959179422654 | N20: of:=(VIN/(VOUT-VIN))*[.N6] -> 0.0215936498602185 | O20: of:=(VIN/(VOUT-VIN))*[.O6] -> 0.0237125644814245
B21: Frequency | C21: 50000 | D21: of:=(VIN/(VOUT-VIN))*[.D7] -> 0.00925820099772552 | E21: of:=(VIN/(VOUT-VIN))*[.E7] -> 0.0101418510567422 | F21: of:=(VIN/(VOUT-VIN))*[.F7] -> 0.0113389341902768 | G21: of:=(VIN/(VOUT-VIN))*[.G7] -> 0.0124211800681624 | H21: of:=(VIN/(VOUT-VIN))*[.H7] -> 0.0137321312465119 | I21: of:=(VIN/(VOUT-VIN))*[.I7] -> 0.0152127765851133 | J21: of:=(VIN/(VOUT-VIN))*[.J7] -> 0.0168183573174416 | K21: of:=(VIN/(VOUT-VIN))*[.K7] -> 0.0182834820066013 | L21: of:=(VIN/(VOUT-VIN))*[.L7] -> 0.020071301473924 | M21: of:=(VIN/(VOUT-VIN))*[.M7] -> 0.0219089023002066 | N21: of:=(VIN/(VOUT-VIN))*[.N7] -> 0.0241424344848887 | O21: of:=(VIN/(VOUT-VIN))*[.O7] -> 0.0265114530506561
C22: 100000 | D22: of:=(VIN/(VOUT-VIN))*[.D8] -> 0.0130930734141595 | E22: of:=(VIN/(VOUT-VIN))*[.E8] -> 0.0143427433120127 | F22: of:=(VIN/(VOUT-VIN))*[.F8] -> 0.0160356745147455 | G22: of:=(VIN/(VOUT-VIN))*[.G8] -> 0.0175662013130736 | H22: of:=(VIN/(VOUT-VIN))*[.H8] -> 0.0194201662491045 | I22: of:=(VIN/(VOUT-VIN))*[.I8] -> 0.0215141149680191 | J22: of:=(VIN/(VOUT-VIN))*[.J8] -> 0.0237847490151628 | K22: of:=(VIN/(VOUT-VIN))*[.K8] -> 0.02585674822114 | L22: of:=(VIN/(VOUT-VIN))*[.L8] -> 0.0283851067589024 | M22: of:=(VIN/(VOUT-VIN))*[.M8] -> 0.0309838667696593 | N22: of:=(VIN/(VOUT-VIN))*[.N8] -> 0.0341425582772335 | O22: of:=(VIN/(VOUT-VIN))*[.O8] -> 0.0374928564624554
C23: 150000 | D23: of:=(VIN/(VOUT-VIN))*[.D9] -> 0.0160356745147455 | E23: of:=(VIN/(VOUT-VIN))*[.E9] -> 0.0175662013130736 | F23: of:=(VIN/(VOUT-VIN))*[.F9] -> 0.0196396101212393 | G23: of:=(VIN/(VOUT-VIN))*[.G9] -> 0.0215141149680191 | H23: of:=(VIN/(VOUT-VIN))*[.H9] -> 0.0237847490151628 | I23: of:=(VIN/(VOUT-VIN))*[.I9] -> 0.0263493019696104 | J23: of:=(VIN/(VOUT-VIN))*[.J9] -> 0.0291302493736567 | K23: of:=(VIN/(VOUT-VIN))*[.K9] -> 0.0316679197747048 | L23: of:=(VIN/(VOUT-VIN))*[.L9] -> 0.0347645139268684 | M23: of:=(VIN/(VOUT-VIN))*[.M9] -> 0.0379473319220206 | N23: of:=(VIN/(VOUT-VIN))*[.N9] -> 0.0418159231462302 | O23: of:=(VIN/(VOUT-VIN))*[.O9] -> 0.0459191836662133
C24: 200000 | D24: of:=(VIN/(VOUT-VIN))*[.D10] -> 0.018516401995451 | E24: of:=(VIN/(VOUT-VIN))*[.E10] -> 0.0202837021134844 | F24: of:=(VIN/(VOUT-VIN))*[.F10] -> 0.0226778683805536 | G24: of:=(VIN/(VOUT-VIN))*[.G10] -> 0.0248423601363248 | H24: of:=(VIN/(VOUT-VIN))*[.H10] -> 0.0274642624930238 | I24: of:=(VIN/(VOUT-VIN))*[.I10] -> 0.0304255531702266 | J24: of:=(VIN/(VOUT-VIN))*[.J10] -> 0.0336367146348833 | K24: of:=(VIN/(VOUT-VIN))*[.K10] -> 0.0365669640132026 | L24: of:=(VIN/(VOUT-VIN))*[.L10] -> 0.040142602947848 | M24: of:=(VIN/(VOUT-VIN))*[.M10] -> 0.0438178046004133 | N24: of:=(VIN/(VOUT-VIN))*[.N10] -> 0.0482848689697774 | O24: of:=(VIN/(VOUT-VIN))*[.O10] -> 0.0530229061013122
C25: 250000 | D25: of:=(VIN/(VOUT-VIN))*[.D11] -> 0.0207019667802706 | E25: of:=(VIN/(VOUT-VIN))*[.E11] -> 0.0226778683805536 | F25: of:=(VIN/(VOUT-VIN))*[.F11] -> 0.0253546276418555 | G25: of:=(VIN/(VOUT-VIN))*[.G11] -> 0.0277746029931765 | H25: of:=(VIN/(VOUT-VIN))*[.H11] -> 0.0307059789431495 | I25: of:=(VIN/(VOUT-VIN))*[.I11] -> 0.0340168025708304 | J25: of:=(VIN/(VOUT-VIN))*[.J11] -> 0.0376069902316805 | K25: of:=(VIN/(VOUT-VIN))*[.K11] -> 0.0408831086321548 | L25: of:=(VIN/(VOUT-VIN))*[.L11] -> 0.0448807944925857 | M25: of:=(VIN/(VOUT-VIN))*[.M11] -> 0.0489897948556636 | N25: of:=(VIN/(VOUT-VIN))*[.N11] -> 0.0539841246505462 | O25: of:=(VIN/(VOUT-VIN))*[.O11] -> 0.0592814112035612
C26: 300000 | D26: of:=(VIN/(VOUT-VIN))*[.D12] -> 0.0226778683805536 | E26: of:=(VIN/(VOUT-VIN))*[.E12] -> 0.0248423601363248 | F26: of:=(VIN/(VOUT-VIN))*[.F12] -> 0.0277746029931765 | G26: of:=(VIN/(VOUT-VIN))*[.G12] -> 0.0304255531702266 | H26: of:=(VIN/(VOUT-VIN))*[.H12] -> 0.0336367146348833 | I26: of:=(VIN/(VOUT-VIN))*[.I12] -> 0.0372635402044871 | J26: of:=(VIN/(VOUT-VIN))*[.J12] -> 0.0411963937395357 | K26: of:=(VIN/(VOUT-VIN))*[.K12] -> 0.0447852016375307 | L26: of:=(VIN/(VOUT-VIN))*[.L12] -> 0.0491644470846857 | M26: of:=(VIN/(VOUT-VIN))*[.M12] -> 0.053665631459995 | N26: of:=(VIN/(VOUT-VIN))*[.N12] -> 0.0591366456365497 | O26: of:=(VIN/(VOUT-VIN))*[.O12] -> 0.0649395323138599
D29: Total Duty Cycle
D30: Inductance
D31: 0.00001 | E31: 0.000012 | F31: 0.000015 | G31: 0.000018 | H31: 0.000022 | I31: 0.000027 | J31: 0.000033 | K31: 0.000039 | L31: 0.000047 | M31: 0.000056 | N31: 0.000068 | O31: 0.000082
C32: 20000 | D32: of:=[.D4]+[.D18] -> 0.210794415756883 | E32: of:=[.E4]+[.E18] -> 0.230913713012335 | F32: of:=[.F4]+[.F18] -> 0.258169379616229 | G32: of:=[.G4]+[.G18] -> 0.282810385745846 | H32: of:=[.H4]+[.H18] -> 0.312658645444882 | I32: of:=[.I4]+[.I18] -> 0.346370569518502 | J32: of:=[.J4]+[.J18] -> 0.382927072504861 | K32: of:=[.K4]+[.K18] -> 0.416285616236874 | L32: of:=[.L4]+[.L18] -> 0.45699140348276 | M32: of:=[.M4]+[.M18] -> 0.498830632579837 | N32: of:=[.N4]+[.N18] -> 0.549684584882224 | O32: of:=[.O4]+[.O18] -> 0.603623345188987
C33: 30000 | D33: of:=[.D5]+[.D19] -> 0.258169379616229 | E33: of:=[.E5]+[.E19] -> 0.282810385745846 | F33: of:=[.F5]+[.F19] -> 0.316191623635325 | G33: of:=[.G5]+[.G19] -> 0.346370569518502 | H33: of:=[.H5]+[.H19] -> 0.382927072504861 | I33: of:=[.I5]+[.I19] -> 0.424215578618769 | J33: of:=[.J5]+[.J19] -> 0.468987968167323 | K33: of:=[.K5]+[.K19] -> 0.509843673520199 | L33: of:=[.L5]+[.L19] -> 0.559697877685555 | M33: of:=[.M5]+[.M19] -> 0.610940258945177 | N33: of:=[.N5]+[.N19] -> 0.673223376217518 | O33: of:=[.O5]+[.O19] -> 0.739284596272446
C34: 40000 | D34: of:=[.D6]+[.D20] -> 0.298108321635897 | E34: of:=[.E6]+[.E20] -> 0.326561304679972 | F34: of:=[.F6]+[.F20] -> 0.365106638042719 | G34: of:=[.G6]+[.G20] -> 0.399954283101742 | H34: of:=[.H6]+[.H20] -> 0.442166096781353 | I34: of:=[.I6]+[.I20] -> 0.489841957019958 | J34: of:=[.J6]+[.J20] -> 0.5415406593362 | K34: of:=[.K6]+[.K20] -> 0.588716764303029 | L34: of:=[.L6]+[.L20] -> 0.646283440693235 | M34: of:=[.M6]+[.M20] -> 0.705453045921555 | N34: of:=[.N6]+[.N20] -> 0.777371394967866 | O34: of:=[.O6]+[.O20] -> 0.853652321331282
B35: Frequency | C35: 50000 | D35: of:=[.D7]+[.D21] -> 0.333295235918119 | E35: of:=[.E7]+[.E21] -> 0.365106638042719 | F35: of:=[.F7]+[.F21] -> 0.408201630849965 | G35: of:=[.G7]+[.G21] -> 0.447162482453846 | H35: of:=[.H7]+[.H21] -> 0.494356724874428 | I35: of:=[.I7]+[.I21] -> 0.547659957064079 | J35: of:=[.J7]+[.J21] -> 0.605460863427899 | K35: of:=[.K7]+[.K21] -> 0.658205352237648 | L35: of:=[.L7]+[.L21] -> 0.722566853061263 | M35: of:=[.M7]+[.M21] -> 0.788720482807439 | N35: of:=[.N7]+[.N21] -> 0.869127641455993 | O35: of:=[.O7]+[.O21] -> 0.95441230982362
C36: 100000 | D36: of:=[.D8]+[.D22] -> 0.471350642909744 | E36: of:=[.E8]+[.E22] -> 0.516338759232458 | F36: of:=[.F8]+[.F22] -> 0.577284282530837 | G36: of:=[.G8]+[.G22] -> 0.63238324727065 | H36: of:=[.H8]+[.H22] -> 0.699125984967762 | I36: of:=[.I8]+[.I22] -> 0.774508138848687 | J36: of:=[.J8]+[.J22] -> 0.856250964545859 | K36: of:=[.K8]+[.K22] -> 0.930842935961041 | L36: of:=[.L8]+[.L22] -> 1.02186384332049 | M36: of:=[.M8]+[.M22] -> 1.11541920370774 | N36: of:=[.N8]+[.N22] -> 1.22913209798041 | O36: of:=[.O8]+[.O22] -> 1.3497428326484
C37: 150000 | D37: of:=[.D9]+[.D23] -> 0.577284282530837 | E37: of:=[.E9]+[.E23] -> 0.63238324727065 | F37: of:=[.F9]+[.F23] -> 0.707025964364615 | G37: of:=[.G9]+[.G23] -> 0.774508138848687 | H37: of:=[.H9]+[.H23] -> 0.856250964545859 | I37: of:=[.I9]+[.I23] -> 0.948574870905974 | J37: of:=[.J9]+[.J23] -> 1.04868897745164 | K37: of:=[.K9]+[.K23] -> 1.14004511188937 | L37: of:=[.L9]+[.L23] -> 1.25152250136726 | M37: of:=[.M9]+[.M23] -> 1.36610394919274 | N37: of:=[.N9]+[.N23] -> 1.50537323326429 | O37: of:=[.O9]+[.O23] -> 1.65309061198368
C38: 200000 | D38: of:=[.D10]+[.D24] -> 0.666590471836237 | E38: of:=[.E10]+[.E24] -> 0.730213276085438 | F38: of:=[.F10]+[.F24] -> 0.816403261699931 | G38: of:=[.G10]+[.G24] -> 0.894324964907691 | H38: of:=[.H10]+[.H24] -> 0.988713449748857 | I38: of:=[.I10]+[.I24] -> 1.09531991412816 | J38: of:=[.J10]+[.J24] -> 1.2109217268558 | K38: of:=[.K10]+[.K24] -> 1.3164107044753 | L38: of:=[.L10]+[.L24] -> 1.44513370612253 | M38: of:=[.M10]+[.M24] -> 1.57744096561488 | N38: of:=[.N10]+[.N24] -> 1.73825528291199 | O38: of:=[.O10]+[.O24] -> 1.90882461964724
C39: 250000 | D39: of:=[.D11]+[.D25] -> 0.745270804089743 | E39: of:=[.E11]+[.E25] -> 0.816403261699931 | F39: of:=[.F11]+[.F25] -> 0.912766595106798 | G39: of:=[.G11]+[.G25] -> 0.999885707754356 | H39: of:=[.H11]+[.H25] -> 1.10541524195338 | I39: of:=[.I11]+[.I25] -> 1.2246048925499 | J39: of:=[.J11]+[.J25] -> 1.3538516483405 | K39: of:=[.K11]+[.K25] -> 1.47179191075757 | L39: of:=[.L11]+[.L25] -> 1.61570860173309 | M39: of:=[.M11]+[.M25] -> 1.76363261480389 | N39: of:=[.N11]+[.N25] -> 1.94342848741966 | O39: of:=[.O11]+[.O25] -> 2.1341308033282
C40: 300000 | D40: of:=[.D12]+[.D26] -> 0.816403261699931 | E40: of:=[.E12]+[.E26] -> 0.894324964907691 | F40: of:=[.F12]+[.F26] -> 0.999885707754356 | G40: of:=[.G12]+[.G26] -> 1.09531991412816 | H40: of:=[.H12]+[.H26] -> 1.2109217268558 | I40: of:=[.I12]+[.I26] -> 1.34148744736154 | J40: of:=[.J12]+[.J26] -> 1.48307017462329 | K40: of:=[.K12]+[.K26] -> 1.61226725895111 | L40: of:=[.L12]+[.L26] -> 1.76992009504868 | M40: of:=[.M12]+[.M26] -> 1.93196273255982 | N40: of:=[.N12]+[.N26] -> 2.12891924291579 | O40: of:=[.O12]+[.O26] -> 2.33782316329896
D43: Peak Currents
D44: Peak Inductor Current
D45: Inductance
D46: 0.00001 | E46: 0.000012 | F46: 0.000015 | G46: 0.000018 | H46: 0.000022 | I46: 0.000027 | J46: 0.000033 | K46: 0.000039 | L46: 0.000047 | M46: 0.000056 | N46: 0.000068 | O46: 0.000082
C47: 20000 | D47: of:=(VIN*[.D32])/([.D$46]*[.$C47]) -> 5.26986039392208 | E47: of:=(VIN*[.E32])/([.E$46]*[.$C47]) -> 4.81070235442364 | F47: of:=(VIN*[.F32])/([.F$46]*[.$C47]) -> 4.30282299360382 | G47: of:=(VIN*[.G32])/([.G$46]*[.$C47]) -> 3.92792202424786 | H47: of:=(VIN*[.H32])/([.H$46]*[.$C47]) -> 3.55293915278275 | I47: of:=(VIN*[.I32])/([.I$46]*[.$C47]) -> 3.20713490294909 | J47: of:=(VIN*[.J32])/([.J$46]*[.$C47]) -> 2.90096267049137 | K47: of:=(VIN*[.K32])/([.K$46]*[.$C47]) -> 2.66849753997996 | L47: of:=(VIN*[.L32])/([.L$46]*[.$C47]) -> 2.43080533767426 | M47: of:=(VIN*[.M32])/([.M$46]*[.$C47]) -> 2.22692246687427 | N47: of:=(VIN*[.N32])/([.N$46]*[.$C47]) -> 2.02089920912582 | O47: of:=(VIN*[.O32])/([.O$46]*[.$C47]) -> 1.84031507679569
C48: 30000 | D48: of:=(VIN*[.D33])/([.D$46]*[.$C48]) -> 4.30282299360382 | E48: of:=(VIN*[.E33])/([.E$46]*[.$C48]) -> 3.92792202424786 | F48: of:=(VIN*[.F33])/([.F$46]*[.$C48]) -> 3.51324026261472 | G48: of:=(VIN*[.G33])/([.G$46]*[.$C48]) -> 3.20713490294909 | H48: of:=(VIN*[.H33])/([.H$46]*[.$C48]) -> 2.90096267049137 | I48: of:=(VIN*[.I33])/([.I$46]*[.$C48]) -> 2.61861468283191 | J48: of:=(VIN*[.J33])/([.J$46]*[.$C48]) -> 2.36862610185517 | K48: of:=(VIN*[.K33])/([.K$46]*[.$C48]) -> 2.17881911760769 | L48: of:=(VIN*[.L33])/([.L$46]*[.$C48]) -> 1.9847442471119 | M48: of:=(VIN*[.M33])/([.M$46]*[.$C48]) -> 1.81827458019398 | N48: of:=(VIN*[.N33])/([.N$46]*[.$C48]) -> 1.65005729465078 | O48: of:=(VIN*[.O33])/([.O$46]*[.$C48]) -> 1.50261096803343
C49: 40000 | D49: of:=(VIN*[.D34])/([.D$46]*[.$C49]) -> 3.72635402044871 | E49: of:=(VIN*[.E34])/([.E$46]*[.$C49]) -> 3.40168025708304 | F49: of:=(VIN*[.F34])/([.F$46]*[.$C49]) -> 3.04255531702266 | G49: of:=(VIN*[.G34])/([.G$46]*[.$C49]) -> 2.77746029931765 | H49: of:=(VIN*[.H34])/([.H$46]*[.$C49]) -> 2.51230736807587 | I49: of:=(VIN*[.I34])/([.I$46]*[.$C49]) -> 2.26778683805536 | J49: of:=(VIN*[.J34])/([.J$46]*[.$C49]) -> 2.05129037627348 | K49: of:=(VIN*[.K34])/([.K$46]*[.$C49]) -> 1.88691270609945 | L49: of:=(VIN*[.L34])/([.L$46]*[.$C49]) -> 1.71883893801392 | M49: of:=(VIN*[.M34])/([.M$46]*[.$C49]) -> 1.57467197750347 | N49: of:=(VIN*[.N34])/([.N$46]*[.$C49]) -> 1.4289915348674 | O49: of:=(VIN*[.O34])/([.O$46]*[.$C49]) -> 1.30129927032208
B50: Frequency | C50: 50000 | D50: of:=(VIN*[.D35])/([.D$46]*[.$C50]) -> 3.33295235918119 | E50: of:=(VIN*[.E35])/([.E$46]*[.$C50]) -> 3.04255531702266 | F50: of:=(VIN*[.F35])/([.F$46]*[.$C50]) -> 2.72134420566644 | G50: of:=(VIN*[.G35])/([.G$46]*[.$C50]) -> 2.48423601363248 | H50: of:=(VIN*[.H35])/([.H$46]*[.$C50]) -> 2.24707602215649 | I50: of:=(VIN*[.I35])/([.I$46]*[.$C50]) -> 2.02837021134844 | J50: of:=(VIN*[.J35])/([.J$46]*[.$C50]) -> 1.83472988917545 | K50: of:=(VIN*[.K35])/([.K$46]*[.$C50]) -> 1.68770603137858 | L50: of:=(VIN*[.L35])/([.L$46]*[.$C50]) -> 1.53737628310907 | M50: of:=(VIN*[.M35])/([.M$46]*[.$C50]) -> 1.40842943358471 | N50: of:=(VIN*[.N35])/([.N$46]*[.$C50]) -> 1.27812888449411 | O50: of:=(VIN*[.O35])/([.O$46]*[.$C50]) -> 1.16391745100441
C51: 100000 | D51: of:=(VIN*[.D36])/([.D$46]*[.$C51]) -> 2.35675321454872 | E51: of:=(VIN*[.E36])/([.E$46]*[.$C51]) -> 2.15141149680191 | F51: of:=(VIN*[.F36])/([.F$46]*[.$C51]) -> 1.92428094176946 | G51: of:=(VIN*[.G36])/([.G$46]*[.$C51]) -> 1.75662013130736 | H51: of:=(VIN*[.H36])/([.H$46]*[.$C51]) -> 1.58892269310855 | I51: of:=(VIN*[.I36])/([.I$46]*[.$C51]) -> 1.43427433120127 | J51: of:=(VIN*[.J36])/([.J$46]*[.$C51]) -> 1.29734994628161 | K51: of:=(VIN*[.K36])/([.K$46]*[.$C51]) -> 1.19338837943723 | L51: of:=(VIN*[.L36])/([.L$46]*[.$C51]) -> 1.08708919502179 | M51: of:=(VIN*[.M36])/([.M$46]*[.$C51]) -> 0.995910003310479 | N51: of:=(VIN*[.N36])/([.N$46]*[.$C51]) -> 0.903773601456181 | O51: of:=(VIN*[.O36])/([.O$46]*[.$C51]) -> 0.823013922346583
C52: 150000 | D52: of:=(VIN*[.D37])/([.D$46]*[.$C52]) -> 1.92428094176946 | E52: of:=(VIN*[.E37])/([.E$46]*[.$C52]) -> 1.75662013130736 | F52: of:=(VIN*[.F37])/([.F$46]*[.$C52]) -> 1.57116880969915 | G52: of:=(VIN*[.G37])/([.G$46]*[.$C52]) -> 1.43427433120127 | H52: of:=(VIN*[.H37])/([.H$46]*[.$C52]) -> 1.29734994628161 | I52: of:=(VIN*[.I37])/([.I$46]*[.$C52]) -> 1.17108008753824 | J52: of:=(VIN*[.J37])/([.J$46]*[.$C52]) -> 1.0592817954057 | K52: of:=(VIN*[.K37])/([.K$46]*[.$C52]) -> 0.97439753152938 | L52: of:=(VIN*[.L37])/([.L$46]*[.$C52]) -> 0.887604610898768 | M52: of:=(VIN*[.M37])/([.M$46]*[.$C52]) -> 0.813157112614726 | N52: of:=(VIN*[.N37])/([.N$46]*[.$C52]) -> 0.737928055521709 | O52: of:=(VIN*[.O37])/([.O$46]*[.$C52]) -> 0.671988053651902
C53: 200000 | D53: of:=(VIN*[.D38])/([.D$46]*[.$C53]) -> 1.66647617959059 | E53: of:=(VIN*[.E38])/([.E$46]*[.$C53]) -> 1.52127765851133 | F53: of:=(VIN*[.F38])/([.F$46]*[.$C53]) -> 1.36067210283322 | G53: of:=(VIN*[.G38])/([.G$46]*[.$C53]) -> 1.24211800681624 | H53: of:=(VIN*[.H38])/([.H$46]*[.$C53]) -> 1.12353801107825 | I53: of:=(VIN*[.I38])/([.I$46]*[.$C53]) -> 1.01418510567422 | J53: of:=(VIN*[.J38])/([.J$46]*[.$C53]) -> 0.917364944587726 | K53: of:=(VIN*[.K38])/([.K$46]*[.$C53]) -> 0.843853015689292 | L53: of:=(VIN*[.L38])/([.L$46]*[.$C53]) -> 0.768688141554535 | M53: of:=(VIN*[.M38])/([.M$46]*[.$C53]) -> 0.704214716792357 | N53: of:=(VIN*[.N38])/([.N$46]*[.$C53]) -> 0.639064442247054 | O53: of:=(VIN*[.O38])/([.O$46]*[.$C53]) -> 0.581958725502207
C54: 250000 | D54: of:=(VIN*[.D39])/([.D$46]*[.$C54]) -> 1.49054160817949 | E54: of:=(VIN*[.E39])/([.E$46]*[.$C54]) -> 1.36067210283322 | F54: of:=(VIN*[.F39])/([.F$46]*[.$C54]) -> 1.21702212680906 | G54: of:=(VIN*[.G39])/([.G$46]*[.$C54]) -> 1.11098411972706 | H54: of:=(VIN*[.H39])/([.H$46]*[.$C54]) -> 1.00492294723035 | I54: of:=(VIN*[.I39])/([.I$46]*[.$C54]) -> 0.907114735222145 | J54: of:=(VIN*[.J39])/([.J$46]*[.$C54]) -> 0.820516150509393 | K54: of:=(VIN*[.K39])/([.K$46]*[.$C54]) -> 0.754765082439781 | L54: of:=(VIN*[.L39])/([.L$46]*[.$C54]) -> 0.687535575205569 | M54: of:=(VIN*[.M39])/([.M$46]*[.$C54]) -> 0.629868791001389 | N54: of:=(VIN*[.N39])/([.N$46]*[.$C54]) -> 0.57159661394696 | O54: of:=(VIN*[.O39])/([.O$46]*[.$C54]) -> 0.52051970812883
C55: 300000 | D55: of:=(VIN*[.D40])/([.D$46]*[.$C55]) -> 1.36067210283322 | E55: of:=(VIN*[.E40])/([.E$46]*[.$C55]) -> 1.24211800681624 | F55: of:=(VIN*[.F40])/([.F$46]*[.$C55]) -> 1.11098411972706 | G55: of:=(VIN*[.G40])/([.G$46]*[.$C55]) -> 1.01418510567422 | H55: of:=(VIN*[.H40])/([.H$46]*[.$C55]) -> 0.917364944587726 | I55: of:=(VIN*[.I40])/([.I$46]*[.$C55]) -> 0.828078671210825 | J55: of:=(VIN*[.J40])/([.J$46]*[.$C55]) -> 0.749025340718831 | K55: of:=(VIN*[.K40])/([.K$46]*[.$C55]) -> 0.689003102115858 | L55: of:=(VIN*[.L40])/([.L$46]*[.$C55]) -> 0.627631239378966 | M55: of:=(VIN*[.M40])/([.M$46]*[.$C55]) -> 0.574988908499946 | N55: of:=(VIN*[.N40])/([.N$46]*[.$C55]) -> 0.521793932087204 | O55: of:=(VIN*[.O40])/([.O$46]*[.$C55]) -> 0.475167309613609
S57: FET Conduction Losses | V57: Selected Switch | W57: IPL65R070C7 | X57: RDS On | Y57: of:=VLOOKUP([.W57];[$Components.B4:$Components.H21];2;FALSE()) -> 0.07
D58: RMS Current Switch/Inductor Rise | S58: Inductance
D59: 0.00001 | E59: 0.000012 | F59: 0.000015 | G59: 0.000018 | H59: 0.000022 | I59: 0.000027 | J59: 0.000033 | K59: 0.000039 | L59: 0.000047 | M59: 0.000056 | N59: 0.000068 | O59: 0.000082 | S59: 0.00001 | T59: 0.000012 | U59: 0.000015 | V59: 0.000018 | W59: 0.000022 | X59: 0.000027 | Y59: 0.000033 | Z59: 0.000039 | AA59: 0.000047 | AB59: 0.000056 | AC59: 0.000068 | AD59: 0.000082
C60: 20000 | D60: of:=[.D47]*SQRT([.D4]/3) -> 1.37737058986024 | E60: of:=[.E47]*SQRT([.E4]/3) -> 1.31599880227624 | F60: of:=[.F47]*SQRT([.F4]/3) -> 1.24459482471099 | G60: of:=[.G47]*SQRT([.G4]/3) -> 1.18913915448497 | H60: of:=[.H47]*SQRT([.H4]/3) -> 1.1309545061592 | I60: of:=[.I47]*SQRT([.I4]/3) -> 1.07450852256354 | J60: of:=[.J47]*SQRT([.J4]/3) -> 1.02193275775703 | K60: of:=[.K47]*SQRT([.K4]/3) -> 0.980132192305092 | L60: of:=[.L47]*SQRT([.L4]/3) -> 0.935462410555727 | M60: of:=[.M47]*SQRT([.M4]/3) -> 0.89537259734411 | N60: of:=[.N47]*SQRT([.N4]/3) -> 0.852950007494752 | O60: of:=[.O47]*SQRT([.O4]/3) -> 0.813949278300834 | R60: 20000 | S60: of:=[.D60]^2*[.$Y$57] -> 0.132800481926836 | T60: of:=[.E60]^2*[.$Y$57] -> 0.121229699331476 | U60: of:=[.F60]^2*[.$Y$57] -> 0.108431139438816 | V60: of:=[.G60]^2*[.$Y$57] -> 0.0989836350110462 | W60: of:=[.H60]^2*[.$Y$57] -> 0.0895340666501254 | X60: of:=[.I60]^2*[.$Y$57] -> 0.0808197995543172 | Y60: of:=[.J60]^2*[.$Y$57] -> 0.0731042592963825 | Z60: of:=[.K60]^2*[.$Y$57] -> 0.0672461380074951 | AA60: of:=[.L60]^2*[.$Y$57] -> 0.0612562945093913 | AB60: of:=[.M60]^2*[.$Y$57] -> 0.0561184461652317 | AC60: of:=[.N60]^2*[.$Y$57] -> 0.0509266600699708 | AD60: of:=[.O60]^2*[.$Y$57] -> 0.0463759399352514
C61: 30000 | D61: of:=[.D48]*SQRT([.D5]/3) -> 1.24459482471099 | E61: of:=[.E48]*SQRT([.E5]/3) -> 1.18913915448497 | F61: of:=[.F48]*SQRT([.F5]/3) -> 1.12461837729129 | G61: of:=[.G48]*SQRT([.G5]/3) -> 1.07450852256354 | H61: of:=[.H48]*SQRT([.H5]/3) -> 1.02193275775703 | I61: of:=[.I48]*SQRT([.I5]/3) -> 0.970928053884265 | J61: of:=[.J48]*SQRT([.J5]/3) -> 0.923420487463788 | K61: of:=[.K48]*SQRT([.K5]/3) -> 0.885649412769391 | L61: of:=[.L48]*SQRT([.L5]/3) -> 0.84528570847985 | M61: of:=[.M48]*SQRT([.M5]/3) -> 0.809060472937489 | N61: of:=[.N48]*SQRT([.N5]/3) -> 0.77072733575129 | O61: of:=[.O48]*SQRT([.O5]/3) -> 0.735486198709421 | R61: 30000 | S61: of:=[.D61]^2*[.$Y$57] -> 0.108431139438816 | T61: of:=[.E61]^2*[.$Y$57] -> 0.0989836350110462 | U61: of:=[.F61]^2*[.$Y$57] -> 0.088533654617891 | V61: of:=[.G61]^2*[.$Y$57] -> 0.0808197995543171 | W61: of:=[.H61]^2*[.$Y$57] -> 0.0731042592963825 | X61: of:=[.I61]^2*[.$Y$57] -> 0.0659890900073641 | Y61: of:=[.J61]^2*[.$Y$57] -> 0.0596893777667503 | Z61: of:=[.K61]^2*[.$Y$57] -> 0.0549062417637138 | AA61: of:=[.L61]^2*[.$Y$57] -> 0.0500155550272198 | AB61: of:=[.M61]^2*[.$Y$57] -> 0.0458205194208883 | AC61: of:=[.N61]^2*[.$Y$57] -> 0.0415814438251997 | AD61: of:=[.O61]^2*[.$Y$57] -> 0.0378657963944424
C62: 40000 | D62: of:=[.D49]*SQRT([.D6]/3) -> 1.15822599148937 | E62: of:=[.E49]*SQRT([.E6]/3) -> 1.10661867531228 | F62: of:=[.F49]*SQRT([.F6]/3) -> 1.0465753265428 | G62: of:=[.G49]*SQRT([.G6]/3) -> 0.999942852244245 | H62: of:=[.H49]*SQRT([.H6]/3) -> 0.951015590044303 | I62: of:=[.I49]*SQRT([.I6]/3) -> 0.903550364783243 | J62: of:=[.J49]*SQRT([.J6]/3) -> 0.859339592628231 | K62: of:=[.K49]*SQRT([.K6]/3) -> 0.824189646984117 | L62: of:=[.L49]*SQRT([.L6]/3) -> 0.78662698764091 | M62: of:=[.M49]*SQRT([.M6]/3) -> 0.75291560742307 | N62: of:=[.N49]*SQRT([.N6]/3) -> 0.717242603692965 | O62: of:=[.O49]*SQRT([.O6]/3) -> 0.68444703032152 | R62: 40000 | S62: of:=[.D62]^2*[.$Y$57] -> 0.0939041213153076 | T62: of:=[.E62]^2*[.$Y$57] -> 0.0857223424784928 | U62: of:=[.F62]^2*[.$Y$57] -> 0.0766723939889711 | V62: of:=[.G62]^2*[.$Y$57] -> 0.0699919995428049 | W62: of:=[.H62]^2*[.$Y$57] -> 0.063310145675512 | X62: of:=[.I62]^2*[.$Y$57] -> 0.0571482283189952 | Y62: of:=[.J62]^2*[.$Y$57] -> 0.0516925174820918 | Z62: of:=[.K62]^2*[.$Y$57] -> 0.0475502001937062 | AA62: of:=[.L62]^2*[.$Y$57] -> 0.0433147412379509 | AB62: of:=[.M62]^2*[.$Y$57] -> 0.0396817338330875 | AC62: of:=[.N62]^2*[.$Y$57] -> 0.0360105866786585 | AD62: of:=[.O62]^2*[.$Y$57] -> 0.0327927416121163
B63: Frequency | C63: 50000 | D63: of:=[.D50]*SQRT([.D7]/3) -> 1.09538251278046 | E63: of:=[.E50]*SQRT([.E7]/3) -> 1.0465753265428 | F63: of:=[.F50]*SQRT([.F7]/3) -> 0.989789833267607 | G63: of:=[.G50]*SQRT([.G7]/3) -> 0.945687561992697 | H63: of:=[.H50]*SQRT([.H7]/3) -> 0.899415014315604 | I63: of:=[.I50]*SQRT([.I7]/3) -> 0.85452517580551 | J63: of:=[.J50]*SQRT([.J7]/3) -> 0.812713209012357 | K63: of:=[.K50]*SQRT([.K7]/3) -> 0.779470442862518 | L63: of:=[.L50]*SQRT([.L7]/3) -> 0.743945872976835 | M63: of:=[.M50]*SQRT([.M7]/3) -> 0.712063618007897 | N63: of:=[.N50]*SQRT([.N7]/3) -> 0.678326174062212 | O63: of:=[.O50]*SQRT([.O7]/3) -> 0.64731003573372 | Q63: Frequency | R63: 50000 | S63: of:=[.D63]^2*[.$Y$57] -> 0.0839903994513659 | T63: of:=[.E63]^2*[.$Y$57] -> 0.0766723939889711 | U63: of:=[.F63]^2*[.$Y$57] -> 0.0685778739827942 | V63: of:=[.G63]^2*[.$Y$57] -> 0.0626027475435384 | W63: of:=[.H63]^2*[.$Y$57] -> 0.0566263157583437 | X63: of:=[.I63]^2*[.$Y$57] -> 0.0511149293259807 | Y63: of:=[.J63]^2*[.$Y$57] -> 0.0462351932072214 | Z63: of:=[.K63]^2*[.$Y$57] -> 0.0425301919907403 | AA63: of:=[.L63]^2*[.$Y$57] -> 0.0387418823343486 | AB63: of:=[.M63]^2*[.$Y$57] -> 0.0354924217263348 | AC63: of:=[.N63]^2*[.$Y$57] -> 0.0322088478892515 | AD63: of:=[.O63]^2*[.$Y$57] -> 0.0293307197653113
C64: 100000 | D64: of:=[.D51]*SQRT([.D8]/3) -> 0.921103228328692 | E64: of:=[.E51]*SQRT([.E8]/3) -> 0.880061440382822 | F64: of:=[.F51]*SQRT([.F8]/3) -> 0.832310722649302 | G64: of:=[.G51]*SQRT([.G8]/3) -> 0.795225280829684 | H64: of:=[.H51]*SQRT([.H8]/3) -> 0.756314861363359 | I64: of:=[.I51]*SQRT([.I8]/3) -> 0.718567157078904 | J64: of:=[.J51]*SQRT([.J8]/3) -> 0.683407624087834 | K64: of:=[.K51]*SQRT([.K8]/3) -> 0.655453901199317 | L64: of:=[.L51]*SQRT([.L8]/3) -> 0.625581417729016 | M64: of:=[.M51]*SQRT([.M8]/3) -> 0.598771743815431 | N64: of:=[.N51]*SQRT([.N8]/3) -> 0.570402048141682 | O64: of:=[.O51]*SQRT([.O8]/3) -> 0.544320688606239 | R64: 100000 | S64: of:=[.D64]^2*[.$Y$57] -> 0.0593901810066277 | T64: of:=[.E64]^2*[.$Y$57] -> 0.0542155697194081 | U64: of:=[.F64]^2*[.$Y$57] -> 0.0484918797325903 | V64: of:=[.G64]^2*[.$Y$57] -> 0.0442668273089455 | W64: of:=[.H64]^2*[.$Y$57] -> 0.0400408518663354 | X64: of:=[.I64]^2*[.$Y$57] -> 0.0361437131462721 | Y64: of:=[.J64]^2*[.$Y$57] -> 0.0326932186462965 | Z64: of:=[.K64]^2*[.$Y$57] -> 0.0300733871618183 | AA64: of:=[.L64]^2*[.$Y$57] -> 0.0273946477145492 | AB64: of:=[.M64]^2*[.$Y$57] -> 0.0250969320834241 | AC64: of:=[.N64]^2*[.$Y$57] -> 0.0227750947566958 | AD64: of:=[.O64]^2*[.$Y$57] -> 0.0207399508431339
C65: 150000 | D65: of:=[.D52]*SQRT([.D9]/3) -> 0.832310722649302 | E65: of:=[.E52]*SQRT([.E9]/3) -> 0.795225280829684 | F65: of:=[.F52]*SQRT([.F9]/3) -> 0.752077636611868 | G65: of:=[.G52]*SQRT([.G9]/3) -> 0.718567157078904 | H65: of:=[.H52]*SQRT([.H9]/3) -> 0.683407624087834 | I65: of:=[.I52]*SQRT([.I9]/3) -> 0.649298722864728 | J65: of:=[.J52]*SQRT([.J9]/3) -> 0.61752849840801 | K65: of:=[.K52]*SQRT([.K9]/3) -> 0.592269458397592 | L65: of:=[.L52]*SQRT([.L9]/3) -> 0.565276622481026 | M65: of:=[.M52]*SQRT([.M9]/3) -> 0.541051347416584 | N65: of:=[.N52]*SQRT([.N9]/3) -> 0.515416433563983 | O65: of:=[.O52]*SQRT([.O9]/3) -> 0.491849264830888 | R65: 150000 | S65: of:=[.D65]^2*[.$Y$57] -> 0.0484918797325903 | T65: of:=[.E65]^2*[.$Y$57] -> 0.0442668273089455 | U65: of:=[.F65]^2*[.$Y$57] -> 0.0395934540044185 | V65: of:=[.G65]^2*[.$Y$57] -> 0.0361437131462721 | W65: of:=[.H65]^2*[.$Y$57] -> 0.0326932186462965 | X65: of:=[.I65]^2*[.$Y$57] -> 0.0295112182059636 | Y65: of:=[.J65]^2*[.$Y$57] -> 0.0266939012442236 | Z65: of:=[.K65]^2*[.$Y$57] -> 0.0245548177945404 | AA65: of:=[.L65]^2*[.$Y$57] -> 0.022367636194649 | AB65: of:=[.M65]^2*[.$Y$57] -> 0.0204915592378911 | AC65: of:=[.N65]^2*[.$Y$57] -> 0.0185957869991471 | AD65: of:=[.O65]^2*[.$Y$57] -> 0.0169340989520279
C66: 200000 | D66: of:=[.D53]*SQRT([.D10]/3) -> 0.774552402780221 | E66: of:=[.E53]*SQRT([.E10]/3) -> 0.740040510420936 | F66: of:=[.F53]*SQRT([.F10]/3) -> 0.699887103053027 | G66: of:=[.G53]*SQRT([.G10]/3) -> 0.66870208796881 | H66: of:=[.H53]*SQRT([.H10]/3) -> 0.635982455723559 | I66: of:=[.I53]*SQRT([.I10]/3) -> 0.604240546506703 | J66: of:=[.J53]*SQRT([.J10]/3) -> 0.574675021252517 | K66: of:=[.K53]*SQRT([.K10]/3) -> 0.551168835882568 | L66: of:=[.L53]*SQRT([.L10]/3) -> 0.526049171617666 | M66: of:=[.M53]*SQRT([.M10]/3) -> 0.503505012929612 | N66: of:=[.N53]*SQRT([.N10]/3) -> 0.479649037535717 | O66: of:=[.O53]*SQRT([.O10]/3) -> 0.45771731579742 | R66: 200000 | S66: of:=[.D66]^2*[.$Y$57] -> 0.041995199725683 | T66: of:=[.E66]^2*[.$Y$57] -> 0.0383361969944855 | U66: of:=[.F66]^2*[.$Y$57] -> 0.0342889369913971 | V66: of:=[.G66]^2*[.$Y$57] -> 0.0313013737717692 | W66: of:=[.H66]^2*[.$Y$57] -> 0.0283131578791718 | X66: of:=[.I66]^2*[.$Y$57] -> 0.0255574646629903 | Y66: of:=[.J66]^2*[.$Y$57] -> 0.0231175966036107 | Z66: of:=[.K66]^2*[.$Y$57] -> 0.0212650959953702 | AA66: of:=[.L66]^2*[.$Y$57] -> 0.0193709411671743 | AB66: of:=[.M66]^2*[.$Y$57] -> 0.0177462108631674 | AC66: of:=[.N66]^2*[.$Y$57] -> 0.0161044239446258 | AD66: of:=[.O66]^2*[.$Y$57] -> 0.0146653598826556
C67: 250000 | D67: of:=[.D54]*SQRT([.D11]/3) -> 0.732526435662642 | E67: of:=[.E54]*SQRT([.E11]/3) -> 0.699887103053027 | F67: of:=[.F54]*SQRT([.F11]/3) -> 0.661912354961941 | G67: of:=[.G54]*SQRT([.G11]/3) -> 0.632419388619405 | H67: of:=[.H54]*SQRT([.H11]/3) -> 0.60147507097379 | I67: of:=[.I54]*SQRT([.I11]/3) -> 0.571455426678208 | J67: of:=[.J54]*SQRT([.J11]/3) -> 0.54349407925329 | K67: of:=[.K54]*SQRT([.K11]/3) -> 0.521263301679987 | L67: of:=[.L54]*SQRT([.L11]/3) -> 0.497506589980479 | M67: of:=[.M54]*SQRT([.M11]/3) -> 0.476185641069216 | N67: of:=[.N54]*SQRT([.N11]/3) -> 0.453624052515853 | O67: of:=[.O54]*SQRT([.O11]/3) -> 0.432882310710866 | R67: 250000 | S67: of:=[.D67]^2*[.$Y$57] -> 0.037561648526123 | T67: of:=[.E67]^2*[.$Y$57] -> 0.0342889369913971 | U67: of:=[.F67]^2*[.$Y$57] -> 0.0306689575955884 | V67: of:=[.G67]^2*[.$Y$57] -> 0.027996799817122 | W67: of:=[.H67]^2*[.$Y$57] -> 0.0253240582702048 | X67: of:=[.I67]^2*[.$Y$57] -> 0.0228592913275981 | Y67: of:=[.J67]^2*[.$Y$57] -> 0.0206770069928367 | Z67: of:=[.K67]^2*[.$Y$57] -> 0.0190200800774825 | AA67: of:=[.L67]^2*[.$Y$57] -> 0.0173258964951803 | AB67: of:=[.M67]^2*[.$Y$57] -> 0.015872693533235 | AC67: of:=[.N67]^2*[.$Y$57] -> 0.0144042346714634 | AD67: of:=[.O67]^2*[.$Y$57] -> 0.0131170966448465
C68: 300000 | D68: of:=[.D55]*SQRT([.D12]/3) -> 0.699887103053027 | E68: of:=[.E55]*SQRT([.E12]/3) -> 0.66870208796881 | F68: of:=[.F55]*SQRT([.F12]/3) -> 0.632419388619405 | G68: of:=[.G55]*SQRT([.G12]/3) -> 0.604240546506703 | H68: of:=[.H55]*SQRT([.H12]/3) -> 0.574675021252517 | I68: of:=[.I55]*SQRT([.I12]/3) -> 0.545992968485765 | J68: of:=[.J55]*SQRT([.J12]/3) -> 0.519277500628305 | K68: of:=[.K55]*SQRT([.K12]/3) -> 0.498037264430794 | L68: of:=[.L55]*SQRT([.L12]/3) -> 0.475339085471022 | M68: of:=[.M55]*SQRT([.M12]/3) -> 0.454968138510798 | N68: of:=[.N55]*SQRT([.N12]/3) -> 0.433411831346807 | O68: of:=[.O55]*SQRT([.O12]/3) -> 0.413594283641468 | R68: 300000 | S68: of:=[.D68]^2*[.$Y$57] -> 0.0342889369913971 | T68: of:=[.E68]^2*[.$Y$57] -> 0.0313013737717692 | U68: of:=[.F68]^2*[.$Y$57] -> 0.027996799817122 | V68: of:=[.G68]^2*[.$Y$57] -> 0.0255574646629903 | W68: of:=[.H68]^2*[.$Y$57] -> 0.0231175966036107 | X68: of:=[.I68]^2*[.$Y$57] -> 0.0208675825145128 | Y68: of:=[.J68]^2*[.$Y$57] -> 0.0188754385861145 | Z68: of:=[.K68]^2*[.$Y$57] -> 0.0173628781733196 | AA68: of:=[.L68]^2*[.$Y$57] -> 0.0158163072323499 | AB68: of:=[.M68]^2*[.$Y$57] -> 0.0144897204941986 | AC68: of:=[.N68]^2*[.$Y$57] -> 0.0131492070885975 | AD68: of:=[.O68]^2*[.$Y$57] -> 0.011974216202263
V70: C_OSS | W70: VG_Typ | X70: VG_Th | Y70: Q_G | Z70: R_G
S71: FET Switching Losses | V71: of:=VLOOKUP([.$W$57];[Components.$B$4:.$H$21];3;FALSE()) -> 0.000000000048 | W71: of:=VLOOKUP([.$W$57];[Components.$B$4:.$H$21];4;FALSE()) -> 12 | X71: of:=VLOOKUP([.$W$57];[Components.$B$4:.$H$21];5;FALSE()) -> 3.5 | Y71: of:=VLOOKUP([.$W$57];[Components.$B$4:.$H$21];6;FALSE()) -> 0.000000064 | Z71: of:=VLOOKUP([.$W$57];[Components.$B$4:.$H$21];7;FALSE()) -> 0.85
S72: Inductance
S73: 0.00001 | T73: 0.000012 | U73: 0.000015 | V73: 0.000018 | W73: 0.000022 | X73: 0.000027 | Y73: 0.000033 | Z73: 0.000039 | AA73: 0.000047 | AB73: 0.000056 | AC73: 0.000068 | AD73: 0.000082
R74: 20000 | S74: of:=[.$R74]*((COSS*(VOUT)^2)+VOUT*(IOUT/(1-[.D32]))*((QG*RG)/(VG-VGTH))) -> 0.0315419087108607 | T74: of:=[.$R74]*((COSS*(VOUT)^2)+VOUT*(IOUT/(1-[.E32]))*((QG*RG)/(VG-VGTH))) -> 0.0315533644027299 | U74: of:=[.$R74]*((COSS*(VOUT)^2)+VOUT*(IOUT/(1-[.F32]))*((QG*RG)/(VG-VGTH))) -> 0.0315698745413087 | V74: of:=[.$R74]*((COSS*(VOUT)^2)+VOUT*(IOUT/(1-[.G32]))*((QG*RG)/(VG-VGTH))) -> 0.031585880932366 | W74: of:=[.$R74]*((COSS*(VOUT)^2)+VOUT*(IOUT/(1-[.H32]))*((QG*RG)/(VG-VGTH))) -> 0.0316068069353163 | X74: of:=[.$R74]*((COSS*(VOUT)^2)+VOUT*(IOUT/(1-[.I32]))*((QG*RG)/(VG-VGTH))) -> 0.0316327399616407 | Y74: of:=[.$R74]*((COSS*(VOUT)^2)+VOUT*(IOUT/(1-[.J32]))*((QG*RG)/(VG-VGTH))) -> 0.0316640634618713 | Z74: of:=[.$R74]*((COSS*(VOUT)^2)+VOUT*(IOUT/(1-[.K32]))*((QG*RG)/(VG-VGTH))) -> 0.0316960703851291 | AA74: of:=[.$R74]*((COSS*(VOUT)^2)+VOUT*(IOUT/(1-[.L32]))*((QG*RG)/(VG-VGTH))) -> 0.0317404540123612 | AB74: of:=[.$R74]*((COSS*(VOUT)^2)+VOUT*(IOUT/(1-[.M32]))*((QG*RG)/(VG-VGTH))) -> 0.0317935872383003 | AC74: of:=[.$R74]*((COSS*(VOUT)^2)+VOUT*(IOUT/(1-[.N32]))*((QG*RG)/(VG-VGTH))) -> 0.0318714620685806 | AD74: of:=[.$R74]*((COSS*(VOUT)^2)+VOUT*(IOUT/(1-[.O32]))*((QG*RG)/(VG-VGTH))) -> 0.0319758979682716
R75: 30000 | S75: of:=[.$R75]*((COSS*(VOUT)^2)+VOUT*(IOUT/(1-[.D33]))*((QG*RG)/(VG-VGTH))) -> 0.047354811811963 | T75: of:=[.$R75]*((COSS*(VOUT)^2)+VOUT*(IOUT/(1-[.E33]))*((QG*RG)/(VG-VGTH))) -> 0.047378821398549 | U75: of:=[.$R75]*((COSS*(VOUT)^2)+VOUT*(IOUT/(1-[.F33]))*((QG*RG)/(VG-VGTH))) -> 0.0474141071216998 | V75: of:=[.$R75]*((COSS*(VOUT)^2)+VOUT*(IOUT/(1-[.G33]))*((QG*RG)/(VG-VGTH))) -> 0.047449109942461 | W75: of:=[.$R75]*((COSS*(VOUT)^2)+VOUT*(IOUT/(1-[.H33]))*((QG*RG)/(VG-VGTH))) -> 0.047496095192807 | X75: of:=[.$R75]*((COSS*(VOUT)^2)+VOUT*(IOUT/(1-[.I33]))*((QG*RG)/(VG-VGTH))) -> 0.0475563369677082 | Y75: of:=[.$R75]*((COSS*(VOUT)^2)+VOUT*(IOUT/(1-[.J33]))*((QG*RG)/(VG-VGTH))) -> 0.0476322490657902 | Z75: of:=[.$R75]*((COSS*(VOUT)^2)+VOUT*(IOUT/(1-[.K33]))*((QG*RG)/(VG-VGTH))) -> 0.0477136217667597 | AA75: of:=[.$R75]*((COSS*(VOUT)^2)+VOUT*(IOUT/(1-[.L33]))*((QG*RG)/(VG-VGTH))) -> 0.0478333733846093 | AB75: of:=[.$R75]*((COSS*(VOUT)^2)+VOUT*(IOUT/(1-[.M33]))*((QG*RG)/(VG-VGTH))) -> 0.0479884431836471 | AC75: of:=[.$R75]*((COSS*(VOUT)^2)+VOUT*(IOUT/(1-[.N33]))*((QG*RG)/(VG-VGTH))) -> 0.0482424047862404 | AD75: of:=[.$R75]*((COSS*(VOUT)^2)+VOUT*(IOUT/(1-[.O33]))*((QG*RG)/(VG-VGTH))) -> 0.0486443750349547
R76: 40000 | S76: of:=[.$R76]*((COSS*(VOUT)^2)+VOUT*(IOUT/(1-[.D34]))*((QG*RG)/(VG-VGTH))) -> 0.0631927673384745 | T76: of:=[.$R76]*((COSS*(VOUT)^2)+VOUT*(IOUT/(1-[.E34]))*((QG*RG)/(VG-VGTH))) -> 0.0632343740483037 | U76: of:=[.$R76]*((COSS*(VOUT)^2)+VOUT*(IOUT/(1-[.F34]))*((QG*RG)/(VG-VGTH))) -> 0.0632966867644499 | V76: of:=[.$R76]*((COSS*(VOUT)^2)+VOUT*(IOUT/(1-[.G34]))*((QG*RG)/(VG-VGTH))) -> 0.063359912230243 | W76: of:=[.$R76]*((COSS*(VOUT)^2)+VOUT*(IOUT/(1-[.H34]))*((QG*RG)/(VG-VGTH))) -> 0.0634470785070822 | X76: of:=[.$R76]*((COSS*(VOUT)^2)+VOUT*(IOUT/(1-[.I34]))*((QG*RG)/(VG-VGTH))) -> 0.0635628742581072 | Y76: of:=[.$R76]*((COSS*(VOUT)^2)+VOUT*(IOUT/(1-[.J34]))*((QG*RG)/(VG-VGTH))) -> 0.0637156582342051 | Z76: of:=[.$R76]*((COSS*(VOUT)^2)+VOUT*(IOUT/(1-[.K34]))*((QG*RG)/(VG-VGTH))) -> 0.0638885936639471 | AA76: of:=[.$R76]*((COSS*(VOUT)^2)+VOUT*(IOUT/(1-[.L34]))*((QG*RG)/(VG-VGTH))) -> 0.0641621069871161 | AB76: of:=[.$R76]*((COSS*(VOUT)^2)+VOUT*(IOUT/(1-[.M34]))*((QG*RG)/(VG-VGTH))) -> 0.0645546547198309 | AC76: of:=[.$R76]*((COSS*(VOUT)^2)+VOUT*(IOUT/(1-[.N34]))*((QG*RG)/(VG-VGTH))) -> 0.0653127223239809 | AD76: of:=[.$R76]*((COSS*(VOUT)^2)+VOUT*(IOUT/(1-[.O34]))*((QG*RG)/(VG-VGTH))) -> 0.0669309994099506
Q77: Frequency | R77: 50000 | S77: of:=[.$R77]*((COSS*(VOUT)^2)+VOUT*(IOUT/(1-[.D35]))*((QG*RG)/(VG-VGTH))) -> 0.0790559259428569 | T77: of:=[.$R77]*((COSS*(VOUT)^2)+VOUT*(IOUT/(1-[.E35]))*((QG*RG)/(VG-VGTH))) -> 0.0791208584555624 | U77: of:=[.$R77]*((COSS*(VOUT)^2)+VOUT*(IOUT/(1-[.F35]))*((QG*RG)/(VG-VGTH))) -> 0.0792199567099871 | V77: of:=[.$R77]*((COSS*(VOUT)^2)+VOUT*(IOUT/(1-[.G35]))*((QG*RG)/(VG-VGTH))) -> 0.0793228461755544 | W77: of:=[.$R77]*((COSS*(VOUT)^2)+VOUT*(IOUT/(1-[.H35]))*((QG*RG)/(VG-VGTH))) -> 0.0794687145078424 | X77: of:=[.$R77]*((COSS*(VOUT)^2)+VOUT*(IOUT/(1-[.I35]))*((QG*RG)/(VG-VGTH))) -> 0.0796700674669264 | Y77: of:=[.$R77]*((COSS*(VOUT)^2)+VOUT*(IOUT/(1-[.J35]))*((QG*RG)/(VG-VGTH))) -> 0.0799498968186192 | Z77: of:=[.$R77]*((COSS*(VOUT)^2)+VOUT*(IOUT/(1-[.K35]))*((QG*RG)/(VG-VGTH))) -> 0.0802878336148808 | AA77: of:=[.$R77]*((COSS*(VOUT)^2)+VOUT*(IOUT/(1-[.L35]))*((QG*RG)/(VG-VGTH))) -> 0.0808742637768182 | AB77: of:=[.$R77]*((COSS*(VOUT)^2)+VOUT*(IOUT/(1-[.M35]))*((QG*RG)/(VG-VGTH))) -> 0.0818493694357156 | AC77: of:=[.$R77]*((COSS*(VOUT)^2)+VOUT*(IOUT/(1-[.N35]))*((QG*RG)/(VG-VGTH))) -> 0.0843618524431916 | AD77: of:=[.$R77]*((COSS*(VOUT)^2)+VOUT*(IOUT/(1-[.O35]))*((QG*RG)/(VG-VGTH))) -> 0.0967124846873609
R78: 100000 | S78: of:=[.$R78]*((COSS*(VOUT)^2)+VOUT*(IOUT/(1-[.D36]))*((QG*RG)/(VG-VGTH))) -> 0.15878870727605 | T78: of:=[.$R78]*((COSS*(VOUT)^2)+VOUT*(IOUT/(1-[.E36]))*((QG*RG)/(VG-VGTH))) -> 0.15909274855694 | U78: of:=[.$R78]*((COSS*(VOUT)^2)+VOUT*(IOUT/(1-[.F36]))*((QG*RG)/(VG-VGTH))) -> 0.159607853677043 | V78: of:=[.$R78]*((COSS*(VOUT)^2)+VOUT*(IOUT/(1-[.G36]))*((QG*RG)/(VG-VGTH))) -> 0.160220547478238 | W78: of:=[.$R78]*((COSS*(VOUT)^2)+VOUT*(IOUT/(1-[.H36]))*((QG*RG)/(VG-VGTH))) -> 0.161263267659106 | X78: of:=[.$R78]*((COSS*(VOUT)^2)+VOUT*(IOUT/(1-[.I36]))*((QG*RG)/(VG-VGTH))) -> 0.163183247760594 | Y78: of:=[.$R78]*((COSS*(VOUT)^2)+VOUT*(IOUT/(1-[.J36]))*((QG*RG)/(VG-VGTH))) -> 0.167540950224402 | Z78: of:=[.$R78]*((COSS*(VOUT)^2)+VOUT*(IOUT/(1-[.K36]))*((QG*RG)/(VG-VGTH))) -> 0.180506601499256 | AA78: of:=[.$R78]*((COSS*(VOUT)^2)+VOUT*(IOUT/(1-[.L36]))*((QG*RG)/(VG-VGTH))) -> 0.0764854050904715 | AB78: of:=[.$R78]*((COSS*(VOUT)^2)+VOUT*(IOUT/(1-[.M36]))*((QG*RG)/(VG-VGTH))) -> 0.140548487942304 | AC78: of:=[.$R78]*((COSS*(VOUT)^2)+VOUT*(IOUT/(1-[.N36]))*((QG*RG)/(VG-VGTH))) -> 0.147978498764552 | AD78: of:=[.$R78]*((COSS*(VOUT)^2)+VOUT*(IOUT/(1-[.O36]))*((QG*RG)/(VG-VGTH))) -> 0.150579226841291
R79: 150000 | S79: of:=[.$R79]*((COSS*(VOUT)^2)+VOUT*(IOUT/(1-[.D37]))*((QG*RG)/(VG-VGTH))) -> 0.239411780515564 | T79: of:=[.$R79]*((COSS*(VOUT)^2)+VOUT*(IOUT/(1-[.E37]))*((QG*RG)/(VG-VGTH))) -> 0.240330821217357 | U79: of:=[.$R79]*((COSS*(VOUT)^2)+VOUT*(IOUT/(1-[.F37]))*((QG*RG)/(VG-VGTH))) -> 0.242127200382036 | V79: of:=[.$R79]*((COSS*(VOUT)^2)+VOUT*(IOUT/(1-[.G37]))*((QG*RG)/(VG-VGTH))) -> 0.244774871640891 | W79: of:=[.$R79]*((COSS*(VOUT)^2)+VOUT*(IOUT/(1-[.H37]))*((QG*RG)/(VG-VGTH))) -> 0.251311425336603 | X79: of:=[.$R79]*((COSS*(VOUT)^2)+VOUT*(IOUT/(1-[.I37]))*((QG*RG)/(VG-VGTH))) -> 0.283683373713672 | Y79: of:=[.$R79]*((COSS*(VOUT)^2)+VOUT*(IOUT/(1-[.J37]))*((QG*RG)/(VG-VGTH))) -> 0.180044131520849 | Z79: of:=[.$R79]*((COSS*(VOUT)^2)+VOUT*(IOUT/(1-[.K37]))*((QG*RG)/(VG-VGTH))) -> 0.214771678181189 | AA79: of:=[.$R79]*((COSS*(VOUT)^2)+VOUT*(IOUT/(1-[.L37]))*((QG*RG)/(VG-VGTH))) -> 0.222974758974207 | AB79: of:=[.$R79]*((COSS*(VOUT)^2)+VOUT*(IOUT/(1-[.M37]))*((QG*RG)/(VG-VGTH))) -> 0.226200043594953 | AC79: of:=[.$R79]*((COSS*(VOUT)^2)+VOUT*(IOUT/(1-[.N37]))*((QG*RG)/(VG-VGTH))) -> 0.22815111736556 | AD79: of:=[.$R79]*((COSS*(VOUT)^2)+VOUT*(IOUT/(1-[.O37]))*((QG*RG)/(VG-VGTH))) -> 0.229311178595376
R80: 200000 | S80: of:=[.$R80]*((COSS*(VOUT)^2)+VOUT*(IOUT/(1-[.D38]))*((QG*RG)/(VG-VGTH))) -> 0.321405630577608 | T80: of:=[.$R80]*((COSS*(VOUT)^2)+VOUT*(IOUT/(1-[.E38]))*((QG*RG)/(VG-VGTH))) -> 0.323850118859275 | U80: of:=[.$R80]*((COSS*(VOUT)^2)+VOUT*(IOUT/(1-[.F38]))*((QG*RG)/(VG-VGTH))) -> 0.329863863822415 | V80: of:=[.$R80]*((COSS*(VOUT)^2)+VOUT*(IOUT/(1-[.G38]))*((QG*RG)/(VG-VGTH))) -> 0.343744034562005 | W80: of:=[.$R80]*((COSS*(VOUT)^2)+VOUT*(IOUT/(1-[.H38]))*((QG*RG)/(VG-VGTH))) -> 0.61724516660084 | X80: of:=[.$R80]*((COSS*(VOUT)^2)+VOUT*(IOUT/(1-[.I38]))*((QG*RG)/(VG-VGTH))) -> 0.274783148201399 | Y80: of:=[.$R80]*((COSS*(VOUT)^2)+VOUT*(IOUT/(1-[.J38]))*((QG*RG)/(VG-VGTH))) -> 0.294654774772052 | Z80: of:=[.$R80]*((COSS*(VOUT)^2)+VOUT*(IOUT/(1-[.K38]))*((QG*RG)/(VG-VGTH))) -> 0.300117487104202 | AA80: of:=[.$R80]*((COSS*(VOUT)^2)+VOUT*(IOUT/(1-[.L38]))*((QG*RG)/(VG-VGTH))) -> 0.303276040649214 | AB80: of:=[.$R80]*((COSS*(VOUT)^2)+VOUT*(IOUT/(1-[.M38]))*((QG*RG)/(VG-VGTH))) -> 0.305054972601883 | AC80: of:=[.$R80]*((COSS*(VOUT)^2)+VOUT*(IOUT/(1-[.N38]))*((QG*RG)/(VG-VGTH))) -> 0.306358692490262 | AD80: of:=[.$R80]*((COSS*(VOUT)^2)+VOUT*(IOUT/(1-[.O38]))*((QG*RG)/(VG-VGTH))) -> 0.307237286115179
R81: 250000 | S81: of:=[.$R81]*((COSS*(VOUT)^2)+VOUT*(IOUT/(1-[.D39]))*((QG*RG)/(VG-VGTH))) -> 0.405759186733828 | T81: of:=[.$R81]*((COSS*(VOUT)^2)+VOUT*(IOUT/(1-[.E39]))*((QG*RG)/(VG-VGTH))) -> 0.412329829778018 | U81: of:=[.$R81]*((COSS*(VOUT)^2)+VOUT*(IOUT/(1-[.F39]))*((QG*RG)/(VG-VGTH))) -> 0.438322313215779 | V81: of:=[.$R81]*((COSS*(VOUT)^2)+VOUT*(IOUT/(1-[.G39]-0.1))*((QG*RG)/(VG-VGTH))) -> 0.345550569254372 | W81: of:=[.$R81]*((COSS*(VOUT)^2)+VOUT*(IOUT/(1-[.H39]))*((QG*RG)/(VG-VGTH))) -> 0.347819208987725 | X81: of:=[.$R81]*((COSS*(VOUT)^2)+VOUT*(IOUT/(1-[.I39]))*((QG*RG)/(VG-VGTH))) -> 0.369566224853983 | Y81: of:=[.$R81]*((COSS*(VOUT)^2)+VOUT*(IOUT/(1-[.J39]))*((QG*RG)/(VG-VGTH))) -> 0.376591493920517 | Z81: of:=[.$R81]*((COSS*(VOUT)^2)+VOUT*(IOUT/(1-[.K39]))*((QG*RG)/(VG-VGTH))) -> 0.379643420793156 | AA81: of:=[.$R81]*((COSS*(VOUT)^2)+VOUT*(IOUT/(1-[.L39]))*((QG*RG)/(VG-VGTH))) -> 0.381783693929498 | AB81: of:=[.$R81]*((COSS*(VOUT)^2)+VOUT*(IOUT/(1-[.M39]))*((QG*RG)/(VG-VGTH))) -> 0.383142829370758 | AC81: of:=[.$R81]*((COSS*(VOUT)^2)+VOUT*(IOUT/(1-[.N39]))*((QG*RG)/(VG-VGTH))) -> 0.384220956588013 | AD81: of:=[.$R81]*((COSS*(VOUT)^2)+VOUT*(IOUT/(1-[.O39]))*((QG*RG)/(VG-VGTH))) -> 0.384990915556369
R82: 300000 | S82: of:=[.$R82]*((COSS*(VOUT)^2)+VOUT*(IOUT/(1-[.D40]))*((QG*RG)/(VG-VGTH))) -> 0.494795795733622 | T82: of:=[.$R82]*((COSS*(VOUT)^2)+VOUT*(IOUT/(1-[.E40]))*((QG*RG)/(VG-VGTH))) -> 0.515616051843008 | U82: of:=[.$R82]*((COSS*(VOUT)^2)+VOUT*(IOUT/(1-[.F40]-0.1))*((QG*RG)/(VG-VGTH))) -> 0.414660683105247 | V82: of:=[.$R82]*((COSS*(VOUT)^2)+VOUT*(IOUT/(1-[.G40]))*((QG*RG)/(VG-VGTH))) -> 0.412174722302098 | W82: of:=[.$R82]*((COSS*(VOUT)^2)+VOUT*(IOUT/(1-[.H40]))*((QG*RG)/(VG-VGTH))) -> 0.441982162158078 | X82: of:=[.$R82]*((COSS*(VOUT)^2)+VOUT*(IOUT/(1-[.I40]))*((QG*RG)/(VG-VGTH))) -> 0.451379354151804 | Y82: of:=[.$R82]*((COSS*(VOUT)^2)+VOUT*(IOUT/(1-[.J40]))*((QG*RG)/(VG-VGTH))) -> 0.455828639894726 | Z82: of:=[.$R82]*((COSS*(VOUT)^2)+VOUT*(IOUT/(1-[.K40]))*((QG*RG)/(VG-VGTH))) -> 0.458093109235857 | AA82: of:=[.$R82]*((COSS*(VOUT)^2)+VOUT*(IOUT/(1-[.L40]))*((QG*RG)/(VG-VGTH))) -> 0.459826833748933 | AB82: of:=[.$R82]*((COSS*(VOUT)^2)+VOUT*(IOUT/(1-[.M40]))*((QG*RG)/(VG-VGTH))) -> 0.460997545817137 | AC82: of:=[.$R82]*((COSS*(VOUT)^2)+VOUT*(IOUT/(1-[.N40]))*((QG*RG)/(VG-VGTH))) -> 0.461967997487393 | AD82: of:=[.$R82]*((COSS*(VOUT)^2)+VOUT*(IOUT/(1-[.O40]))*((QG*RG)/(VG-VGTH))) -> 0.462685048405339
S84: Total FET Losses
S85: Inductance
S86: 0.00001 | T86: 0.000012 | U86: 0.000015 | V86: 0.000018 | W86: 0.000022 | X86: 0.000027 | Y86: 0.000033 | Z86: 0.000039 | AA86: 0.000047 | AB86: 0.000056 | AC86: 0.000068 | AD86: 0.000082
R87: 20000 | S87: of:=[.S60]+[.S74] -> 0.164342390637697 | T87: of:=[.T60]+[.T74] -> 0.152783063734206 | U87: of:=[.U60]+[.U74] -> 0.140001013980125 | V87: of:=[.V60]+[.V74] -> 0.130569515943412 | W87: of:=[.W60]+[.W74] -> 0.121140873585442 | X87: of:=[.X60]+[.X74] -> 0.112452539515958 | Y87: of:=[.Y60]+[.Y74] -> 0.104768322758254 | Z87: of:=[.Z60]+[.Z74] -> 0.0989422083926241 | AA87: of:=[.AA60]+[.AA74] -> 0.0929967485217525 | AB87: of:=[.AB60]+[.AB74] -> 0.087912033403532 | AC87: of:=[.AC60]+[.AC74] -> 0.0827981221385513 | AD87: of:=[.AD60]+[.AD74] -> 0.078351837903523
R88: 30000 | S88: of:=[.S61]+[.S75] -> 0.155785951250779 | T88: of:=[.T61]+[.T75] -> 0.146362456409595 | U88: of:=[.U61]+[.U75] -> 0.135947761739591 | V88: of:=[.V61]+[.V75] -> 0.128268909496778 | W88: of:=[.W61]+[.W75] -> 0.120600354489189 | X88: of:=[.X61]+[.X75] -> 0.113545426975072 | Y88: of:=[.Y61]+[.Y75] -> 0.10732162683254 | Z88: of:=[.Z61]+[.Z75] -> 0.102619863530473 | AA88: of:=[.AA61]+[.AA75] -> 0.097848928411829 | AB88: of:=[.AB61]+[.AB75] -> 0.0938089626045354 | AC88: of:=[.AC61]+[.AC75] -> 0.0898238486114401 | AD88: of:=[.AD61]+[.AD75] -> 0.0865101714293971
R89: 40000 | S89: of:=[.S62]+[.S76] -> 0.157096888653782 | T89: of:=[.T62]+[.T76] -> 0.148956716526796 | U89: of:=[.U62]+[.U76] -> 0.139969080753421 | V89: of:=[.V62]+[.V76] -> 0.133351911773048 | W89: of:=[.W62]+[.W76] -> 0.126757224182594 | X89: of:=[.X62]+[.X76] -> 0.120711102577102 | Y89: of:=[.Y62]+[.Y76] -> 0.115408175716297 | Z89: of:=[.Z62]+[.Z76] -> 0.111438793857653 | AA89: of:=[.AA62]+[.AA76] -> 0.107476848225067 | AB89: of:=[.AB62]+[.AB76] -> 0.104236388552918 | AC89: of:=[.AC62]+[.AC76] -> 0.101323309002639 | AD89: of:=[.AD62]+[.AD76] -> 0.0997237410220669
Q90: Frequency | R90: 50000 | S90: of:=[.S63]+[.S77] -> 0.163046325394223 | T90: of:=[.T63]+[.T77] -> 0.155793252444533 | U90: of:=[.U63]+[.U77] -> 0.147797830692781 | V90: of:=[.V63]+[.V77] -> 0.141925593719093 | W90: of:=[.W63]+[.W77] -> 0.136095030266186 | X90: of:=[.X63]+[.X77] -> 0.130784996792907 | Y90: of:=[.Y63]+[.Y77] -> 0.126185090025841 | Z90: of:=[.Z63]+[.Z77] -> 0.122818025605621 | AA90: of:=[.AA63]+[.AA77] -> 0.119616146111167 | AB90: of:=[.AB63]+[.AB77] -> 0.11734179116205 | AC90: of:=[.AC63]+[.AC77] -> 0.116570700332443 | AD90: of:=[.AD63]+[.AD77] -> 0.126043204452672
R91: 100000 | S91: of:=[.S64]+[.S78] -> 0.218178888282678 | T91: of:=[.T64]+[.T78] -> 0.213308318276348 | U91: of:=[.U64]+[.U78] -> 0.208099733409633 | V91: of:=[.V64]+[.V78] -> 0.204487374787183 | W91: of:=[.W64]+[.W78] -> 0.201304119525441 | X91: of:=[.X64]+[.X78] -> 0.199326960906866 | Y91: of:=[.Y64]+[.Y78] -> 0.200234168870698 | Z91: of:=[.Z64]+[.Z78] -> 0.210579988661074 | AA91: of:=[.AA64]+[.AA78] -> 0.103880052805021 | AB91: of:=[.AB64]+[.AB78] -> 0.165645420025728 | AC91: of:=[.AC64]+[.AC78] -> 0.170753593521248 | AD91: of:=[.AD64]+[.AD78] -> 0.171319177684425
R92: 150000 | S92: of:=[.S65]+[.S79] -> 0.287903660248154 | T92: of:=[.T65]+[.T79] -> 0.284597648526303 | U92: of:=[.U65]+[.U79] -> 0.281720654386454 | V92: of:=[.V65]+[.V79] -> 0.280918584787163 | W92: of:=[.W65]+[.W79] -> 0.284004643982899 | X92: of:=[.X65]+[.X79] -> 0.313194591919636 | Y92: of:=[.Y65]+[.Y79] -> 0.206738032765073 | Z92: of:=[.Z65]+[.Z79] -> 0.239326495975729 | AA92: of:=[.AA65]+[.AA79] -> 0.245342395168856 | AB92: of:=[.AB65]+[.AB79] -> 0.246691602832845 | AC92: of:=[.AC65]+[.AC79] -> 0.246746904364707 | AD92: of:=[.AD65]+[.AD79] -> 0.246245277547404
R93: 200000 | S93: of:=[.S66]+[.S80] -> 0.363400830303291 | T93: of:=[.T66]+[.T80] -> 0.362186315853761 | U93: of:=[.U66]+[.U80] -> 0.364152800813812 | V93: of:=[.V66]+[.V80] -> 0.375045408333775 | W93: of:=[.W66]+[.W80] -> 0.645558324480012 | X93: of:=[.X66]+[.X80] -> 0.300340612864389 | Y93: of:=[.Y66]+[.Y80] -> 0.317772371375663 | Z93: of:=[.Z66]+[.Z80] -> 0.321382583099572 | AA93: of:=[.AA66]+[.AA80] -> 0.322646981816388 | AB93: of:=[.AB66]+[.AB80] -> 0.322801183465051 | AC93: of:=[.AC66]+[.AC80] -> 0.322463116434887 | AD93: of:=[.AD66]+[.AD80] -> 0.321902645997834
R94: 250000 | S94: of:=[.S67]+[.S81] -> 0.443320835259951 | T94: of:=[.T67]+[.T81] -> 0.446618766769416 | U94: of:=[.U67]+[.U81] -> 0.468991270811367 | V94: of:=[.V67]+[.V81] -> 0.373547369071494 | W94: of:=[.W67]+[.W81] -> 0.37314326725793 | X94: of:=[.X67]+[.X81] -> 0.392425516181581 | Y94: of:=[.Y67]+[.Y81] -> 0.397268500913354 | Z94: of:=[.Z67]+[.Z81] -> 0.398663500870638 | AA94: of:=[.AA67]+[.AA81] -> 0.399109590424679 | AB94: of:=[.AB67]+[.AB81] -> 0.399015522903993 | AC94: of:=[.AC67]+[.AC81] -> 0.398625191259476 | AD94: of:=[.AD67]+[.AD81] -> 0.398108012201216
R95: 300000 | S95: of:=[.S68]+[.S82] -> 0.529084732725019 | T95: of:=[.T68]+[.T82] -> 0.546917425614777 | U95: of:=[.U68]+[.U82] -> 0.442657482922369 | V95: of:=[.V68]+[.V82] -> 0.437732186965089 | W95: of:=[.W68]+[.W82] -> 0.465099758761689 | X95: of:=[.X68]+[.X82] -> 0.472246936666317 | Y95: of:=[.Y68]+[.Y82] -> 0.474704078480841 | Z95: of:=[.Z68]+[.Z82] -> 0.475455987409177 | AA95: of:=[.AA68]+[.AA82] -> 0.475643140981283 | AB95: of:=[.AB68]+[.AB82] -> 0.475487266311335 | AC95: of:=[.AC68]+[.AC82] -> 0.47511720457599 | AD95: of:=[.AD68]+[.AD82] -> 0.474659264607602
X97: VFWD
D99: RMS Diode Current | S99: Diode Losses | V99: Selected Diode | W99: 1N4004 | X99: of:=LOOKUP([.W99];[Components.$J$4:Components.$J$12];[Components.$K$4:Components.$K$12]) -> 1.1
S100: Inductance
D101: 0.00001 | E101: 0.000012 | F101: 0.000015 | G101: 0.000018 | H101: 0.000022 | I101: 0.000027 | J101: 0.000033 | K101: 0.000039 | L101: 0.000047 | M101: 0.000056 | N101: 0.000068 | O101: 0.000082 | S101: 0.00001 | T101: 0.000012 | U101: 0.000015 | V101: 0.000018 | W101: 0.000022 | X101: 0.000027 | Y101: 0.000033 | Z101: 0.000039 | AA101: 0.000047 | AB101: 0.000056 | AC101: 0.000068 | AD101: 0.000082
C102: 20000 | D102: of:=[.D47]*SQRT([.D18]/3) -> 0.232818122871662 | E102: of:=[.E47]*SQRT([.E18]/3) -> 0.22244439739228 | F102: of:=[.F47]*SQRT([.F18]/3) -> 0.210374922303517 | G102: of:=[.G47]*SQRT([.G18]/3) -> 0.201001203175449 | H102: of:=[.H47]*SQRT([.H18]/3) -> 0.191166202556967 | I102: of:=[.I47]*SQRT([.I18]/3) -> 0.181625089917325 | J102: of:=[.J47]*SQRT([.J18]/3) -> 0.17273816365296 | K102: of:=[.K47]*SQRT([.K18]/3) -> 0.165672578504607 | L102: of:=[.L47]*SQRT([.L18]/3) -> 0.158122007283953 | M102: of:=[.M47]*SQRT([.M18]/3) -> 0.15134559204254 | N102: of:=[.N47]*SQRT([.N18]/3) -> 0.144174865580982 | O102: of:=[.O47]*SQRT([.O18]/3) -> 0.137582539137831 | R102: 20000 | S102: of:=[.D102]*[.$X$99] -> 0.256099935158828 | T102: of:=[.E102]*[.$X$99] -> 0.244688837131508 | U102: of:=[.F102]*[.$X$99] -> 0.231412414533868 | V102: of:=[.G102]*[.$X$99] -> 0.221101323492994 | W102: of:=[.H102]*[.$X$99] -> 0.210282822812663 | X102: of:=[.I102]*[.$X$99] -> 0.199787598909058 | Y102: of:=[.J102]*[.$X$99] -> 0.190011980018257 | Z102: of:=[.K102]*[.$X$99] -> 0.182239836355068 | AA102: of:=[.L102]*[.$X$99] -> 0.173934208012349 | AB102: of:=[.M102]*[.$X$99] -> 0.166480151246794 | AC102: of:=[.N102]*[.$X$99] -> 0.15859235213908 | AD102: of:=[.O102]*[.$X$99] -> 0.151340793051614
C103: 30000 | D103: of:=[.D48]*SQRT([.D19]/3) -> 0.210374922303517 | E103: of:=[.E48]*SQRT([.E19]/3) -> 0.201001203175449 | F103: of:=[.F48]*SQRT([.F19]/3) -> 0.190095201302723 | G103: of:=[.G48]*SQRT([.G19]/3) -> 0.181625089917325 | H103: of:=[.H48]*SQRT([.H19]/3) -> 0.17273816365296 | I103: of:=[.I48]*SQRT([.I19]/3) -> 0.164116795155113 | J103: of:=[.J48]*SQRT([.J19]/3) -> 0.1560865507767 | K103: of:=[.K48]*SQRT([.K19]/3) -> 0.149702073879973 | L103: of:=[.L48]*SQRT([.L19]/3) -> 0.142879362596591 | M103: of:=[.M48]*SQRT([.M19]/3) -> 0.136756180207157 | N103: of:=[.N48]*SQRT([.N19]/3) -> 0.130276697409155 | O103: of:=[.O48]*SQRT([.O19]/3) -> 0.124319858026674 | R103: 30000 | S103: of:=[.D103]*[.$X$99] -> 0.231412414533868 | T103: of:=[.E103]*[.$X$99] -> 0.221101323492994 | U103: of:=[.F103]*[.$X$99] -> 0.209104721432995 | V103: of:=[.G103]*[.$X$99] -> 0.199787598909058 | W103: of:=[.H103]*[.$X$99] -> 0.190011980018256 | X103: of:=[.I103]*[.$X$99] -> 0.180528474670624 | Y103: of:=[.J103]*[.$X$99] -> 0.17169520585437 | Z103: of:=[.K103]*[.$X$99] -> 0.16467228126797 | AA103: of:=[.L103]*[.$X$99] -> 0.15716729885625 | AB103: of:=[.M103]*[.$X$99] -> 0.150431798227873 | AC103: of:=[.N103]*[.$X$99] -> 0.143304367150071 | AD103: of:=[.O103]*[.$X$99] -> 0.136751843829342
C104: 40000 | D104: of:=[.D49]*SQRT([.D20]/3) -> 0.195775924928879 | E104: of:=[.E49]*SQRT([.E20]/3) -> 0.187052696360441 | F104: of:=[.F49]*SQRT([.F20]/3) -> 0.176903518024306 | G104: of:=[.G49]*SQRT([.G20]/3) -> 0.169021191211918 | H104: of:=[.H49]*SQRT([.H20]/3) -> 0.160750974447819 | I104: of:=[.I49]*SQRT([.I20]/3) -> 0.152727887031612 | J104: of:=[.J49]*SQRT([.J20]/3) -> 0.145254902593284 | K104: of:=[.K49]*SQRT([.K20]/3) -> 0.139313477370364 | L104: of:=[.L49]*SQRT([.L20]/3) -> 0.132964229097798 | M104: of:=[.M49]*SQRT([.M20]/3) -> 0.127265965813023 | N104: of:=[.N49]*SQRT([.N20]/3) -> 0.121236127636734 | O104: of:=[.O49]*SQRT([.O20]/3) -> 0.115692663962506 | R104: 40000 | S104: of:=[.D104]*[.$X$99] -> 0.215353517421767 | T104: of:=[.E104]*[.$X$99] -> 0.205757965996485 | U104: of:=[.F104]*[.$X$99] -> 0.194593869826737 | V104: of:=[.G104]*[.$X$99] -> 0.18592331033311 | W104: of:=[.H104]*[.$X$99] -> 0.176826071892601 | X104: of:=[.I104]*[.$X$99] -> 0.168000675734773 | Y104: of:=[.J104]*[.$X$99] -> 0.159780392852612 | Z104: of:=[.K104]*[.$X$99] -> 0.153244825107401 | AA104: of:=[.L104]*[.$X$99] -> 0.146260652007578 | AB104: of:=[.M104]*[.$X$99] -> 0.139992562394325 | AC104: of:=[.N104]*[.$X$99] -> 0.133359740400407 | AD104: of:=[.O104]*[.$X$99] -> 0.127261930358757
B105: Frequency | C105: 50000 | D105: of:=[.D50]*SQRT([.D21]/3) -> 0.185153438246323 | E105: of:=[.E50]*SQRT([.E21]/3) -> 0.176903518024306 | F105: of:=[.F50]*SQRT([.F21]/3) -> 0.167305017774629 | G105: of:=[.G50]*SQRT([.G21]/3) -> 0.159850373332393 | H105: of:=[.H50]*SQRT([.H21]/3) -> 0.152028885223108 | I105: of:=[.I50]*SQRT([.I21]/3) -> 0.144441117620932 | J105: of:=[.J50]*SQRT([.J21]/3) -> 0.137373605294172 | K105: of:=[.K50]*SQRT([.K21]/3) -> 0.131754552244076 | L105: of:=[.L50]*SQRT([.L21]/3) -> 0.125749803966819 | M105: of:=[.M50]*SQRT([.M21]/3) -> 0.120360719279351 | N105: of:=[.N50]*SQRT([.N21]/3) -> 0.114658050420479 | O105: of:=[.O50]*SQRT([.O21]/3) -> 0.109415366165764 | Q105: Frequency | R105: 50000 | S105: of:=[.D105]*[.$X$99] -> 0.203668782070956 | T105: of:=[.E105]*[.$X$99] -> 0.194593869826737 | U105: of:=[.F105]*[.$X$99] -> 0.184035519552092 | V105: of:=[.G105]*[.$X$99] -> 0.175835410665632 | W105: of:=[.H105]*[.$X$99] -> 0.167231773745419 | X105: of:=[.I105]*[.$X$99] -> 0.158885229383025 | Y105: of:=[.J105]*[.$X$99] -> 0.151110965823589 | Z105: of:=[.K105]*[.$X$99] -> 0.144930007468483 | AA105: of:=[.L105]*[.$X$99] -> 0.1383247843635 | AB105: of:=[.M105]*[.$X$99] -> 0.132396791207286 | AC105: of:=[.N105]*[.$X$99] -> 0.126123855462527 | AD105: of:=[.O105]*[.$X$99] -> 0.120356902782341
C106: 100000 | D106: of:=[.D51]*SQRT([.D22]/3) -> 0.155694862493233 | E106: of:=[.E51]*SQRT([.E22]/3) -> 0.14875753415241 | F106: of:=[.F51]*SQRT([.F22]/3) -> 0.140686189700645 | G106: of:=[.G51]*SQRT([.G22]/3) -> 0.134417605912177 | H106: of:=[.H51]*SQRT([.H22]/3) -> 0.12784054459913 | I106: of:=[.I51]*SQRT([.I22]/3) -> 0.121460018022682 | J106: of:=[.J51]*SQRT([.J22]/3) -> 0.115516972242348 | K106: of:=[.K51]*SQRT([.K22]/3) -> 0.110791930675401 | L106: of:=[.L51]*SQRT([.L22]/3) -> 0.105742559374555 | M106: of:=[.M51]*SQRT([.M22]/3) -> 0.101210897379365 | N106: of:=[.N51]*SQRT([.N22]/3) -> 0.0964155435785604 | O106: of:=[.O51]*SQRT([.O22]/3) -> 0.0920069891824637 | R106: 100000 | S106: of:=[.D106]*[.$X$99] -> 0.171264348742557 | T106: of:=[.E106]*[.$X$99] -> 0.163633287567651 | U106: of:=[.F106]*[.$X$99] -> 0.154754808670709 | V106: of:=[.G106]*[.$X$99] -> 0.147859366503395 | W106: of:=[.H106]*[.$X$99] -> 0.140624599059043 | X106: of:=[.I106]*[.$X$99] -> 0.13360601982495 | Y106: of:=[.J106]*[.$X$99] -> 0.127068669466583 | Z106: of:=[.K106]*[.$X$99] -> 0.121871123742942 | AA106: of:=[.L106]*[.$X$99] -> 0.116316815312011 | AB106: of:=[.M106]*[.$X$99] -> 0.111331987117302 | AC106: of:=[.N106]*[.$X$99] -> 0.106057097936416 | AD106: of:=[.O106]*[.$X$99] -> 0.10120768810071
C107: 150000 | D107: of:=[.D52]*SQRT([.D23]/3) -> 0.140686189700645 | E107: of:=[.E52]*SQRT([.E23]/3) -> 0.134417605912177 | F107: of:=[.F52]*SQRT([.F23]/3) -> 0.127124322893737 | G107: of:=[.G52]*SQRT([.G23]/3) -> 0.121460018022682 | H107: of:=[.H52]*SQRT([.H23]/3) -> 0.115516972242348 | I107: of:=[.I52]*SQRT([.I23]/3) -> 0.109751515643783 | J107: of:=[.J52]*SQRT([.J23]/3) -> 0.104381367569128 | K107: of:=[.K52]*SQRT([.K23]/3) -> 0.100111810542096 | L107: of:=[.L52]*SQRT([.L23]/3) -> 0.095549188517681 | M107: of:=[.M52]*SQRT([.M23]/3) -> 0.0914543696591446 | N107: of:=[.N52]*SQRT([.N23]/3) -> 0.0871212783567195 | O107: of:=[.O52]*SQRT([.O23]/3) -> 0.0831376997713836 | R107: 150000 | S107: of:=[.D107]*[.$X$99] -> 0.154754808670709 | T107: of:=[.E107]*[.$X$99] -> 0.147859366503395 | U107: of:=[.F107]*[.$X$99] -> 0.139836755183111 | V107: of:=[.G107]*[.$X$99] -> 0.13360601982495 | W107: of:=[.H107]*[.$X$99] -> 0.127068669466583 | X107: of:=[.I107]*[.$X$99] -> 0.120726667208162 | Y107: of:=[.J107]*[.$X$99] -> 0.114819504326041 | Z107: of:=[.K107]*[.$X$99] -> 0.110122991596305 | AA107: of:=[.L107]*[.$X$99] -> 0.105104107369449 | AB107: of:=[.M107]*[.$X$99] -> 0.100599806625059 | AC107: of:=[.N107]*[.$X$99] -> 0.0958334061923915 | AD107: of:=[.O107]*[.$X$99] -> 0.0914514697485219
C108: 200000 | D108: of:=[.D53]*SQRT([.D24]/3) -> 0.13092325174398 | E108: of:=[.E53]*SQRT([.E24]/3) -> 0.125089677210743 | F108: of:=[.F53]*SQRT([.F24]/3) -> 0.118302512594976 | G108: of:=[.G53]*SQRT([.G24]/3) -> 0.113031282958536 | H108: of:=[.H53]*SQRT([.H24]/3) -> 0.107500655677491 | I108: of:=[.I53]*SQRT([.I24]/3) -> 0.102135293751925 | J108: of:=[.J53]*SQRT([.J24]/3) -> 0.0971378078595532 | K108: of:=[.K53]*SQRT([.K24]/3) -> 0.0931645373439832 | L108: of:=[.L53]*SQRT([.L24]/3) -> 0.0889185391178164 | M108: of:=[.M53]*SQRT([.M24]/3) -> 0.0851078807909196 | N108: of:=[.N53]*SQRT([.N24]/3) -> 0.0810754849699498 | O108: of:=[.O53]*SQRT([.O24]/3) -> 0.077368347381821 | R108: 200000 | S108: of:=[.D108]*[.$X$99] -> 0.144015576918378 | T108: of:=[.E108]*[.$X$99] -> 0.137598644931818 | U108: of:=[.F108]*[.$X$99] -> 0.130132763854474 | V108: of:=[.G108]*[.$X$99] -> 0.12433441125439 | W108: of:=[.H108]*[.$X$99] -> 0.11825072124524 | X108: of:=[.I108]*[.$X$99] -> 0.112348823127117 | Y108: of:=[.J108]*[.$X$99] -> 0.106851588645508 | Z108: of:=[.K108]*[.$X$99] -> 0.102480991078381 | AA108: of:=[.L108]*[.$X$99] -> 0.0978103930295981 | AB108: of:=[.M108]*[.$X$99] -> 0.0936186688700116 | AC108: of:=[.N108]*[.$X$99] -> 0.0891830334669448 | AD108: of:=[.O108]*[.$X$99] -> 0.0851051821200032
C109: 250000 | D109: of:=[.D54]*SQRT([.D25]/3) -> 0.123819566760279 | E109: of:=[.E54]*SQRT([.E25]/3) -> 0.118302512594976 | F109: of:=[.F54]*SQRT([.F25]/3) -> 0.111883608610691 | G109: of:=[.G54]*SQRT([.G25]/3) -> 0.1068983874129 | H109: of:=[.H54]*SQRT([.H25]/3) -> 0.101667843069327 | I109: of:=[.I54]*SQRT([.I25]/3) -> 0.0965935970489574 | J109: of:=[.J54]*SQRT([.J25]/3) -> 0.0918672667001352 | K109: of:=[.K54]*SQRT([.K25]/3) -> 0.0881095794497351 | L109: of:=[.L54]*SQRT([.L25]/3) -> 0.0840939622554955 | M109: of:=[.M54]*SQRT([.M25]/3) -> 0.0804900641180548 | N109: of:=[.N54]*SQRT([.N25]/3) -> 0.0766764596061931 | O109: of:=[.O54]*SQRT([.O25]/3) -> 0.0731704653388001 | R109: 250000 | S109: of:=[.D109]*[.$X$99] -> 0.136201523436307 | T109: of:=[.E109]*[.$X$99] -> 0.130132763854474 | U109: of:=[.F109]*[.$X$99] -> 0.123071969471761 | V109: of:=[.G109]*[.$X$99] -> 0.117588226154189 | W109: of:=[.H109]*[.$X$99] -> 0.11183462737626 | X109: of:=[.I109]*[.$X$99] -> 0.106252956753853 | Y109: of:=[.J109]*[.$X$99] -> 0.101053993370149 | Z109: of:=[.K109]*[.$X$99] -> 0.0969205373947086 | AA109: of:=[.L109]*[.$X$99] -> 0.0925033584810451 | AB109: of:=[.M109]*[.$X$99] -> 0.0885390705298603 | AC109: of:=[.N109]*[.$X$99] -> 0.0843441055668124 | AD109: of:=[.O109]*[.$X$99] -> 0.0804875118726801
C110: 300000 | D110: of:=[.D55]*SQRT([.D26]/3) -> 0.118302512594976 | E110: of:=[.E55]*SQRT([.E26]/3) -> 0.113031282958536 | F110: of:=[.F55]*SQRT([.F26]/3) -> 0.1068983874129 | G110: of:=[.G55]*SQRT([.G26]/3) -> 0.102135293751925 | H110: of:=[.H55]*SQRT([.H26]/3) -> 0.0971378078595532 | I110: of:=[.I55]*SQRT([.I26]/3) -> 0.0922896560735193 | J110: of:=[.J55]*SQRT([.J26]/3) -> 0.0877739178081604 | K110: of:=[.K55]*SQRT([.K26]/3) -> 0.0841836626094074 | L110: of:=[.L55]*SQRT([.L26]/3) -> 0.0803469701049193 | M110: of:=[.M55]*SQRT([.M26]/3) -> 0.0769036516056628 | N110: of:=[.N55]*SQRT([.N26]/3) -> 0.0732599706624865 | O110: of:=[.O55]*SQRT([.O26]/3) -> 0.069910193710196 | R110: 300000 | S110: of:=[.D110]*[.$X$99] -> 0.130132763854474 | T110: of:=[.E110]*[.$X$99] -> 0.12433441125439 | U110: of:=[.F110]*[.$X$99] -> 0.117588226154189 | V110: of:=[.G110]*[.$X$99] -> 0.112348823127117 | W110: of:=[.H110]*[.$X$99] -> 0.106851588645508 | X110: of:=[.I110]*[.$X$99] -> 0.101518621680871 | Y110: of:=[.J110]*[.$X$99] -> 0.0965513095889764 | Z110: of:=[.K110]*[.$X$99] -> 0.0926020288703482 | AA110: of:=[.L110]*[.$X$99] -> 0.0883816671154112 | AB110: of:=[.M110]*[.$X$99] -> 0.0845940167662291 | AC110: of:=[.N110]*[.$X$99] -> 0.0805859677287351 | AD110: of:=[.O110]*[.$X$99] -> 0.0769012130812156
S112: Inductor Resistive Losses | V112: Inductor DC Resistance | W112: 0.1
D113: RMS Inductor Current | S113: Inductance
D114: 0.00001 | E114: 0.000012 | F114: 0.000015 | G114: 0.000018 | H114: 0.000022 | I114: 0.000027 | J114: 0.000033 | K114: 0.000039 | L114: 0.000047 | M114: 0.000056 | N114: 0.000068 | O114: 0.000082 | S114: 0.00001 | T114: 0.000012 | U114: 0.000015 | V114: 0.000018 | W114: 0.000022 | X114: 0.000027 | Y114: 0.000033 | Z114: 0.000039 | AA114: 0.000047 | AB114: 0.000056 | AC114: 0.000068 | AD114: 0.000082
C115: 20000 | D115: of:=SQRT([.D60]^2+[.D102]^2) -> 1.39690873722997 | E115: of:=SQRT([.E60]^2+[.E102]^2) -> 1.33466638435368 | F115: of:=SQRT([.F60]^2+[.F102]^2) -> 1.2622495338211 | G115: of:=SQRT([.G60]^2+[.G102]^2) -> 1.20600721905269 | H115: of:=SQRT([.H60]^2+[.H102]^2) -> 1.1469972153418 | I115: of:=SQRT([.I60]^2+[.I102]^2) -> 1.08975053950395 | J115: of:=SQRT([.J60]^2+[.J102]^2) -> 1.03642898191776 | K115: of:=SQRT([.K60]^2+[.K102]^2) -> 0.994035471027645 | L115: of:=SQRT([.L60]^2+[.L102]^2) -> 0.948732043703721 | M115: of:=SQRT([.M60]^2+[.M102]^2) -> 0.908073552255237 | N115: of:=SQRT([.N60]^2+[.N102]^2) -> 0.865049193485891 | O115: of:=SQRT([.O60]^2+[.O102]^2) -> 0.825495234826987 | R115: 20000 | S115: of:=[.D115]^2*[.$W$112] -> 0.195135402014943 | T115: of:=[.E115]^2*[.$W$112] -> 0.178133435752373 | U115: of:=[.F115]^2*[.$W$112] -> 0.159327388563159 | V115: of:=[.G115]^2*[.$W$112] -> 0.145445341240721 | W115: of:=[.H115]^2*[.$W$112] -> 0.131560261200184 | X115: of:=[.I115]^2*[.$W$112] -> 0.118755623834915 | Y115: of:=[.J115]^2*[.$W$112] -> 0.107418503455909 | Z115: of:=[.K115]^2*[.$W$112] -> 0.0988106517661152 | AA115: of:=[.L115]^2*[.$W$112] -> 0.0900092490750239 | AB115: of:=[.M115]^2*[.$W$112] -> 0.0824597576305445 | AC115: of:=[.N115]^2*[.$W$112] -> 0.0748310107150591 | AD115: of:=[.O115]^2*[.$W$112] -> 0.0681442382722062
C116: 30000 | D116: of:=SQRT([.D61]^2+[.D103]^2) -> 1.2622495338211 | E116: of:=SQRT([.E61]^2+[.E103]^2) -> 1.20600721905269 | F116: of:=SQRT([.F61]^2+[.F103]^2) -> 1.14057120781634 | G116: of:=SQRT([.G61]^2+[.G103]^2) -> 1.08975053950395 | H116: of:=SQRT([.H61]^2+[.H103]^2) -> 1.03642898191776 | I116: of:=SQRT([.I61]^2+[.I103]^2) -> 0.984700770930679 | J116: of:=SQRT([.J61]^2+[.J103]^2) -> 0.936519304660202 | K116: of:=SQRT([.K61]^2+[.K103]^2) -> 0.898212443279836 | L116: of:=SQRT([.L61]^2+[.L103]^2) -> 0.857276175579545 | M116: of:=SQRT([.M61]^2+[.M103]^2) -> 0.820537081242941 | N116: of:=SQRT([.N61]^2+[.N103]^2) -> 0.781660184454932 | O116: of:=SQRT([.O61]^2+[.O103]^2) -> 0.745919148160044 | R116: 30000 | S116: of:=[.D116]^2*[.$W$112] -> 0.159327388563158 | T116: of:=[.E116]^2*[.$W$112] -> 0.145445341240721 | U116: of:=[.F116]^2*[.$W$112] -> 0.130090268009962 | V116: of:=[.G116]^2*[.$W$112] -> 0.118755623834915 | W116: of:=[.H116]^2*[.$W$112] -> 0.107418503455909 | X116: of:=[.I116]^2*[.$W$112] -> 0.0969635608271473 | Y116: of:=[.J116]^2*[.$W$112] -> 0.0877068408001228 | Z116: of:=[.K116]^2*[.$W$112] -> 0.0806785593262733 | AA116: of:=[.L116]^2*[.$W$112] -> 0.0734922441216291 | AB116: of:=[.M116]^2*[.$W$112] -> 0.0673281101694685 | AC116: of:=[.N116]^2*[.$W$112] -> 0.0610992643962118 | AD116: of:=[.O116]^2*[.$W$112] -> 0.0556395375591806
C117: 40000 | D117: of:=SQRT([.D62]^2+[.D104]^2) -> 1.17465554957328 | E117: of:=SQRT([.E62]^2+[.E104]^2) -> 1.12231617816265 | F117: of:=SQRT([.F62]^2+[.F104]^2) -> 1.06142110814584 | G117: of:=SQRT([.G62]^2+[.G104]^2) -> 1.01412714727151 | H117: of:=SQRT([.H62]^2+[.H104]^2) -> 0.964505846686912 | I117: of:=SQRT([.I62]^2+[.I104]^2) -> 0.916367322189673 | J117: of:=SQRT([.J62]^2+[.J104]^2) -> 0.871529415559703 | K117: of:=SQRT([.K62]^2+[.K104]^2) -> 0.835880864222184 | L117: of:=SQRT([.L62]^2+[.L104]^2) -> 0.797785374586789 | M117: of:=SQRT([.M62]^2+[.M104]^2) -> 0.763595794878135 | N117: of:=SQRT([.N62]^2+[.N104]^2) -> 0.727416765820403 | O117: of:=SQRT([.O62]^2+[.O104]^2) -> 0.694155983775037 | R117: 40000 | S117: of:=[.D117]^2*[.$W$112] -> 0.13798156601433 | T117: of:=[.E117]^2*[.$W$112] -> 0.125959360376561 | U117: of:=[.F117]^2*[.$W$112] -> 0.112661476881753 | V117: of:=[.G117]^2*[.$W$112] -> 0.102845387083305 | W117: of:=[.H117]^2*[.$W$112] -> 0.0930271528293237 | X117: of:=[.I117]^2*[.$W$112] -> 0.0839729069177072 | Y117: of:=[.J117]^2*[.$W$112] -> 0.0759563522185838 | Z117: of:=[.K117]^2*[.$W$112] -> 0.0698696819172826 | AA117: of:=[.L117]^2*[.$W$112] -> 0.0636461503904584 | AB117: of:=[.M117]^2*[.$W$112] -> 0.0583078537955572 | AC117: of:=[.N117]^2*[.$W$112] -> 0.0529135151196615 | AD117: of:=[.O117]^2*[.$W$112] -> 0.0481852529810689
B118: Frequency | C118: 50000 | D118: of:=SQRT([.D63]^2+[.D105]^2) -> 1.11092062947794 | E118: of:=SQRT([.E63]^2+[.E105]^2) -> 1.06142110814584 | F118: of:=SQRT([.F63]^2+[.F105]^2) -> 1.00383010664778 | G118: of:=SQRT([.G63]^2+[.G105]^2) -> 0.959102239994359 | H118: of:=SQRT([.H63]^2+[.H105]^2) -> 0.912173311338651 | I118: of:=SQRT([.I63]^2+[.I105]^2) -> 0.866646705725593 | J118: of:=SQRT([.J63]^2+[.J105]^2) -> 0.824241631765031 | K118: of:=SQRT([.K63]^2+[.K105]^2) -> 0.790527313464454 | L118: of:=SQRT([.L63]^2+[.L105]^2) -> 0.754498823800912 | M118: of:=SQRT([.M63]^2+[.M105]^2) -> 0.722164315676107 | N118: of:=SQRT([.N63]^2+[.N105]^2) -> 0.687948302522874 | O118: of:=SQRT([.O63]^2+[.O105]^2) -> 0.656492196994586 | Q118: Frequency | R118: 50000 | S118: of:=[.D118]^2*[.$W$112] -> 0.123414464499966 | T118: of:=[.E118]^2*[.$W$112] -> 0.112661476881753 | U118: of:=[.F118]^2*[.$W$112] -> 0.100767488301249 | V118: of:=[.G118]^2*[.$W$112] -> 0.0919877106762197 | W118: of:=[.H118]^2*[.$W$112] -> 0.0832060149918519 | X118: of:=[.I118]^2*[.$W$112] -> 0.0751076512545023 | Y118: of:=[.J118]^2*[.$W$112] -> 0.0679374267534682 | Z118: of:=[.K118]^2*[.$W$112] -> 0.0624933433333327 | AA118: of:=[.L118]^2*[.$W$112] -> 0.0569268475116959 | AB118: of:=[.M118]^2*[.$W$112] -> 0.052152129883594 | AC118: of:=[.N118]^2*[.$W$112] -> 0.0473272866944104 | AD118: of:=[.O118]^2*[.$W$112] -> 0.0430982004714778
C119: 100000 | D119: of:=SQRT([.D64]^2+[.D106]^2) -> 0.9341691749594 | E119: of:=SQRT([.E64]^2+[.E106]^2) -> 0.892545204914459 | F119: of:=SQRT([.F64]^2+[.F106]^2) -> 0.844117138203869 | G119: of:=SQRT([.G64]^2+[.G106]^2) -> 0.806505635473064 | H119: of:=SQRT([.H64]^2+[.H106]^2) -> 0.767043267594782 | I119: of:=SQRT([.I64]^2+[.I106]^2) -> 0.728760108136092 | J119: of:=SQRT([.J64]^2+[.J106]^2) -> 0.693101833454087 | K119: of:=SQRT([.K64]^2+[.K106]^2) -> 0.664751584052409 | L119: of:=SQRT([.L64]^2+[.L106]^2) -> 0.634455356247331 | M119: of:=SQRT([.M64]^2+[.M106]^2) -> 0.60726538427619 | N119: of:=SQRT([.N64]^2+[.N106]^2) -> 0.578493261471363 | O119: of:=SQRT([.O64]^2+[.O106]^2) -> 0.552041935094782 | R119: 100000 | S119: of:=[.D119]^2*[.$W$112] -> 0.0872672047444325 | T119: of:=[.E119]^2*[.$W$112] -> 0.0796636942815793 | U119: of:=[.F119]^2*[.$W$112] -> 0.071253374300949 | V119: of:=[.G119]^2*[.$W$112] -> 0.0650451340049811 | W119: of:=[.H119]^2*[.$W$112] -> 0.058835537436248 | X119: of:=[.I119]^2*[.$W$112] -> 0.0531091295210528 | Y119: of:=[.J119]^2*[.$W$112] -> 0.0480390151537417 | Z119: of:=[.K119]^2*[.$W$112] -> 0.0441894668500187 | AA119: of:=[.L119]^2*[.$W$112] -> 0.0402533599070927 | AB119: of:=[.M119]^2*[.$W$112] -> 0.0368771246940109 | AC119: of:=[.N119]^2*[.$W$112] -> 0.0334654453567774 | AD119: of:=[.O119]^2*[.$W$112] -> 0.0304750298103192
C120: 150000 | D120: of:=SQRT([.D65]^2+[.D107]^2) -> 0.844117138203869 | E120: of:=SQRT([.E65]^2+[.E107]^2) -> 0.806505635473064 | F120: of:=SQRT([.F65]^2+[.F107]^2) -> 0.762745937362424 | G120: of:=SQRT([.G65]^2+[.G107]^2) -> 0.728760108136092 | H120: of:=SQRT([.H65]^2+[.H107]^2) -> 0.693101833454087 | I120: of:=SQRT([.I65]^2+[.I107]^2) -> 0.6585090938627 | J120: of:=SQRT([.J65]^2+[.J107]^2) -> 0.62628820541477 | K120: of:=SQRT([.K65]^2+[.K107]^2) -> 0.600670863252575 | L120: of:=SQRT([.L65]^2+[.L107]^2) -> 0.573295131106086 | M120: of:=SQRT([.M65]^2+[.M107]^2) -> 0.548726217954868 | N120: of:=SQRT([.N65]^2+[.N107]^2) -> 0.522727670140317 | O120: of:=SQRT([.O65]^2+[.O107]^2) -> 0.498826198628301 | R120: 150000 | S120: of:=[.D120]^2*[.$W$112] -> 0.071253374300949 | T120: of:=[.E120]^2*[.$W$112] -> 0.0650451340049811 | U120: of:=[.F120]^2*[.$W$112] -> 0.0581781364962884 | V120: of:=[.G120]^2*[.$W$112] -> 0.0531091295210528 | W120: of:=[.H120]^2*[.$W$112] -> 0.0480390151537417 | X120: of:=[.I120]^2*[.$W$112] -> 0.0433634226699874 | Y120: of:=[.J120]^2*[.$W$112] -> 0.0392236916241653 | Z120: of:=[.K120]^2*[.$W$112] -> 0.0360805485960593 | AA120: of:=[.L120]^2*[.$W$112] -> 0.0328667307349944 | AB120: of:=[.M120]^2*[.$W$112] -> 0.0301100462271053 | AC120: of:=[.N120]^2*[.$W$112] -> 0.0273244217130324 | AD120: of:=[.O120]^2*[.$W$112] -> 0.0248827576437961
C121: 200000 | D121: of:=SQRT([.D66]^2+[.D108]^2) -> 0.785539510463879 | E121: of:=SQRT([.E66]^2+[.E108]^2) -> 0.75053806326446 | F121: of:=SQRT([.F66]^2+[.F108]^2) -> 0.709815075569858 | G121: of:=SQRT([.G66]^2+[.G108]^2) -> 0.678187697751219 | H121: of:=SQRT([.H66]^2+[.H108]^2) -> 0.645003934064948 | I121: of:=SQRT([.I66]^2+[.I108]^2) -> 0.612811762511549 | J121: of:=SQRT([.J66]^2+[.J108]^2) -> 0.582826847157319 | K121: of:=SQRT([.K66]^2+[.K108]^2) -> 0.558987224063899 | L121: of:=SQRT([.L66]^2+[.L108]^2) -> 0.533511234706899 | M121: of:=SQRT([.M66]^2+[.M108]^2) -> 0.510647284745518 | N121: of:=SQRT([.N66]^2+[.N108]^2) -> 0.486452909819699 | O121: of:=SQRT([.O66]^2+[.O108]^2) -> 0.464210084290926 | R121: 200000 | S121: of:=[.D121]^2*[.$W$112] -> 0.0617072322499831 | T121: of:=[.E121]^2*[.$W$112] -> 0.0563307384408767 | U121: of:=[.F121]^2*[.$W$112] -> 0.0503837441506243 | V121: of:=[.G121]^2*[.$W$112] -> 0.0459938553381099 | W121: of:=[.H121]^2*[.$W$112] -> 0.0416030074959259 | X121: of:=[.I121]^2*[.$W$112] -> 0.0375538256272511 | Y121: of:=[.J121]^2*[.$W$112] -> 0.0339687133767341 | Z121: of:=[.K121]^2*[.$W$112] -> 0.0312466716666663 | AA121: of:=[.L121]^2*[.$W$112] -> 0.028463423755848 | AB121: of:=[.M121]^2*[.$W$112] -> 0.026076064941797 | AC121: of:=[.N121]^2*[.$W$112] -> 0.0236636433472052 | AD121: of:=[.O121]^2*[.$W$112] -> 0.0215491002357389
C122: 250000 | D122: of:=SQRT([.D67]^2+[.D109]^2) -> 0.742917400561676 | E122: of:=SQRT([.E67]^2+[.E109]^2) -> 0.709815075569858 | F122: of:=SQRT([.F67]^2+[.F109]^2) -> 0.671301651664148 | G122: of:=SQRT([.G67]^2+[.G109]^2) -> 0.641390324477397 | H122: of:=SQRT([.H67]^2+[.H109]^2) -> 0.610007058415962 | I122: of:=SQRT([.I67]^2+[.I109]^2) -> 0.579561582293744 | J122: of:=SQRT([.J67]^2+[.J109]^2) -> 0.551203600200811 | K122: of:=SQRT([.K67]^2+[.K109]^2) -> 0.52865747669841 | L122: of:=SQRT([.L67]^2+[.L109]^2) -> 0.504563773532973 | M122: of:=SQRT([.M67]^2+[.M109]^2) -> 0.482940384708329 | N122: of:=SQRT([.N67]^2+[.N109]^2) -> 0.460058757637159 | O122: of:=SQRT([.O67]^2+[.O109]^2) -> 0.4390227920328 | R122: 250000 | S122: of:=[.D122]^2*[.$W$112] -> 0.0551926264057318 | T122: of:=[.E122]^2*[.$W$112] -> 0.0503837441506243 | U122: of:=[.F122]^2*[.$W$112] -> 0.0450645907527013 | V122: of:=[.G122]^2*[.$W$112] -> 0.0411381548333221 | W122: of:=[.H122]^2*[.$W$112] -> 0.0372108611317295 | X122: of:=[.I122]^2*[.$W$112] -> 0.0335891627670829 | Y122: of:=[.J122]^2*[.$W$112] -> 0.0303825408874335 | Z122: of:=[.K122]^2*[.$W$112] -> 0.027947872766913 | AA122: of:=[.L122]^2*[.$W$112] -> 0.0254584601561834 | AB122: of:=[.M122]^2*[.$W$112] -> 0.0233231415182229 | AC122: of:=[.N122]^2*[.$W$112] -> 0.0211654060478646 | AD122: of:=[.O122]^2*[.$W$112] -> 0.0192741011924275
C123: 300000 | D123: of:=SQRT([.D68]^2+[.D110]^2) -> 0.709815075569858 | E123: of:=SQRT([.E68]^2+[.E110]^2) -> 0.678187697751219 | F123: of:=SQRT([.F68]^2+[.F110]^2) -> 0.641390324477397 | G123: of:=SQRT([.G68]^2+[.G110]^2) -> 0.612811762511549 | H123: of:=SQRT([.H68]^2+[.H110]^2) -> 0.582826847157319 | I123: of:=SQRT([.I68]^2+[.I110]^2) -> 0.553737936441116 | J123: of:=SQRT([.J68]^2+[.J110]^2) -> 0.526643506848962 | K123: of:=SQRT([.K68]^2+[.K110]^2) -> 0.505101975656444 | L123: of:=SQRT([.L68]^2+[.L110]^2) -> 0.482081820629516 | M123: of:=SQRT([.M68]^2+[.M110]^2) -> 0.461421909633977 | N123: of:=SQRT([.N68]^2+[.N110]^2) -> 0.439559823974919 | O123: of:=SQRT([.O68]^2+[.O110]^2) -> 0.419461162261176 | R123: 300000 | S123: of:=[.D123]^2*[.$W$112] -> 0.0503837441506243 | T123: of:=[.E123]^2*[.$W$112] -> 0.0459938553381099 | U123: of:=[.F123]^2*[.$W$112] -> 0.0411381548333221 | V123: of:=[.G123]^2*[.$W$112] -> 0.0375538256272511 | W123: of:=[.H123]^2*[.$W$112] -> 0.0339687133767341 | X123: of:=[.I123]^2*[.$W$112] -> 0.0306625702254066 | Y123: of:=[.J123]^2*[.$W$112] -> 0.0277353383306173 | Z123: of:=[.K123]^2*[.$W$112] -> 0.0255128005812043 | AA123: of:=[.L123]^2*[.$W$112] -> 0.0232402881781469 | AB123: of:=[.M123]^2*[.$W$112] -> 0.0212910178690266 | AC123: of:=[.N123]^2*[.$W$112] -> 0.0193212838852862 | AD123: of:=[.O123]^2*[.$W$112] -> 0.0175947666645496
Q126: Total Losses | S126: Inductance
S127: 0.00001 | T127: 0.000012 | U127: 0.000015 | V127: 0.000018 | W127: 0.000022 | X127: 0.000027 | Y127: 0.000033 | Z127: 0.000039 | AA127: 0.000047 | AB127: 0.000056 | AC127: 0.000068 | AD127: 0.000082
R128: 20000 | S128: of:=[.S87]+[.S102]+[.S115] -> 0.615577727811469 | T128: of:=[.T87]+[.T102]+[.T115] -> 0.575605336618086 | U128: of:=[.U87]+[.U102]+[.U115] -> 0.530740817077152 | V128: of:=[.V87]+[.V102]+[.V115] -> 0.497116180677127 | W128: of:=[.W87]+[.W102]+[.W115] -> 0.462983957598289 | X128: of:=[.X87]+[.X102]+[.X115] -> 0.43099576225993 | Y128: of:=[.Y87]+[.Y102]+[.Y115] -> 0.402198806232419 | Z128: of:=[.Z87]+[.Z102]+[.Z115] -> 0.379992696513808 | AA128: of:=[.AA87]+[.AA102]+[.AA115] -> 0.356940205609125 | AB128: of:=[.AB87]+[.AB102]+[.AB115] -> 0.33685194228087 | AC128: of:=[.AC87]+[.AC102]+[.AC115] -> 0.31622148499269 | AD128: of:=[.AD87]+[.AD102]+[.AD115] -> 0.297836869227343
R129: 30000 | S129: of:=[.S88]+[.S103]+[.S116] -> 0.546525754347806 | T129: of:=[.T88]+[.T103]+[.T116] -> 0.51290912114331 | U129: of:=[.U88]+[.U103]+[.U116] -> 0.475142751182548 | V129: of:=[.V88]+[.V103]+[.V116] -> 0.446812132240751 | W129: of:=[.W88]+[.W103]+[.W116] -> 0.418030837963355 | X129: of:=[.X88]+[.X103]+[.X116] -> 0.391037462472844 | Y129: of:=[.Y88]+[.Y103]+[.Y116] -> 0.366723673487034 | Z129: of:=[.Z88]+[.Z103]+[.Z116] -> 0.347970704124717 | AA129: of:=[.AA88]+[.AA103]+[.AA116] -> 0.328508471389708 | AB129: of:=[.AB88]+[.AB103]+[.AB116] -> 0.311568871001876 | AC129: of:=[.AC88]+[.AC103]+[.AC116] -> 0.294227480157723 | AD129: of:=[.AD88]+[.AD103]+[.AD116] -> 0.278901552817919
R130: 40000 | S130: of:=[.S89]+[.S104]+[.S117] -> 0.510431972089879 | T130: of:=[.T89]+[.T104]+[.T117] -> 0.480674042899842 | U130: of:=[.U89]+[.U104]+[.U117] -> 0.447224427461911 | V130: of:=[.V89]+[.V104]+[.V117] -> 0.422120609189463 | W130: of:=[.W89]+[.W104]+[.W117] -> 0.396610448904518 | X130: of:=[.X89]+[.X104]+[.X117] -> 0.372684685229583 | Y130: of:=[.Y89]+[.Y104]+[.Y117] -> 0.351144920787493 | Z130: of:=[.Z89]+[.Z104]+[.Z117] -> 0.334553300882336 | AA130: of:=[.AA89]+[.AA104]+[.AA117] -> 0.317383650623103 | AB130: of:=[.AB89]+[.AB104]+[.AB117] -> 0.3025368047428 | AC130: of:=[.AC89]+[.AC104]+[.AC117] -> 0.287596564522708 | AD130: of:=[.AD89]+[.AD104]+[.AD117] -> 0.275170924361892
Q131: Frequency | R131: 50000 | S131: of:=[.S90]+[.S105]+[.S118] -> 0.490129571965145 | T131: of:=[.T90]+[.T105]+[.T118] -> 0.463048599153023 | U131: of:=[.U90]+[.U105]+[.U118] -> 0.432600838546122 | V131: of:=[.V90]+[.V105]+[.V118] -> 0.409748715060945 | W131: of:=[.W90]+[.W105]+[.W118] -> 0.386532819003457 | X131: of:=[.X90]+[.X105]+[.X118] -> 0.364777877430435 | Y131: of:=[.Y90]+[.Y105]+[.Y118] -> 0.345233482602898 | Z131: of:=[.Z90]+[.Z105]+[.Z118] -> 0.330241376407437 | AA131: of:=[.AA90]+[.AA105]+[.AA118] -> 0.314867777986363 | AB131: of:=[.AB90]+[.AB105]+[.AB118] -> 0.30189071225293 | AC131: of:=[.AC90]+[.AC105]+[.AC118] -> 0.29002184248938 | AD131: of:=[.AD90]+[.AD105]+[.AD118] -> 0.289498307706491
R132: 100000 | S132: of:=[.S91]+[.S106]+[.S119] -> 0.476710441769667 | T132: of:=[.T91]+[.T106]+[.T119] -> 0.456605300125578 | U132: of:=[.U91]+[.U106]+[.U119] -> 0.434107916381291 | V132: of:=[.V91]+[.V106]+[.V119] -> 0.41739187529556 | W132: of:=[.W91]+[.W106]+[.W119] -> 0.400764256020733 | X132: of:=[.X91]+[.X106]+[.X119] -> 0.386042110252869 | Y132: of:=[.Y91]+[.Y106]+[.Y119] -> 0.375341853491023 | Z132: of:=[.Z91]+[.Z106]+[.Z119] -> 0.376640579254035 | AA132: of:=[.AA91]+[.AA106]+[.AA119] -> 0.260450228024124 | AB132: of:=[.AB91]+[.AB106]+[.AB119] -> 0.313854531837041 | AC132: of:=[.AC91]+[.AC106]+[.AC119] -> 0.310276136814442 | AD132: of:=[.AD91]+[.AD106]+[.AD119] -> 0.303001895595454
R133: 150000 | S133: of:=[.S92]+[.S107]+[.S120] -> 0.513911843219812 | T133: of:=[.T92]+[.T107]+[.T120] -> 0.497502149034679 | U133: of:=[.U92]+[.U107]+[.U120] -> 0.479735546065854 | V133: of:=[.V92]+[.V107]+[.V120] -> 0.467633734133166 | W133: of:=[.W92]+[.W107]+[.W120] -> 0.459112328603224 | X133: of:=[.X92]+[.X107]+[.X120] -> 0.477284681797785 | Y133: of:=[.Y92]+[.Y107]+[.Y120] -> 0.360781228715279 | Z133: of:=[.Z92]+[.Z107]+[.Z120] -> 0.385530036168094 | AA133: of:=[.AA92]+[.AA107]+[.AA120] -> 0.383313233273299 | AB133: of:=[.AB92]+[.AB107]+[.AB120] -> 0.377401455685009 | AC133: of:=[.AC92]+[.AC107]+[.AC120] -> 0.369904732270131 | AD133: of:=[.AD92]+[.AD107]+[.AD120] -> 0.362579504939722
R134: 200000 | S134: of:=[.S93]+[.S108]+[.S121] -> 0.569123639471651 | T134: of:=[.T93]+[.T108]+[.T121] -> 0.556115699226455 | U134: of:=[.U93]+[.U108]+[.U121] -> 0.54466930881891 | V134: of:=[.V93]+[.V108]+[.V121] -> 0.545373674926275 | W134: of:=[.W93]+[.W108]+[.W121] -> 0.805412053221179 | X134: of:=[.X93]+[.X108]+[.X121] -> 0.450243261618758 | Y134: of:=[.Y93]+[.Y108]+[.Y121] -> 0.458592673397905 | Z134: of:=[.Z93]+[.Z108]+[.Z121] -> 0.45511024584462 | AA134: of:=[.AA93]+[.AA108]+[.AA121] -> 0.448920798601834 | AB134: of:=[.AB93]+[.AB108]+[.AB121] -> 0.442495917276859 | AC134: of:=[.AC93]+[.AC108]+[.AC121] -> 0.435309793249037 | AD134: of:=[.AD93]+[.AD108]+[.AD121] -> 0.428556928353576
R135: 250000 | S135: of:=[.S94]+[.S109]+[.S122] -> 0.634714985101991 | T135: of:=[.T94]+[.T109]+[.T122] -> 0.627135274774514 | U135: of:=[.U94]+[.U109]+[.U122] -> 0.637127831035829 | V135: of:=[.V94]+[.V109]+[.V122] -> 0.532273750059006 | W135: of:=[.W94]+[.W109]+[.W122] -> 0.522188755765919 | X135: of:=[.X94]+[.X109]+[.X122] -> 0.532267635702517 | Y135: of:=[.Y94]+[.Y109]+[.Y122] -> 0.528705035170936 | Z135: of:=[.Z94]+[.Z109]+[.Z122] -> 0.52353191103226 | AA135: of:=[.AA94]+[.AA109]+[.AA122] -> 0.517071409061907 | AB135: of:=[.AB94]+[.AB109]+[.AB122] -> 0.510877734952076 | AC135: of:=[.AC94]+[.AC109]+[.AC122] -> 0.504134702874153 | AD135: of:=[.AD94]+[.AD109]+[.AD122] -> 0.497869625266323
R136: 300000 | S136: of:=[.S95]+[.S110]+[.S123] -> 0.709601240730117 | T136: of:=[.T95]+[.T110]+[.T123] -> 0.717245692207277 | U136: of:=[.U95]+[.U110]+[.U123] -> 0.601383863909881 | V136: of:=[.V95]+[.V110]+[.V123] -> 0.587634835719457 | W136: of:=[.W95]+[.W110]+[.W123] -> 0.605920060783931 | X136: of:=[.X95]+[.X110]+[.X123] -> 0.604428128572595 | Y136: of:=[.Y95]+[.Y110]+[.Y123] -> 0.598990726400434 | Z136: of:=[.Z95]+[.Z110]+[.Z123] -> 0.59357081686073 | AA136: of:=[.AA95]+[.AA110]+[.AA123] -> 0.587265096274841 | AB136: of:=[.AB95]+[.AB110]+[.AB123] -> 0.581372300946591 | AC136: of:=[.AC95]+[.AC110]+[.AC123] -> 0.575024456190012 | AD136: of:=[.AD95]+[.AD110]+[.AD123] -> 0.569155244353367
Q138: Efficiency | S138: Inductance
S139: 0.00001 | T139: 0.000012 | U139: 0.000015 | V139: 0.000018 | W139: 0.000022 | X139: 0.000027 | Y139: 0.000033 | Z139: 0.000039 | AA139: 0.000047 | AB139: 0.000056 | AC139: 0.000068 | AD139: 0.000082
R140: 20000 | S140: of:=(VOUT*IOUT)/(VOUT*IOUT+[.S128]) -> 0.814337717783562 | T140: of:=(VOUT*IOUT)/(VOUT*IOUT+[.T128]) -> 0.824275125521571 | U140: of:=(VOUT*IOUT)/(VOUT*IOUT+[.U128]) -> 0.835721635647234 | V140: of:=(VOUT*IOUT)/(VOUT*IOUT+[.V128]) -> 0.844511067917513 | W140: of:=(VOUT*IOUT)/(VOUT*IOUT+[.W128]) -> 0.853624310522953 | X140: of:=(VOUT*IOUT)/(VOUT*IOUT+[.X128]) -> 0.862345466111765 | Y140: of:=(VOUT*IOUT)/(VOUT*IOUT+[.Y128]) -> 0.870350409063278 | Z140: of:=(VOUT*IOUT)/(VOUT*IOUT+[.Z128]) -> 0.876625455331789 | AA140: of:=(VOUT*IOUT)/(VOUT*IOUT+[.AA128]) -> 0.883236117947554 | AB140: of:=(VOUT*IOUT)/(VOUT*IOUT+[.AB128]) -> 0.88907857587951 | AC140: of:=(VOUT*IOUT)/(VOUT*IOUT+[.AC128]) -> 0.895159726642735 | AD140: of:=(VOUT*IOUT)/(VOUT*IOUT+[.AD128]) -> 0.9006494074829
R141: 30000 | S141: of:=(VOUT*IOUT)/(VOUT*IOUT+[.S129]) -> 0.831658272349791 | T141: of:=(VOUT*IOUT)/(VOUT*IOUT+[.T129]) -> 0.840359903811785 | U141: of:=(VOUT*IOUT)/(VOUT*IOUT+[.U129]) -> 0.850355467953185 | V141: of:=(VOUT*IOUT)/(VOUT*IOUT+[.V129]) -> 0.858011182916538 | W141: of:=(VOUT*IOUT)/(VOUT*IOUT+[.W129]) -> 0.865931140618094 | X141: of:=(VOUT*IOUT)/(VOUT*IOUT+[.X129]) -> 0.87349313386839 | Y141: of:=(VOUT*IOUT)/(VOUT*IOUT+[.Y129]) -> 0.880418416351791 | Z141: of:=(VOUT*IOUT)/(VOUT*IOUT+[.Z129]) -> 0.88583528586616 | AA141: of:=(VOUT*IOUT)/(VOUT*IOUT+[.AA129]) -> 0.891527966821581 | AB141: of:=(VOUT*IOUT)/(VOUT*IOUT+[.AB129]) -> 0.896542671163212 | AC141: of:=(VOUT*IOUT)/(VOUT*IOUT+[.AC129]) -> 0.901735094575304 | AD141: of:=(VOUT*IOUT)/(VOUT*IOUT+[.AD129]) -> 0.90637436388118
R142: 40000 | S142: of:=(VOUT*IOUT)/(VOUT*IOUT+[.S130]) -> 0.841008320211312 | T142: of:=(VOUT*IOUT)/(VOUT*IOUT+[.T130]) -> 0.848876673177862 | U142: of:=(VOUT*IOUT)/(VOUT*IOUT+[.U130]) -> 0.857898781046709 | V142: of:=(VOUT*IOUT)/(VOUT*IOUT+[.V130]) -> 0.864796828172807 | W142: of:=(VOUT*IOUT)/(VOUT*IOUT+[.W130]) -> 0.871921103590919 | X142: of:=(VOUT*IOUT)/(VOUT*IOUT+[.X130]) -> 0.878710403634619 | Y142: of:=(VOUT*IOUT)/(VOUT*IOUT+[.Y130]) -> 0.884913719307419 | Z142: of:=(VOUT*IOUT)/(VOUT*IOUT+[.Z130]) -> 0.889752043312253 | AA142: of:=(VOUT*IOUT)/(VOUT*IOUT+[.AA130]) -> 0.894814949846513 | AB142: of:=(VOUT*IOUT)/(VOUT*IOUT+[.AB130]) -> 0.899239601571273 | AC142: of:=(VOUT*IOUT)/(VOUT*IOUT+[.AC130]) -> 0.903736479035397 | AD142: of:=(VOUT*IOUT)/(VOUT*IOUT+[.AD130]) -> 0.907510885472602
Q143: Frequency | R143: 50000 | S143: of:=(VOUT*IOUT)/(VOUT*IOUT+[.S131]) -> 0.84636060670626 | T143: of:=(VOUT*IOUT)/(VOUT*IOUT+[.T131]) -> 0.85360686545347 | U143: of:=(VOUT*IOUT)/(VOUT*IOUT+[.U131]) -> 0.861903619119601 | V143: of:=(VOUT*IOUT)/(VOUT*IOUT+[.V131]) -> 0.868237355296113 | W143: of:=(VOUT*IOUT)/(VOUT*IOUT+[.W131]) -> 0.874767954313132 | X143: of:=(VOUT*IOUT)/(VOUT*IOUT+[.X131]) -> 0.88097738497895 | Y143: of:=(VOUT*IOUT)/(VOUT*IOUT+[.Y131]) -> 0.886631522812559 | Z143: of:=(VOUT*IOUT)/(VOUT*IOUT+[.Z131]) -> 0.891018128463759 | AA143: of:=(VOUT*IOUT)/(VOUT*IOUT+[.AA131]) -> 0.895561662675414 | AB143: of:=(VOUT*IOUT)/(VOUT*IOUT+[.AB131]) -> 0.899433143578248 | AC143: of:=(VOUT*IOUT)/(VOUT*IOUT+[.AC131]) -> 0.903003436841813 | AD143: of:=(VOUT*IOUT)/(VOUT*IOUT+[.AD131]) -> 0.903161574983934
R144: 100000 | S144: of:=(VOUT*IOUT)/(VOUT*IOUT+[.S132]) -> 0.849935821816954 | T144: of:=(VOUT*IOUT)/(VOUT*IOUT+[.T132]) -> 0.855349257600431 | U144: of:=(VOUT*IOUT)/(VOUT*IOUT+[.U132]) -> 0.861489161202043 | V144: of:=(VOUT*IOUT)/(VOUT*IOUT+[.V132]) -> 0.866108627983773 | W144: of:=(VOUT*IOUT)/(VOUT*IOUT+[.W132]) -> 0.870753071523392 | X144: of:=(VOUT*IOUT)/(VOUT*IOUT+[.X132]) -> 0.874907050370341 | Y144: of:=(VOUT*IOUT)/(VOUT*IOUT+[.Y132]) -> 0.877951177016322 | Z144: of:=(VOUT*IOUT)/(VOUT*IOUT+[.Z132]) -> 0.877580572201464 | AA144: of:=(VOUT*IOUT)/(VOUT*IOUT+[.AA132]) -> 0.91202343969216 | AB144: of:=(VOUT*IOUT)/(VOUT*IOUT+[.AB132]) -> 0.895862747016613 | AC144: of:=(VOUT*IOUT)/(VOUT*IOUT+[.AC132]) -> 0.896927682806274 | AD144: of:=(VOUT*IOUT)/(VOUT*IOUT+[.AD132]) -> 0.899100331558275
R145: 150000 | S145: of:=(VOUT*IOUT)/(VOUT*IOUT+[.S133]) -> 0.840097716337808 | T145: of:=(VOUT*IOUT)/(VOUT*IOUT+[.T133]) -> 0.844409127548241 | U145: of:=(VOUT*IOUT)/(VOUT*IOUT+[.U133]) -> 0.849127218564006 | V145: of:=(VOUT*IOUT)/(VOUT*IOUT+[.V133]) -> 0.852371273517474 | W145: of:=(VOUT*IOUT)/(VOUT*IOUT+[.W133]) -> 0.854670464090077 | X145: of:=(VOUT*IOUT)/(VOUT*IOUT+[.X133]) -> 0.849782210410014 | Y145: of:=(VOUT*IOUT)/(VOUT*IOUT+[.Y133]) -> 0.882127730877809 | Z145: of:=(VOUT*IOUT)/(VOUT*IOUT+[.Z133]) -> 0.875052249808308 | AA145: of:=(VOUT*IOUT)/(VOUT*IOUT+[.AA133]) -> 0.875681384188668 | AB145: of:=(VOUT*IOUT)/(VOUT*IOUT+[.AB133]) -> 0.877363593564363 | AC145: of:=(VOUT*IOUT)/(VOUT*IOUT+[.AC133]) -> 0.879506120049336 | AD145: of:=(VOUT*IOUT)/(VOUT*IOUT+[.AD133]) -> 0.881609765769376
R146: 200000 | S146: of:=(VOUT*IOUT)/(VOUT*IOUT+[.S134]) -> 0.825909417251765 | T146: of:=(VOUT*IOUT)/(VOUT*IOUT+[.T134]) -> 0.829208863997502 | U146: of:=(VOUT*IOUT)/(VOUT*IOUT+[.U134]) -> 0.8321341076767 | V146: of:=(VOUT*IOUT)/(VOUT*IOUT+[.V134]) -> 0.83195350380148 | W146: of:=(VOUT*IOUT)/(VOUT*IOUT+[.W134]) -> 0.770237552392429 | X146: of:=(VOUT*IOUT)/(VOUT*IOUT+[.X134]) -> 0.857076668616569 | Y146: of:=(VOUT*IOUT)/(VOUT*IOUT+[.Y134]) -> 0.854811075432349 | Z146: of:=(VOUT*IOUT)/(VOUT*IOUT+[.Z134]) -> 0.855754566280524 | AA146: of:=(VOUT*IOUT)/(VOUT*IOUT+[.AA134]) -> 0.857436618030799 | AB146: of:=(VOUT*IOUT)/(VOUT*IOUT+[.AB134]) -> 0.859189660408435 | AC146: of:=(VOUT*IOUT)/(VOUT*IOUT+[.AC134]) -> 0.861158921460856 | AD146: of:=(VOUT*IOUT)/(VOUT*IOUT+[.AD134]) -> 0.863017698521118
R147: 250000 | S147: of:=(VOUT*IOUT)/(VOUT*IOUT+[.S135]) -> 0.809664397725859 | T147: of:=(VOUT*IOUT)/(VOUT*IOUT+[.T135]) -> 0.811508933968122 | U147: of:=(VOUT*IOUT)/(VOUT*IOUT+[.U135]) -> 0.809078985494521 | V147: of:=(VOUT*IOUT)/(VOUT*IOUT+[.V135]) -> 0.835325287640229 | W147: of:=(VOUT*IOUT)/(VOUT*IOUT+[.W135]) -> 0.837939737443533 | X147: of:=(VOUT*IOUT)/(VOUT*IOUT+[.X135]) -> 0.835326867792979 | Y147: of:=(VOUT*IOUT)/(VOUT*IOUT+[.Y135]) -> 0.836248579721081 | Z147: of:=(VOUT*IOUT)/(VOUT*IOUT+[.Z135]) -> 0.837590591474985 | AA147: of:=(VOUT*IOUT)/(VOUT*IOUT+[.AA135]) -> 0.83927263547666 | AB147: of:=(VOUT*IOUT)/(VOUT*IOUT+[.AB135]) -> 0.840891563888931 | AC147: of:=(VOUT*IOUT)/(VOUT*IOUT+[.AC135]) -> 0.842661201970711 | AD147: of:=(VOUT*IOUT)/(VOUT*IOUT+[.AD135]) -> 0.844312094110197
R148: 300000 | S148: of:=(VOUT*IOUT)/(VOUT*IOUT+[.S136]) -> 0.791881457499069 | T148: of:=(VOUT*IOUT)/(VOUT*IOUT+[.T136]) -> 0.790110001793874 | U148: of:=(VOUT*IOUT)/(VOUT*IOUT+[.U136]) -> 0.817838855249734 | V148: of:=(VOUT*IOUT)/(VOUT*IOUT+[.V136]) -> 0.821259091996797 | W148: of:=(VOUT*IOUT)/(VOUT*IOUT+[.W136]) -> 0.816716662943069 | X148: of:=(VOUT*IOUT)/(VOUT*IOUT+[.X136]) -> 0.817085406292771 | Y148: of:=(VOUT*IOUT)/(VOUT*IOUT+[.Y136]) -> 0.818432127860511 | Z148: of:=(VOUT*IOUT)/(VOUT*IOUT+[.Z136]) -> 0.819778942106825 | AA148: of:=(VOUT*IOUT)/(VOUT*IOUT+[.AA136]) -> 0.821351464188168 | AB148: of:=(VOUT*IOUT)/(VOUT*IOUT+[.AB136]) -> 0.822826473917976 | AC148: of:=(VOUT*IOUT)/(VOUT*IOUT+[.AC136]) -> 0.824421324517691 | AD148: of:=(VOUT*IOUT)/(VOUT*IOUT+[.AD136]) -> 0.825901432690773

Sheet: Components
B1: Component Tables
B2: FETS | J2: Diodes | M2: Inductors
B3: FET | C3: RDS_ON | D3: C_OSS | E3: VG_Typ | F3: VG_Th | G3: Q_G | H3: R_G | J3: Diodes | K3: Vfwd | M3: Inductors | N3: Inductance | O3: RDC
B4: IPL65R070C7 | C4: 0.07 | D4: 0.000000000048 | E4: 12 | F4: 3.5 | G4: 0.000000064 | H4: 0.85 | J4: 1N4004 | K4: 1.1 | M4: SDR1307-820KL | N4: 0.000082 | O4: 0.14
B5: IPW50R190CE | C5: 0.17 | D5: 0.000000000068 | E5: 13 | F5: 3 | G5: 0.0000000245 | H5: 5 | J5: UF5403-E3/54 | K5: 1
B6: FDS2672 | C6: 0.08 | D6: 0.000000000135 | E6: 6 | F6: 2.9 | G6: 0.000000046 | H6: 0.7
B7: FCH029N65S3 | C7: 0.029 | D7: 0.000000000166 | E7: 10 | F7: 3 | G7: 0.000000201 | H7: 0.85
B8: test | C8: 123