Sheet: Flyback Calculations
B1: Nixie Flyback Calculations | R1: ID RMS | S1: 1.29715214861475
R2: ID Max | S2: 3.51 | T2: Rg Ext | U2: 1 | V2: Fsw | W2: 250000
B3: Input Parameters | L3: FET | M3: VDS | N3: RDS_ON(4.5V) | O3: VGS(th) | P3: gfs | Q3: VGS Miller | R3: Ciss | S3: Crss | T3: Crss VDD | U3: Cgd Avg | V3: Rg | W3: Tc On | X3: Tc Off | Y3: Switch Loss On | Z3: Switch Loss Off | AA3: Conduction Loss | AB3: Total FET Losses
B4: VinMin | C4: 4.75 | L4: DMT6030LFCL | M4: 60 | N4: 0.034 | O4: 2 | P4: of:=(14-5)/(3-2) -> 9 | Q4: of:=[.O4]+(3/[.P4]) -> 2.33333333333333 | R4: 0.000000000639 | S4: 0.0000000000131 | T4: 30 | U4: of:=2*[.S4]*SQRT([.T4]/5.25) -> 0.0000000000626299791291222 | V4: 1.4 | W4: of:=[.R4]*([.Q4]-[.O4])*(([.$U$2]+[.V4])/(5-0.5*([.O4]+[.Q4])))+[.U4]*5*(([.$U$2]+[.V4])/(5-[.Q4])) -> 0.000000000462258435492815 | X4: of:=ABS([.R4]*([.Q4]-[.O4])*(([.$U$2]+[.V4])/(0-0.5*([.O4]+[.Q4])))+[.U4]*5*(([.$U$2]+[.V4])/(0-[.Q4]))) -> 0.000000000558035497059662 | Y4: of:=0.5*5*[.$S$2]*[.W4]*[.$W$2] -> 0.00101407944286236 | Z4: of:=0.5*5*[.$S$2]*[.X4]*[.$W$2] -> 0.00122419037167463 | AA4: of:=[.$S$1]^2*[.N4] -> 0.0572085256862993 | AB4: of:=SUM([.Y4:.AA4]) -> 0.0594467955008363
B5: VinNominal | C5: 5 | L5: Si2392BDS | M5: 100 | N5: 0.18 | O5: 2 | P5: 12 | Q5: of:=[.O5]+(3/[.P5]) -> 2.25 | R5: 0.00000000029 | S5: 0.000000000005 | T5: 50 | U5: of:=2*[.S5]*SQRT([.T5]/5.25) -> 0.0000000000308606699924184 | V5: 1.5 | W5: of:=[.R5]*([.Q5]-[.O5])*(([.$U$2]+[.V5])/(5-0.5*([.O5]+[.Q5])))+[.U5]*5*(([.$U$2]+[.V5])/(5-[.Q5])) -> 0.00000000020331925095368 | X5: of:=ABS([.R5]*([.Q5]-[.O5])*(([.$U$2]+[.V5])/(0-0.5*([.O5]+[.Q5])))+[.U5]*5*(([.$U$2]+[.V5])/(0-[.Q5]))) -> 0.000000000256742284271605 | Y5: of:=0.5*5*[.$S$2]*[.W5]*[.$W$2] -> 0.000446031606779636 | Z5: of:=0.5*5*[.$S$2]*[.X5]*[.$W$2] -> 0.000563228386120834 | AA5: of:=[.$S$1]^2*[.N5] -> 0.302868665398055 | AB5: of:=SUM([.Y5:.AA5]) -> 0.303877925390956
B6: VinMax | C6: 5.5 | L6: IRL60HS118 | M6: 60 | N6: 0.023 | O6: 1.7 | P6: 17 | Q6: of:=[.O6]+(3/[.P6]) -> 1.87647058823529 | R6: 0.00000000068 | S6: 0.000000000014 | T6: 25 | U6: of:=2*[.S6]*SQRT([.T6]/5.25) -> 0.0000000000611010092660779 | V6: 1.2 | W6: of:=[.R6]*([.Q6]-[.O6])*(([.$U$2]+[.V6])/(5-0.5*([.O6]+[.Q6])))+[.U6]*5*(([.$U$2]+[.V6])/(5-[.Q6])) -> 0.00000000029737461449077 | X6: of:=ABS([.R6]*([.Q6]-[.O6])*(([.$U$2]+[.V6])/(0-0.5*([.O6]+[.Q6])))+[.U6]*5*(([.$U$2]+[.V6])/(0-[.Q6]))) -> 0.000000000505809909127825 | Y6: of:=0.5*5*[.$S$2]*[.W6]*[.$W$2] -> 0.000652365560539125 | Z6: of:=0.5*5*[.$S$2]*[.X6]*[.$W$2] -> 0.00110962048814917 | AA6: of:=[.$S$1]^2*[.N6] -> 0.0386998850230848 | AB6: of:=SUM([.Y6:.AA6]) -> 0.0404618710717731
B7: Vout | C7: 180
M8: I RMS | N8: 0.0865190246086794
B9: IN-12 Digit Current | C9: 0.0025 | L9: Diode | M9: Vf | N9: Cond Loss
B10: IN-12 Comma Current | C10: 0.0003 | L10: SE50PAJ-M3/I | M10: 0.9 | N10: of:=[.$N$8]^2*[.M10] -> 0.00673698745731354
B11: Digits Used | C11: 6 | L11: SBR1U400P1-7 | M11: 0.6 | N11: of:=[.$N$8]^2*[.M11] -> 0.00449132497154236
B12: Commas Used | C12: 3
B13: Output Current Min | C13: of:=([.C11]*[.C9])+([.C12]*[.C10]) -> 0.0159
B15: Iout | C15: 0.01
B16: Power Out | C16: of:=[.C7]*[.C15] -> 1.8
B17: I In Avg | C17: of:=(VOUT*IOUT)/VIN_NOM -> 0.36
B19: Dmax DCM | C19: 0.8
B21: Maximum Inductance for DCM vs Frequency
B22: Fsw | C22: Lp | D22: Ls | E22: T1 | F22: D1 | G22: T2 | H22: D2
B23: 50000 | C23: of:=([.$C$19]^2*VIN_MAX^2)/(2*[.B23]*POUT) -> 0.000107555555555556 | D23: of:=[.C23]/(1/[.$C$29]^2) -> 0.0072 | E23: of:=SQRT(2*IOUT*[.C23]*([.$C$7]/([.B23]*[.$C$5]^2))) -> 0.0000176 | F23: of:=[.E23]/(1/[.B23]) -> 0.88 | G23: of:=[.E23]*(([.$C$5]+[.$C$7]*[.$C$29])/([.$C$7]*[.$C$29]))-[.E23] -> 0.0000000597530864197532 | H23: of:=[.G23]/(1/[.B23]) -> 0.00298765432098766
B24: 100000 | C24: of:=([.$C$19]^2*VIN_MAX^2)/(2*[.B24]*POUT) -> 0.0000537777777777778 | D24: of:=[.C24]/(1/[.$C$29]^2) -> 0.0036 | E24: of:=SQRT(2*IOUT*[.C24]*([.$C$7]/([.B24]*[.$C$5]^2))) -> 0.0000088 | F24: of:=[.E24]/(1/[.B24]) -> 0.88 | G24: of:=[.E24]*(([.$C$5]+[.$C$7]*[.$C$29])/([.$C$7]*[.$C$29]))-[.E24] -> 0.0000000298765432098766 | H24: of:=[.G24]/(1/[.B24]) -> 0.00298765432098766
B25: 150000 | C25: of:=([.$C$19]^2*VIN_MAX^2)/(2*[.B25]*POUT) -> 0.0000358518518518519 | D25: of:=[.C25]/(1/[.$C$29]^2) -> 0.0024 | E25: of:=SQRT(2*IOUT*[.C25]*([.$C$7]/([.B25]*[.$C$5]^2))) -> 0.00000586666666666667 | F25: of:=[.E25]/(1/[.B25]) -> 0.88 | G25: of:=[.E25]*(([.$C$5]+[.$C$7]*[.$C$29])/([.$C$7]*[.$C$29]))-[.E25] -> 0.0000000199176954732516 | H25: of:=[.G25]/(1/[.B25]) -> 0.00298765432098775
B26: 200000 | C26: of:=([.$C$19]^2*VIN_MAX^2)/(2*[.B26]*POUT) -> 0.0000268888888888889 | D26: of:=[.C26]/(1/[.$C$29]^2) -> 0.0018 | E26: of:=SQRT(2*IOUT*[.C26]*([.$C$7]/([.B26]*[.$C$5]^2))) -> 0.0000044 | F26: of:=[.E26]/(1/[.B26]) -> 0.88 | G26: of:=[.E26]*(([.$C$5]+[.$C$7]*[.$C$29])/([.$C$7]*[.$C$29]))-[.E26] -> 0.0000000149382716049383 | H26: of:=[.G26]/(1/[.B26]) -> 0.00298765432098766
B27: 250000 | C27: of:=([.$C$19]^2*VIN_MAX^2)/(2*[.B27]*POUT) -> 0.0000215111111111111 | D27: of:=[.C27]/(1/[.$C$29]^2) -> 0.00144 | E27: of:=SQRT(2*IOUT*[.C27]*([.$C$7]/([.B27]*[.$C$5]^2))) -> 0.00000352 | F27: of:=[.E27]/(1/[.B27]) -> 0.88 | G27: of:=[.E27]*(([.$C$5]+[.$C$7]*[.$C$29])/([.$C$7]*[.$C$29]))-[.E27] -> 0.0000000119506172839508 | H27: of:=[.G27]/(1/[.B27]) -> 0.0029876543209877
B29: Ns1 | C29: of:=((1-[.C19])*[.C7])/([.C6]*[.C19]) -> 8.18181818181818
B31: Transformer | C31: Np | D31: Ns | E31: Lp | F31: Ls | G31: Isat | H31: Rpri | I31: Rsec | J31: VFET Max
B32: CJ5143 | C32: 1 | D32: 10 | E32: 0.000015 | F32: of:=[.E32]/(([.C32]/[.D32])^2) -> 0.0015 | G32: 1.2 | H32: 1 | I32: 25 | J32: of:=(VIN_MAX+(VOUT))*[.C32]/[.D32] -> 18.55
B33: 750312367 | C33: 1 | D33: 8.4 | E33: of:=[.F33]/([.D33]^2) -> 0.00000425170068027211 | F33: 0.0003 | G33: of:=0.45*[.D33] -> 3.78 | H33: 0.03 | I33: 0.8 | J33: of:=(VIN_MAX+(VOUT))*[.C33]/[.D33] -> 22.0833333333333
B34: 750315839 | C34: 1 | D34: 10 | E34: 0.00004 | F34: of:=[.E34]/(([.C34]/[.D34])^2) -> 0.004 | G34: 3.2 | H34: 0.085 | I34: 8.4 | J34: of:=(VIN_MAX+(VOUT))*[.C34]/[.D34] -> 18.55
B35: 750315831 | C35: 1 | D35: 10 | E35: of:=[.F35]/([.D35]^2) -> 0.0000015 | F35: 0.00015 | G35: of:=0.8*[.D35] -> 8 | H35: 0.018 | I35: 0.495 | J35: of:=(VIN_MAX+(VOUT))*[.C35]/[.D35] -> 18.55
B36: 750315825 | C36: 1 | D36: 8 | E36: of:=[.F36]/([.D36]^2) -> 0.00000234375 | F36: 0.00015 | G36: of:=0.9*[.D36] -> 7.2 | H36: 0.013 | I36: 0.818 | J36: of:=(VIN_MAX+(VOUT))*[.C36]/[.D36] -> 23.1875
B38: Primary Side Calculations | P38: APPENDIXA.FM
B39: T1 (Primary On) at Frequency | I39: Peak Current at Frequency
B40: Fsw | C40: of:=TRANSPOSE([.$B$32:.$B$36]) -> CJ5143 | D40: 750312367 | E40: 750315839 | F40: 750315831 | G40: 750315825 | I40: Fsw | J40: of:=TRANSPOSE([.$B$32:.$B$36]) -> CJ5143 | K40: 750312367 | L40: 750315839 | M40: 750315831 | N40: 750315825 | X40: Total Conducted Losses
B41: 50000 | C41: of:=SQRT(2*IOUT*VLOOKUP([.C$40];[.$B$32:.$E$36];4;FALSE())*([.$C$7]/([.$B41]*[.$C$5]^2))) -> 0.00000657267069006199 | D41: of:=SQRT(2*IOUT*VLOOKUP([.D$40];[.$B$32:.$E$36];4;FALSE())*([.$C$7]/([.$B41]*[.$C$5]^2))) -> 0.00000349927106111883 | E41: of:=SQRT(2*IOUT*VLOOKUP([.E$40];[.$B$32:.$E$36];4;FALSE())*([.$C$7]/([.$B41]*[.$C$5]^2))) -> 0.000010733126291999 | F41: of:=SQRT(2*IOUT*VLOOKUP([.F$40];[.$B$32:.$E$36];4;FALSE())*([.$C$7]/([.$B41]*[.$C$5]^2))) -> 0.00000207846096908265 | G41: of:=SQRT(2*IOUT*VLOOKUP([.G$40];[.$B$32:.$E$36];4;FALSE())*([.$C$7]/([.$B41]*[.$C$5]^2))) -> 0.00000259807621135332 | I41: 50000 | J41: of:=(1/VLOOKUP([.J$40];[.$B$32:.$E$36];4;FALSE()))*[.$C$5]*[.C41] -> 2.19089023002067 | K41: of:=(1/VLOOKUP([.K$40];[.$B$32:.$E$36];4;FALSE()))*[.$C$5]*[.D41] -> 4.11514276787574 | L41: of:=(1/VLOOKUP([.L$40];[.$B$32:.$E$36];4;FALSE()))*[.$C$5]*[.E41] -> 1.34164078649987 | M41: of:=(1/VLOOKUP([.M$40];[.$B$32:.$E$36];4;FALSE()))*[.$C$5]*[.F41] -> 6.92820323027551 | N41: of:=(1/VLOOKUP([.N$40];[.$B$32:.$E$36];4;FALSE()))*[.$C$5]*[.G41] -> 5.54256258422041 | X41: Fsw | Y41: of:=TRANSPOSE([.$B$32:.$B$36]) -> CJ5143 | Z41: 750312367 | AA41: 750315839 | AB41: 750315831 | AC41: 750315825
B42: 100000 | C42: of:=SQRT(2*IOUT*VLOOKUP([.C$40];[.$B$32:.$E$36];4;FALSE())*([.$C$7]/([.$B42]*[.$C$5]^2))) -> 0.0000046475800154489 | D42: of:=SQRT(2*IOUT*VLOOKUP([.D$40];[.$B$32:.$E$36];4;FALSE())*([.$C$7]/([.$B42]*[.$C$5]^2))) -> 0.00000247435829652697 | E42: of:=SQRT(2*IOUT*VLOOKUP([.E$40];[.$B$32:.$E$36];4;FALSE())*([.$C$7]/([.$B42]*[.$C$5]^2))) -> 0.00000758946638440411 | F42: of:=SQRT(2*IOUT*VLOOKUP([.F$40];[.$B$32:.$E$36];4;FALSE())*([.$C$7]/([.$B42]*[.$C$5]^2))) -> 0.00000146969384566991 | G42: of:=SQRT(2*IOUT*VLOOKUP([.G$40];[.$B$32:.$E$36];4;FALSE())*([.$C$7]/([.$B42]*[.$C$5]^2))) -> 0.00000183711730708738 | I42: 100000 | J42: of:=(1/VLOOKUP([.J$40];[.$B$32:.$E$36];4;FALSE()))*[.$C$5]*[.C42] -> 1.54919333848297 | K42: of:=(1/VLOOKUP([.K$40];[.$B$32:.$E$36];4;FALSE()))*[.$C$5]*[.D42] -> 2.90984535671571 | L42: of:=(1/VLOOKUP([.L$40];[.$B$32:.$E$36];4;FALSE()))*[.$C$5]*[.E42] -> 0.948683298050514 | M42: of:=(1/VLOOKUP([.M$40];[.$B$32:.$E$36];4;FALSE()))*[.$C$5]*[.F42] -> 4.89897948556636 | N42: of:=(1/VLOOKUP([.N$40];[.$B$32:.$E$36];4;FALSE()))*[.$C$5]*[.G42] -> 3.91918358845309 | X42: 50000 | Y42: of:=[.Q49]+[.Q73] -> 0.525959714553628 | Z42: of:=[.R49]+[.R73] -> 0.0297228972635195 | AA42: of:=[.S49]+[.S73] -> 0.0273770746757209 | AB42: of:=[.T49]+[.T73] -> 0.0299381517986665 | AC42: of:=[.U49]+[.U73] -> 0.0173697271861372
B43: 150000 | C43: of:=SQRT(2*IOUT*VLOOKUP([.C$40];[.$B$32:.$E$36];4;FALSE())*([.$C$7]/([.$B43]*[.$C$5]^2))) -> 0.00000379473319220206 | D43: of:=SQRT(2*IOUT*VLOOKUP([.D$40];[.$B$32:.$E$36];4;FALSE())*([.$C$7]/([.$B43]*[.$C$5]^2))) -> 0.00000202030508910442 | E43: of:=SQRT(2*IOUT*VLOOKUP([.E$40];[.$B$32:.$E$36];4;FALSE())*([.$C$7]/([.$B43]*[.$C$5]^2))) -> 0.00000619677335393187 | F43: of:=SQRT(2*IOUT*VLOOKUP([.F$40];[.$B$32:.$E$36];4;FALSE())*([.$C$7]/([.$B43]*[.$C$5]^2))) -> 0.0000012 | G43: of:=SQRT(2*IOUT*VLOOKUP([.G$40];[.$B$32:.$E$36];4;FALSE())*([.$C$7]/([.$B43]*[.$C$5]^2))) -> 0.0000015 | I43: 150000 | J43: of:=(1/VLOOKUP([.J$40];[.$B$32:.$E$36];4;FALSE()))*[.$C$5]*[.C43] -> 1.26491106406735 | K43: of:=(1/VLOOKUP([.K$40];[.$B$32:.$E$36];4;FALSE()))*[.$C$5]*[.D43] -> 2.3758787847868 | L43: of:=(1/VLOOKUP([.L$40];[.$B$32:.$E$36];4;FALSE()))*[.$C$5]*[.E43] -> 0.774596669241483 | M43: of:=(1/VLOOKUP([.M$40];[.$B$32:.$E$36];4;FALSE()))*[.$C$5]*[.F43] -> 4 | N43: of:=(1/VLOOKUP([.N$40];[.$B$32:.$E$36];4;FALSE()))*[.$C$5]*[.G43] -> 3.2 | X43: 100000 | Y43: of:=[.Q50]+[.Q74] -> 0.371909680791811 | Z43: of:=[.R50]+[.R74] -> 0.0210172622115457 | AA43: of:=[.S50]+[.S74] -> 0.0193585151522528 | AB43: of:=[.T50]+[.T74] -> 0.0211694701530293 | AC43: of:=[.U50]+[.U74] -> 0.0122822518806779
B44: 200000 | C44: of:=SQRT(2*IOUT*VLOOKUP([.C$40];[.$B$32:.$E$36];4;FALSE())*([.$C$7]/([.$B44]*[.$C$5]^2))) -> 0.000003286335345031 | D44: of:=SQRT(2*IOUT*VLOOKUP([.D$40];[.$B$32:.$E$36];4;FALSE())*([.$C$7]/([.$B44]*[.$C$5]^2))) -> 0.00000174963553055941 | E44: of:=SQRT(2*IOUT*VLOOKUP([.E$40];[.$B$32:.$E$36];4;FALSE())*([.$C$7]/([.$B44]*[.$C$5]^2))) -> 0.0000053665631459995 | F44: of:=SQRT(2*IOUT*VLOOKUP([.F$40];[.$B$32:.$E$36];4;FALSE())*([.$C$7]/([.$B44]*[.$C$5]^2))) -> 0.00000103923048454133 | G44: of:=SQRT(2*IOUT*VLOOKUP([.G$40];[.$B$32:.$E$36];4;FALSE())*([.$C$7]/([.$B44]*[.$C$5]^2))) -> 0.00000129903810567666 | I44: 200000 | J44: of:=(1/VLOOKUP([.J$40];[.$B$32:.$E$36];4;FALSE()))*[.$C$5]*[.C44] -> 1.09544511501033 | K44: of:=(1/VLOOKUP([.K$40];[.$B$32:.$E$36];4;FALSE()))*[.$C$5]*[.D44] -> 2.05757138393787 | L44: of:=(1/VLOOKUP([.L$40];[.$B$32:.$E$36];4;FALSE()))*[.$C$5]*[.E44] -> 0.670820393249937 | M44: of:=(1/VLOOKUP([.M$40];[.$B$32:.$E$36];4;FALSE()))*[.$C$5]*[.F44] -> 3.46410161513775 | N44: of:=(1/VLOOKUP([.N$40];[.$B$32:.$E$36];4;FALSE()))*[.$C$5]*[.G44] -> 2.7712812921102 | X44: 150000 | Y44: of:=[.Q51]+[.Q75] -> 0.303662982780436 | Z44: of:=[.R51]+[.R75] -> 0.0171605227361886 | AA44: of:=[.S51]+[.S75] -> 0.015806161433652 | AB44: of:=[.T51]+[.T75] -> 0.0172848 | AC44: of:=[.U51]+[.U75] -> 0.0100284166666667
B45: 250000 | C45: of:=SQRT(2*IOUT*VLOOKUP([.C$40];[.$B$32:.$E$36];4;FALSE())*([.$C$7]/([.$B45]*[.$C$5]^2))) -> 0.00000293938769133981 | D45: of:=SQRT(2*IOUT*VLOOKUP([.D$40];[.$B$32:.$E$36];4;FALSE())*([.$C$7]/([.$B45]*[.$C$5]^2))) -> 0.0000015649215928719 | E45: of:=SQRT(2*IOUT*VLOOKUP([.E$40];[.$B$32:.$E$36];4;FALSE())*([.$C$7]/([.$B45]*[.$C$5]^2))) -> 0.0000048 | F45: of:=SQRT(2*IOUT*VLOOKUP([.F$40];[.$B$32:.$E$36];4;FALSE())*([.$C$7]/([.$B45]*[.$C$5]^2))) -> 0.00000092951600308978 | G45: of:=SQRT(2*IOUT*VLOOKUP([.G$40];[.$B$32:.$E$36];4;FALSE())*([.$C$7]/([.$B45]*[.$C$5]^2))) -> 0.00000116189500386223 | I45: 250000 | J45: of:=(1/VLOOKUP([.J$40];[.$B$32:.$E$36];4;FALSE()))*[.$C$5]*[.C45] -> 0.979795897113271 | K45: of:=(1/VLOOKUP([.K$40];[.$B$32:.$E$36];4;FALSE()))*[.$C$5]*[.D45] -> 1.84034779321736 | L45: of:=(1/VLOOKUP([.L$40];[.$B$32:.$E$36];4;FALSE()))*[.$C$5]*[.E45] -> 0.6 | M45: of:=(1/VLOOKUP([.M$40];[.$B$32:.$E$36];4;FALSE()))*[.$C$5]*[.F45] -> 3.09838667696593 | N45: of:=(1/VLOOKUP([.N$40];[.$B$32:.$E$36];4;FALSE()))*[.$C$5]*[.G45] -> 2.47870934157275 | X45: 200000 | Y45: of:=[.Q52]+[.Q76] -> 0.262979857276814 | Z45: of:=[.R52]+[.R76] -> 0.0148614486317597 | AA45: of:=[.S52]+[.S76] -> 0.0136885373378605 | AB45: of:=[.T52]+[.T76] -> 0.0149690758993333 | AC45: of:=[.U52]+[.U76] -> 0.00868486359306859
X46: 250000 | Y46: of:=[.Q53]+[.Q77] -> 0.235216335033659 | Z46: of:=[.R53]+[.R77] -> 0.0132924837538944 | AA46: of:=[.S53]+[.S77] -> 0.0122434 | AB46: of:=[.T53]+[.T77] -> 0.0133887485085052 | AC46: of:=[.U53]+[.U77] -> 0.00776797814776578
B47: Duty Cycle T1 | I47: RMS Current | P47: Primary Conducted Losses
B48: Fsw | C48: of:=TRANSPOSE([.B32:.B36]) -> CJ5143 | D48: 750312367 | E48: 750315839 | F48: 750315831 | G48: 750315825 | I48: Fsw | J48: of:=TRANSPOSE([.$B$32:.$B$36]) -> CJ5143 | K48: 750312367 | L48: 750315839 | M48: 750315831 | N48: 750315825 | P48: Fsw | Q48: of:=TRANSPOSE([.$B$32:.$B$36]) -> CJ5143 | R48: 750312367 | S48: 750315839 | T48: 750315831 | U48: 750315825 | Y48: of:=POUT/(POUT+[.Y42]) -> 0.773874108281981 | Z48: of:=POUT/(POUT+[.Z42]) -> 0.98375551986152 | AA48: of:=POUT/(POUT+[.AA42]) -> 0.985018376855483 | AB48: of:=POUT/(POUT+[.AB42]) -> 0.983639801285502 | AC48: of:=POUT/(POUT+[.AC42]) -> 0.990442381136704
B49: 50000 | C49: of:=[.C41]/(1/[.$B49]) -> 0.3286335345031 | D49: of:=[.D41]/(1/[.$B49]) -> 0.174963553055941 | E49: of:=[.E41]/(1/[.$B49]) -> 0.53665631459995 | F49: of:=[.F41]/(1/[.$B49]) -> 0.103923048454133 | G49: of:=[.G41]/(1/[.$B49]) -> 0.129903810567666 | I49: 50000 | J49: of:=[.J41]*SQRT([.C49]/3) -> 0.725130095365625 | K49: of:=[.K41]*SQRT([.D49]/3) -> 0.99379789911741 | L49: of:=[.L41]*SQRT([.E49]/3) -> 0.567444965401905 | M49: of:=[.M41]*SQRT([.F49]/3) -> 1.28948391818825 | N49: of:=[.N41]*SQRT([.G49]/3) -> 1.15334947878468 | P49: 50000 | Q49: of:=VLOOKUP([.Q$48];[.$B$32:.$H$36];7;FALSE())*[.J49]^2 -> 0.52581365520496 | R49: of:=VLOOKUP([.R$48];[.$B$32:.$H$36];7;FALSE())*[.K49]^2 -> 0.0296290279287053 | S49: of:=VLOOKUP([.S$48];[.$B$32:.$H$36];7;FALSE())*[.L49]^2 -> 0.0273694720445974 | T49: of:=VLOOKUP([.T$48];[.$B$32:.$H$36];7;FALSE())*[.M49]^2 -> 0.0299298379547902 | U49: of:=VLOOKUP([.U$48];[.$B$32:.$H$36];7;FALSE())*[.N49]^2 -> 0.0172927952627677 | Y49: of:=POUT/(POUT+[.Y43]) -> 0.82876374460644 | Z49: of:=POUT/(POUT+[.Z43]) -> 0.988458504678851 | AA49: of:=POUT/(POUT+[.AA43]) -> 0.989359702889217 | AB49: of:=POUT/(POUT+[.AB43]) -> 0.988375892249473 | AC49: of:=POUT/(POUT+[.AC43]) -> 0.99322277097404
B50: 100000 | C50: of:=[.C42]/(1/[.$B50]) -> 0.46475800154489 | D50: of:=[.D42]/(1/[.$B50]) -> 0.247435829652697 | E50: of:=[.E42]/(1/[.$B50]) -> 0.758946638440411 | F50: of:=[.F42]/(1/[.$B50]) -> 0.146969384566991 | G50: of:=[.G42]/(1/[.$B50]) -> 0.183711730708738 | I50: 100000 | J50: of:=[.J42]*SQRT([.C50]/3) -> 0.609759297785538 | K50: of:=[.K42]*SQRT([.D50]/3) -> 0.835681090854502 | L50: of:=[.L42]*SQRT([.E50]/3) -> 0.47716243726023 | M50: of:=[.M42]*SQRT([.F50]/3) -> 1.08432240433181 | N50: of:=[.N42]*SQRT([.G50]/3) -> 0.969847442244779 | P50: 100000 | Q50: of:=VLOOKUP([.Q$48];[.$B$32:.$H$36];7;FALSE())*[.J50]^2 -> 0.371806401235912 | R50: of:=VLOOKUP([.R$48];[.$B$32:.$H$36];7;FALSE())*[.K50]^2 -> 0.0209508865683531 | S50: of:=VLOOKUP([.S$48];[.$B$32:.$H$36];7;FALSE())*[.L50]^2 -> 0.0193531392802305 | T50: of:=VLOOKUP([.T$48];[.$B$32:.$H$36];7;FALSE())*[.M50]^2 -> 0.0211635913776467 | U50: of:=VLOOKUP([.U$48];[.$B$32:.$H$36];7;FALSE())*[.N50]^2 -> 0.0122278527959736 | Y50: of:=POUT/(POUT+[.Y44]) -> 0.855650365450135 | Z50: of:=POUT/(POUT+[.Z44]) -> 0.990556407911422 | AA50: of:=POUT/(POUT+[.AA44]) -> 0.991295237471178 | AB50: of:=POUT/(POUT+[.AB44]) -> 0.990488667488992 | AC50: of:=POUT/(POUT+[.AC44]) -> 0.994459525290142
B51: 150000 | C51: of:=[.C43]/(1/[.$B51]) -> 0.569209978830308 | D51: of:=[.D43]/(1/[.$B51]) -> 0.303045763365663 | E51: of:=[.E43]/(1/[.$B51]) -> 0.92951600308978 | F51: of:=[.F43]/(1/[.$B51]) -> 0.18 | G51: of:=[.G43]/(1/[.$B51]) -> 0.225 | I51: 150000 | J51: of:=[.J43]*SQRT([.C51]/3) -> 0.550979723198744 | K51: of:=[.K43]*SQRT([.D51]/3) -> 0.755123108074989 | L51: of:=[.L43]*SQRT([.E51]/3) -> 0.431164934355701 | M51: of:=[.M43]*SQRT([.F51]/3) -> 0.979795897113271 | N51: of:=[.N43]*SQRT([.G51]/3) -> 0.876356092008266 | P51: 150000 | Q51: of:=VLOOKUP([.Q$48];[.$B$32:.$H$36];7;FALSE())*[.J51]^2 -> 0.303578655376165 | R51: of:=VLOOKUP([.R$48];[.$B$32:.$H$36];7;FALSE())*[.K51]^2 -> 0.017106327250465 | S51: of:=VLOOKUP([.S$48];[.$B$32:.$H$36];7;FALSE())*[.L51]^2 -> 0.0158017720525263 | T51: of:=VLOOKUP([.T$48];[.$B$32:.$H$36];7;FALSE())*[.M51]^2 -> 0.01728 | U51: of:=VLOOKUP([.U$48];[.$B$32:.$H$36];7;FALSE())*[.N51]^2 -> 0.009984 | Y51: of:=POUT/(POUT+[.Y45]) -> 0.872524272910762 | Z51: of:=POUT/(POUT+[.Z45]) -> 0.991811248928692 | AA51: of:=POUT/(POUT+[.AA45]) -> 0.99245265267103 | AB51: of:=POUT/(POUT+[.AB45]) -> 0.991752434739465 | AC51: of:=POUT/(POUT+[.AC45]) -> 0.99519824389097
B52: 200000 | C52: of:=[.C44]/(1/[.$B52]) -> 0.657267069006199 | D52: of:=[.D44]/(1/[.$B52]) -> 0.349927106111883 | E52: of:=[.E44]/(1/[.$B52]) -> 1.0733126291999 | F52: of:=[.F44]/(1/[.$B52]) -> 0.207846096908265 | G52: of:=[.G44]/(1/[.$B52]) -> 0.259807621135332 | I52: 200000 | J52: of:=[.J44]*SQRT([.C52]/3) -> 0.512744407675481 | K52: of:=[.K44]*SQRT([.D52]/3) -> 0.702721233594865 | L52: of:=[.L44]*SQRT([.E52]/3) -> 0.401244182985853 | M52: of:=[.M44]*SQRT([.F52]/3) -> 0.911802822781911 | N52: of:=[.N44]*SQRT([.G52]/3) -> 0.815541237526619 | P52: 200000 | Q52: of:=VLOOKUP([.Q$48];[.$B$32:.$H$36];7;FALSE())*[.J52]^2 -> 0.26290682760248 | R52: of:=VLOOKUP([.R$48];[.$B$32:.$H$36];7;FALSE())*[.K52]^2 -> 0.0148145139643527 | S52: of:=VLOOKUP([.S$48];[.$B$32:.$H$36];7;FALSE())*[.L52]^2 -> 0.0136847360222987 | T52: of:=VLOOKUP([.T$48];[.$B$32:.$H$36];7;FALSE())*[.M52]^2 -> 0.0149649189773951 | U52: of:=VLOOKUP([.U$48];[.$B$32:.$H$36];7;FALSE())*[.N52]^2 -> 0.00864639763138383 | Y52: of:=POUT/(POUT+[.Y46]) -> 0.884426863628839 | Z52: of:=POUT/(POUT+[.Z46]) -> 0.992669421026675 | AA52: of:=POUT/(POUT+[.AA46]) -> 0.993244064235522 | AB52: of:=POUT/(POUT+[.AB46]) -> 0.992616724615989 | AC52: of:=POUT/(POUT+[.AC46]) -> 0.995703000472591
B53: 250000 | C53: of:=[.C45]/(1/[.$B53]) -> 0.734846922834954 | D53: of:=[.D45]/(1/[.$B53]) -> 0.391230398217976 | E53: of:=[.E45]/(1/[.$B53]) -> 1.2 | F53: of:=[.F45]/(1/[.$B53]) -> 0.232379000772445 | G53: of:=[.G45]/(1/[.$B53]) -> 0.290473750965556 | I53: 250000 | J53: of:=[.J45]*SQRT([.C53]/3) -> 0.48492372112239 | K53: of:=[.K45]*SQRT([.D53]/3) -> 0.664592710140704 | L53: of:=[.L45]*SQRT([.E53]/3) -> 0.379473319220206 | M53: of:=[.M45]*SQRT([.F53]/3) -> 0.862329868711402 | N53: of:=[.N45]*SQRT([.G53]/3) -> 0.771291282186866 | P53: 250000 | Q53: of:=VLOOKUP([.Q$48];[.$B$32:.$H$36];7;FALSE())*[.J53]^2 -> 0.235151015307185 | R53: of:=VLOOKUP([.R$48];[.$B$32:.$H$36];7;FALSE())*[.K53]^2 -> 0.013250504111165 | S53: of:=VLOOKUP([.S$48];[.$B$32:.$H$36];7;FALSE())*[.L53]^2 -> 0.01224 | T53: of:=VLOOKUP([.T$48];[.$B$32:.$H$36];7;FALSE())*[.M53]^2 -> 0.0133850304444928 | U53: of:=VLOOKUP([.U$48];[.$B$32:.$H$36];7;FALSE())*[.N53]^2 -> 0.00773357314570697
B55: Right Half Plane Zero
B56: Fsw | C56: of:=TRANSPOSE([.B32:.B36]) -> CJ5143 | D56: 750312367 | E56: 750315839 | F56: 750315831 | G56: 750315825
B57: 50000 | C57: of:=(VOUT*((1-[.C49])^2))/(2*PI()*[.C49]*IOUT*VLOOKUP([.C$56];[.$B$32:.$F$36];5;0)) -> 2619442.01490314 | D57: of:=(VOUT*((1-[.D49])^2))/(2*PI()*[.D49]*IOUT*VLOOKUP([.D$56];[.$B$32:.$F$36];5;0)) -> 37150961.7751163 | E57: of:=(VOUT*((1-[.E49])^2))/(2*PI()*[.E49]*IOUT*VLOOKUP([.E$56];[.$B$32:.$F$36];5;0)) -> 286512.054525425 | F57: of:=(VOUT*((1-[.F49])^2))/(2*PI()*[.F49]*IOUT*VLOOKUP([.F$56];[.$B$32:.$F$36];5;0)) -> 147563896.155394 | G57: of:=(VOUT*((1-[.G49])^2))/(2*PI()*[.G49]*IOUT*VLOOKUP([.G$56];[.$B$32:.$F$36];5;0)) -> 111304832.466488
B58: 100000 | C58: of:=(VOUT*((1-[.C50])^2))/(2*PI()*[.C50]*IOUT*VLOOKUP([.C$56];[.$B$32:.$F$36];5;0)) -> 1177266.72565307 | D58: of:=(VOUT*((1-[.D50])^2))/(2*PI()*[.D50]*IOUT*VLOOKUP([.D$56];[.$B$32:.$F$36];5;0)) -> 21857267.6317343 | E58: of:=(VOUT*((1-[.E50])^2))/(2*PI()*[.E50]*IOUT*VLOOKUP([.E$56];[.$B$32:.$F$36];5;0)) -> 54833.7298605339 | F58: of:=(VOUT*((1-[.F50])^2))/(2*PI()*[.F50]*IOUT*VLOOKUP([.F$56];[.$B$32:.$F$36];5;0)) -> 94559189.0146657 | G58: of:=(VOUT*((1-[.G50])^2))/(2*PI()*[.G50]*IOUT*VLOOKUP([.G$56];[.$B$32:.$F$36];5;0)) -> 69271022.7613202
B59: 150000 | C59: of:=(VOUT*((1-[.C51])^2))/(2*PI()*[.C51]*IOUT*VLOOKUP([.C$56];[.$B$32:.$F$36];5;0)) -> 622673.154217234 | D59: of:=(VOUT*((1-[.D51])^2))/(2*PI()*[.D51]*IOUT*VLOOKUP([.D$56];[.$B$32:.$F$36];5;0)) -> 15306351.7678334 | E59: of:=(VOUT*((1-[.E51])^2))/(2*PI()*[.E51]*IOUT*VLOOKUP([.E$56];[.$B$32:.$F$36];5;0)) -> 3827.86683623652 | F59: of:=(VOUT*((1-[.F51])^2))/(2*PI()*[.F51]*IOUT*VLOOKUP([.F$56];[.$B$32:.$F$36];5;0)) -> 71343855.8233269 | G59: of:=(VOUT*((1-[.G51])^2))/(2*PI()*[.G51]*IOUT*VLOOKUP([.G$56];[.$B$32:.$F$36];5;0)) -> 50982633.4371038
B60: 200000 | C60: of:=(VOUT*((1-[.C52])^2))/(2*PI()*[.C52]*IOUT*VLOOKUP([.C$56];[.$B$32:.$F$36];5;0)) -> 341327.41702355 | D60: of:=(VOUT*((1-[.D52])^2))/(2*PI()*[.D52]*IOUT*VLOOKUP([.D$56];[.$B$32:.$F$36];5;0)) -> 11532352.5917241 | E60: of:=(VOUT*((1-[.E52])^2))/(2*PI()*[.E52]*IOUT*VLOOKUP([.E$56];[.$B$32:.$F$36];5;0)) -> 3586.4435170967 | F60: of:=(VOUT*((1-[.F52])^2))/(2*PI()*[.F52]*IOUT*VLOOKUP([.F$56];[.$B$32:.$F$36];5;0)) -> 57660530.9419474 | G60: of:=(VOUT*((1-[.G52])^2))/(2*PI()*[.G52]*IOUT*VLOOKUP([.G$56];[.$B$32:.$F$36];5;0)) -> 40275293.1063136
B61: 250000 | C61: of:=(VOUT*((1-[.C53])^2))/(2*PI()*[.C53]*IOUT*VLOOKUP([.C$56];[.$B$32:.$F$36];5;0)) -> 182724.945460716 | D61: of:=(VOUT*((1-[.D53])^2))/(2*PI()*[.D53]*IOUT*VLOOKUP([.D$56];[.$B$32:.$F$36];5;0)) -> 9045752.62639163 | E61: of:=(VOUT*((1-[.E53])^2))/(2*PI()*[.E53]*IOUT*VLOOKUP([.E$56];[.$B$32:.$F$36];5;0)) -> 23873.2414637843 | F61: of:=(VOUT*((1-[.F53])^2))/(2*PI()*[.F53]*IOUT*VLOOKUP([.F$56];[.$B$32:.$F$36];5;0)) -> 48428184.8633879 | G61: of:=(VOUT*((1-[.G53])^2))/(2*PI()*[.G53]*IOUT*VLOOKUP([.G$56];[.$B$32:.$F$36];5;0)) -> 33100261.0210586
B63: T2 (Secondary On) Vs Frequency | I63: Peak Secondary Current
B64: Fsw | C64: of:=TRANSPOSE([.$B$32:.$B$36]) -> CJ5143 | D64: 750312367 | E64: 750315839 | F64: 750315831 | G64: 750315825 | I64: Fsw | J64: of:=TRANSPOSE([.$B$32:.$B$36]) -> CJ5143 | K64: 750312367 | L64: 750315839 | M64: 750315831 | N64: 750315825
B65: 50000 | C65: of:=[.C41]*(((VIN_NOM+VOUT)*(1/VLOOKUP([.C$64];[.$B$32:.$D$36];3;FALSE())))/(VOUT*0.1))-[.C41] -> 0.000000182574185835055 | D65: of:=[.D41]*(((VIN_NOM+VOUT)*(1/VLOOKUP([.D$64];[.$B$32:.$D$36];3;FALSE())))/(VOUT*0.1))-[.D41] -> 0.000000782244456784499 | E65: of:=[.E41]*(((VIN_NOM+VOUT)*(1/VLOOKUP([.E$64];[.$B$32:.$D$36];3;FALSE())))/(VOUT*0.1))-[.E41] -> 0.000000298142396999971 | F65: of:=[.F41]*(((VIN_NOM+VOUT)*(1/VLOOKUP([.F$64];[.$B$32:.$D$36];3;FALSE())))/(VOUT*0.1))-[.F41] -> 0.0000000577350269189622 | G65: of:=[.G41]*(((VIN_NOM+VOUT)*(1/VLOOKUP([.G$64];[.$B$32:.$D$36];3;FALSE())))/(VOUT*0.1))-[.G41] -> 0.000000739730032399208 | I65: 50000 | J65: of:=[.J41]*(1/VLOOKUP([.J$64];[.$B$32:.$D$36];3;FALSE())) -> 0.219089023002067 | K65: of:=[.K41]*(1/VLOOKUP([.K$64];[.$B$32:.$D$36];3;FALSE())) -> 0.489897948556636 | L65: of:=[.L41]*(1/VLOOKUP([.L$64];[.$B$32:.$D$36];3;FALSE())) -> 0.134164078649987 | M65: of:=[.M41]*(1/VLOOKUP([.M$64];[.$B$32:.$D$36];3;FALSE())) -> 0.692820323027551 | N65: of:=[.N41]*(1/VLOOKUP([.N$64];[.$B$32:.$D$36];3;FALSE())) -> 0.692820323027551
B66: 100000 | C66: of:=[.C42]*(((VIN_NOM+VOUT)*(1/VLOOKUP([.C$64];[.$B$32:.$D$36];3;FALSE())))/(VOUT*0.1))-[.C42] -> 0.00000012909944487358 | D66: of:=[.D42]*(((VIN_NOM+VOUT)*(1/VLOOKUP([.D$64];[.$B$32:.$D$36];3;FALSE())))/(VOUT*0.1))-[.D42] -> 0.000000553130359937907 | E66: of:=[.E42]*(((VIN_NOM+VOUT)*(1/VLOOKUP([.E$64];[.$B$32:.$D$36];3;FALSE())))/(VOUT*0.1))-[.E42] -> 0.000000210818510677892 | F66: of:=[.F42]*(((VIN_NOM+VOUT)*(1/VLOOKUP([.F$64];[.$B$32:.$D$36];3;FALSE())))/(VOUT*0.1))-[.F42] -> 0.0000000408248290463861 | G66: of:=[.G42]*(((VIN_NOM+VOUT)*(1/VLOOKUP([.G$64];[.$B$32:.$D$36];3;FALSE())))/(VOUT*0.1))-[.G42] -> 0.000000523068122156824 | I66: 100000 | J66: of:=[.J42]*(1/VLOOKUP([.J$64];[.$B$32:.$D$36];3;FALSE())) -> 0.154919333848297 | K66: of:=[.K42]*(1/VLOOKUP([.K$64];[.$B$32:.$D$36];3;FALSE())) -> 0.346410161513775 | L66: of:=[.L42]*(1/VLOOKUP([.L$64];[.$B$32:.$D$36];3;FALSE())) -> 0.0948683298050514 | M66: of:=[.M42]*(1/VLOOKUP([.M$64];[.$B$32:.$D$36];3;FALSE())) -> 0.489897948556636 | N66: of:=[.N42]*(1/VLOOKUP([.N$64];[.$B$32:.$D$36];3;FALSE())) -> 0.489897948556636
B67: 150000 | C67: of:=[.C43]*(((VIN_NOM+VOUT)*(1/VLOOKUP([.C$64];[.$B$32:.$D$36];3;FALSE())))/(VOUT*0.1))-[.C43] -> 0.000000105409255338946 | D67: of:=[.D43]*(((VIN_NOM+VOUT)*(1/VLOOKUP([.D$64];[.$B$32:.$D$36];3;FALSE())))/(VOUT*0.1))-[.D43] -> 0.000000451629047696623 | E67: of:=[.E43]*(((VIN_NOM+VOUT)*(1/VLOOKUP([.E$64];[.$B$32:.$D$36];3;FALSE())))/(VOUT*0.1))-[.E43] -> 0.000000172132593164774 | F67: of:=[.F43]*(((VIN_NOM+VOUT)*(1/VLOOKUP([.F$64];[.$B$32:.$D$36];3;FALSE())))/(VOUT*0.1))-[.F43] -> 0.0000000333333333333332 | G67: of:=[.G43]*(((VIN_NOM+VOUT)*(1/VLOOKUP([.G$64];[.$B$32:.$D$36];3;FALSE())))/(VOUT*0.1))-[.G43] -> 0.000000427083333333333 | I67: 150000 | J67: of:=[.J43]*(1/VLOOKUP([.J$64];[.$B$32:.$D$36];3;FALSE())) -> 0.126491106406735 | K67: of:=[.K43]*(1/VLOOKUP([.K$64];[.$B$32:.$D$36];3;FALSE())) -> 0.282842712474619 | L67: of:=[.L43]*(1/VLOOKUP([.L$64];[.$B$32:.$D$36];3;FALSE())) -> 0.0774596669241483 | M67: of:=[.M43]*(1/VLOOKUP([.M$64];[.$B$32:.$D$36];3;FALSE())) -> 0.4 | N67: of:=[.N43]*(1/VLOOKUP([.N$64];[.$B$32:.$D$36];3;FALSE())) -> 0.4
B68: 200000 | C68: of:=[.C44]*(((VIN_NOM+VOUT)*(1/VLOOKUP([.C$64];[.$B$32:.$D$36];3;FALSE())))/(VOUT*0.1))-[.C44] -> 0.0000000912870929175273 | D68: of:=[.D44]*(((VIN_NOM+VOUT)*(1/VLOOKUP([.D$64];[.$B$32:.$D$36];3;FALSE())))/(VOUT*0.1))-[.D44] -> 0.00000039112222839225 | E68: of:=[.E44]*(((VIN_NOM+VOUT)*(1/VLOOKUP([.E$64];[.$B$32:.$D$36];3;FALSE())))/(VOUT*0.1))-[.E44] -> 0.000000149071198499986 | F68: of:=[.F44]*(((VIN_NOM+VOUT)*(1/VLOOKUP([.F$64];[.$B$32:.$D$36];3;FALSE())))/(VOUT*0.1))-[.F44] -> 0.0000000288675134594811 | G68: of:=[.G44]*(((VIN_NOM+VOUT)*(1/VLOOKUP([.G$64];[.$B$32:.$D$36];3;FALSE())))/(VOUT*0.1))-[.G44] -> 0.000000369865016199604 | I68: 200000 | J68: of:=[.J44]*(1/VLOOKUP([.J$64];[.$B$32:.$D$36];3;FALSE())) -> 0.109544511501033 | K68: of:=[.K44]*(1/VLOOKUP([.K$64];[.$B$32:.$D$36];3;FALSE())) -> 0.244948974278318 | L68: of:=[.L44]*(1/VLOOKUP([.L$64];[.$B$32:.$D$36];3;FALSE())) -> 0.0670820393249937 | M68: of:=[.M44]*(1/VLOOKUP([.M$64];[.$B$32:.$D$36];3;FALSE())) -> 0.346410161513775 | N68: of:=[.N44]*(1/VLOOKUP([.N$64];[.$B$32:.$D$36];3;FALSE())) -> 0.346410161513775
B69: 250000 | C69: of:=[.C45]*(((VIN_NOM+VOUT)*(1/VLOOKUP([.C$64];[.$B$32:.$D$36];3;FALSE())))/(VOUT*0.1))-[.C45] -> 0.0000000816496580927723 | D69: of:=[.D45]*(((VIN_NOM+VOUT)*(1/VLOOKUP([.D$64];[.$B$32:.$D$36];3;FALSE())))/(VOUT*0.1))-[.D45] -> 0.000000349830356078507 | E69: of:=[.E45]*(((VIN_NOM+VOUT)*(1/VLOOKUP([.E$64];[.$B$32:.$D$36];3;FALSE())))/(VOUT*0.1))-[.E45] -> 0.000000133333333333333 | F69: of:=[.F45]*(((VIN_NOM+VOUT)*(1/VLOOKUP([.F$64];[.$B$32:.$D$36];3;FALSE())))/(VOUT*0.1))-[.F45] -> 0.0000000258198889747159 | G69: of:=[.G45]*(((VIN_NOM+VOUT)*(1/VLOOKUP([.G$64];[.$B$32:.$D$36];3;FALSE())))/(VOUT*0.1))-[.G45] -> 0.00000033081732748855 | I69: 250000 | J69: of:=[.J45]*(1/VLOOKUP([.J$64];[.$B$32:.$D$36];3;FALSE())) -> 0.0979795897113271 | K69: of:=[.K45]*(1/VLOOKUP([.K$64];[.$B$32:.$D$36];3;FALSE())) -> 0.219089023002066 | L69: of:=[.L45]*(1/VLOOKUP([.L$64];[.$B$32:.$D$36];3;FALSE())) -> 0.06 | M69: of:=[.M45]*(1/VLOOKUP([.M$64];[.$B$32:.$D$36];3;FALSE())) -> 0.309838667696593 | N69: of:=[.N45]*(1/VLOOKUP([.N$64];[.$B$32:.$D$36];3;FALSE())) -> 0.309838667696593
B71: Duty Cycle T2 | I71: RMS Secondary Current | P71: Secondary Conducted Losses
B72: Fsw | C72: of:=TRANSPOSE([.B32:.B36]) -> CJ5143 | D72: 750312367 | E72: 750315839 | F72: 750315831 | G72: 750315825 | I72: Fsw | J72: of:=TRANSPOSE([.$B$32:.$B$36]) -> CJ5143 | K72: 750312367 | L72: 750315839 | M72: 750315831 | N72: 750315825 | P72: Fsw | Q72: of:=TRANSPOSE([.$B$32:.$B$36]) -> CJ5143 | R72: 750312367 | S72: 750315839 | T72: 750315831 | U72: 750315825
B73: 50000 | C73: of:=[.$B73]/(1/[.C65]) -> 0.00912870929175273 | D73: of:=[.$B73]/(1/[.D65]) -> 0.039112222839225 | E73: of:=[.$B73]/(1/[.E65]) -> 0.0149071198499986 | F73: of:=[.$B73]/(1/[.F65]) -> 0.00288675134594811 | G73: of:=[.$B73]/(1/[.G65]) -> 0.0369865016199604 | I73: 50000 | J73: of:=[.J65]*SQRT([.C73]/3) -> 0.0120855015894271 | K73: of:=[.K65]*SQRT([.D73]/3) -> 0.0559372668901332 | L73: of:=[.L65]*SQRT([.E73]/3) -> 0.00945741609003175 | M73: of:=[.M65]*SQRT([.F73]/3) -> 0.0214913986364708 | N73: of:=[.N65]*SQRT([.G73]/3) -> 0.0769275000191327 | P73: 50000 | Q73: of:=VLOOKUP([.Q$72];[.$B$32:.$H$36];7;FALSE())*[.J73]^2 -> 0.000146059348668044 | R73: of:=VLOOKUP([.R$72];[.$B$32:.$H$36];7;FALSE())*[.K73]^2 -> 0.0000938693348141399 | S73: of:=VLOOKUP([.S$72];[.$B$32:.$H$36];7;FALSE())*[.L73]^2 -> 0.00000760263112349927 | T73: of:=VLOOKUP([.T$72];[.$B$32:.$H$36];7;FALSE())*[.M73]^2 -> 0.00000831384387633056 | U73: of:=VLOOKUP([.U$72];[.$B$32:.$H$36];7;FALSE())*[.N73]^2 -> 0.0000769319233695177
B74: 100000 | C74: of:=[.$B74]/(1/[.C66]) -> 0.012909944487358 | D74: of:=[.$B74]/(1/[.D66]) -> 0.0553130359937907 | E74: of:=[.$B74]/(1/[.E66]) -> 0.0210818510677892 | F74: of:=[.$B74]/(1/[.F66]) -> 0.00408248290463861 | G74: of:=[.$B74]/(1/[.G66]) -> 0.0523068122156824 | I74: 100000 | J74: of:=[.J66]*SQRT([.C74]/3) -> 0.0101626549630923 | K74: of:=[.K66]*SQRT([.D74]/3) -> 0.0470374472070033 | L74: of:=[.L66]*SQRT([.E74]/3) -> 0.0079527072876705 | M74: of:=[.M66]*SQRT([.F74]/3) -> 0.0180720400721969 | N74: of:=[.N66]*SQRT([.G74]/3) -> 0.0646880590005188 | P74: 100000 | Q74: of:=VLOOKUP([.Q$72];[.$B$32:.$H$36];7;FALSE())*[.J74]^2 -> 0.000103279555898864 | R74: of:=VLOOKUP([.R$72];[.$B$32:.$H$36];7;FALSE())*[.K74]^2 -> 0.0000663756431925488 | S74: of:=VLOOKUP([.S$72];[.$B$32:.$H$36];7;FALSE())*[.L74]^2 -> 0.00000537587202228624 | T74: of:=VLOOKUP([.T$72];[.$B$32:.$H$36];7;FALSE())*[.M74]^2 -> 0.00000587877538267961 | U74: of:=VLOOKUP([.U$72];[.$B$32:.$H$36];7;FALSE())*[.N74]^2 -> 0.0000543990847043098
B75: 150000 | C75: of:=[.$B75]/(1/[.C67]) -> 0.0158113883008419 | D75: of:=[.$B75]/(1/[.D67]) -> 0.0677443571544935 | E75: of:=[.$B75]/(1/[.E67]) -> 0.0258198889747161 | F75: of:=[.$B75]/(1/[.F67]) -> 0.00499999999999997 | G75: of:=[.$B75]/(1/[.G67]) -> 0.0640625 | I75: 150000 | J75: of:=[.J67]*SQRT([.C75]/3) -> 0.00918299538664573 | K75: of:=[.K67]*SQRT([.D75]/3) -> 0.0425031315409405 | L75: of:=[.L67]*SQRT([.E75]/3) -> 0.00718608223926168 | M75: of:=[.M67]*SQRT([.F75]/3) -> 0.0163299316185545 | N75: of:=[.N67]*SQRT([.G75]/3) -> 0.0584522597225006 | P75: 150000 | Q75: of:=VLOOKUP([.Q$72];[.$B$32:.$H$36];7;FALSE())*[.J75]^2 -> 0.0000843274042711567 | R75: of:=VLOOKUP([.R$72];[.$B$32:.$H$36];7;FALSE())*[.K75]^2 -> 0.0000541954857235948 | S75: of:=VLOOKUP([.S$72];[.$B$32:.$H$36];7;FALSE())*[.L75]^2 -> 0.00000438938112570173 | T75: of:=VLOOKUP([.T$72];[.$B$32:.$H$36];7;FALSE())*[.M75]^2 -> 0.00000479999999999997 | U75: of:=VLOOKUP([.U$72];[.$B$32:.$H$36];7;FALSE())*[.N75]^2 -> 0.0000444166666666667
B76: 200000 | C76: of:=[.$B76]/(1/[.C68]) -> 0.0182574185835055 | D76: of:=[.$B76]/(1/[.D68]) -> 0.0782244456784499 | E76: of:=[.$B76]/(1/[.E68]) -> 0.0298142396999971 | F76: of:=[.$B76]/(1/[.F68]) -> 0.00577350269189622 | G76: of:=[.$B76]/(1/[.G68]) -> 0.0739730032399208 | I76: 200000 | J76: of:=[.J68]*SQRT([.C76]/3) -> 0.00854574012792467 | K76: of:=[.K68]*SQRT([.D76]/3) -> 0.039553620739055 | L76: of:=[.L68]*SQRT([.E76]/3) -> 0.00668740304976421 | M76: of:=[.M68]*SQRT([.F76]/3) -> 0.0151967137130318 | N76: of:=[.N68]*SQRT([.G76]/3) -> 0.054395956923257 | P76: 200000 | Q76: of:=VLOOKUP([.Q$72];[.$B$32:.$H$36];7;FALSE())*[.J76]^2 -> 0.0000730296743340219 | R76: of:=VLOOKUP([.R$72];[.$B$32:.$H$36];7;FALSE())*[.K76]^2 -> 0.0000469346674070699 | S76: of:=VLOOKUP([.S$72];[.$B$32:.$H$36];7;FALSE())*[.L76]^2 -> 0.00000380131556174963 | T76: of:=VLOOKUP([.T$72];[.$B$32:.$H$36];7;FALSE())*[.M76]^2 -> 0.00000415692193816528 | U76: of:=VLOOKUP([.U$72];[.$B$32:.$H$36];7;FALSE())*[.N76]^2 -> 0.0000384659616847588
B77: 250000 | C77: of:=[.$B77]/(1/[.C69]) -> 0.0204124145231931 | D77: of:=[.$B77]/(1/[.D69]) -> 0.0874575890196268 | E77: of:=[.$B77]/(1/[.E69]) -> 0.0333333333333332 | F77: of:=[.$B77]/(1/[.F69]) -> 0.00645497224367898 | G77: of:=[.$B77]/(1/[.G69]) -> 0.0827043318721376 | I77: 250000 | J77: of:=[.J69]*SQRT([.C77]/3) -> 0.00808206201870648 | K77: of:=[.K69]*SQRT([.D77]/3) -> 0.0374075049196552 | L77: of:=[.L69]*SQRT([.E77]/3) -> 0.00632455532033674 | M77: of:=[.M69]*SQRT([.F77]/3) -> 0.0143721644785233 | N77: of:=[.N69]*SQRT([.G77]/3) -> 0.0514445198238685 | P77: 250000 | Q77: of:=VLOOKUP([.Q$72];[.$B$32:.$H$36];7;FALSE())*[.J77]^2 -> 0.0000653197264742178 | R77: of:=VLOOKUP([.R$72];[.$B$32:.$H$36];7;FALSE())*[.K77]^2 -> 0.0000419796427294209 | S77: of:=VLOOKUP([.S$72];[.$B$32:.$H$36];7;FALSE())*[.L77]^2 -> 0.00000339999999999998 | T77: of:=VLOOKUP([.T$72];[.$B$32:.$H$36];7;FALSE())*[.M77]^2 -> 0.00000371806401235909 | U77: of:=VLOOKUP([.U$72];[.$B$32:.$H$36];7;FALSE())*[.N77]^2 -> 0.0000344050020588092
B79: T3 (Idle)
B80: Fsw | C80: of:=TRANSPOSE([.B32:.B36]) -> CJ5143 | D80: 750312367 | E80: 750315839 | F80: 750315831 | G80: 750315825
B81: 50000 | C81: of:=(1/[.$B81])-[.C41]-[.C65] -> 0.000013244755124103 | D81: of:=(1/[.$B81])-[.D41]-[.D65] -> 0.0000157184844820967 | E81: of:=(1/[.$B81])-[.E41]-[.E65] -> 0.00000896873131100104 | F81: of:=(1/[.$B81])-[.F41]-[.F65] -> 0.0000178638040039984 | G81: of:=(1/[.$B81])-[.G41]-[.G65] -> 0.0000166621937562475
B82: 100000 | C82: of:=(1/[.$B82])-[.C42]-[.C66] -> 0.00000522332053967752 | D82: of:=(1/[.$B82])-[.D42]-[.D66] -> 0.00000697251134353513 | E82: of:=(1/[.$B82])-[.E42]-[.E66] -> 0.000002199715104918 | F82: of:=(1/[.$B82])-[.F42]-[.F66] -> 0.00000848948132528371 | G82: of:=(1/[.$B82])-[.G42]-[.G66] -> 0.00000763981457075579
B83: 150000 | C83: of:=(1/[.$B83])-[.C43]-[.C67] -> 0.00000276652421912567 | D83: of:=(1/[.$B83])-[.D43]-[.D67] -> 0.00000419473252986562 | E83: of:=(1/[.$B83])-[.E43]-[.E67] -> 0.000000297760719570026 | F83: of:=(1/[.$B83])-[.F43]-[.F67] -> 0.00000543333333333333 | G83: of:=(1/[.$B83])-[.G43]-[.G67] -> 0.00000473958333333333
B84: 200000 | C84: of:=(1/[.$B84])-[.C44]-[.C68] -> 0.00000162237756205148 | D84: of:=(1/[.$B84])-[.D44]-[.D68] -> 0.00000285924224104834 | E84: of:=(1/[.$B84])-[.E44]-[.E68] -> -0.000000515634344499481 | F84: of:=(1/[.$B84])-[.F44]-[.F68] -> 0.00000393190200199919 | G84: of:=(1/[.$B84])-[.G44]-[.G68] -> 0.00000333109687812374
B85: 250000 | C85: of:=(1/[.$B85])-[.C45]-[.C69] -> 0.000000978962650567414 | D85: of:=(1/[.$B85])-[.D45]-[.D69] -> 0.00000208524805104959 | E85: of:=(1/[.$B85])-[.E45]-[.E69] -> -0.000000933333333333333 | F85: of:=(1/[.$B85])-[.F45]-[.F69] -> 0.0000030446641079355 | G85: of:=(1/[.$B85])-[.G45]-[.G69] -> 0.00000250728766864922

Sheet: TPS40210
F6: Rout | G6: 9000
B7: Fsw | C7: 250 | F7: D | G7: 0.41
B8: CT | C8: 470 | F8: D’ | G8: of:=1-[.G7] -> 0.59
B9: RT | C9: of:=1/(0.000000058*[.C7]*[.C8]+0.0000000008*[.C7]^2+0.00000014*[.C7]-0.00015+0.0000017*[.C8]-0.000000004*[.C8]^2) -> 150.028505416029 | F9: Np | G9: 1
F10: Ns | G10: 8
B12: Tss | C12: 0.05 | F12: A | G12: 6
B13: Css | C13: of:=[.C12]/500000*LN((5-0.7)/(5-(0.7+0.7))) -> 0.0000000177681177237452 | F13: Rs | G13: 0.003
F14: Ri | G14: of:=[.G12]*[.G13] -> 0.018
B15: Fsw | C15: 250000
B16: Iout OC | C16: 4 | F16: Avc | G16: of:=([.G6]*[.G8])/((1+[.G7])*[.G14])*([.G9]/[.G10]) -> 26152.4822695035
B17: L | C17: 0.00000234 | F17: dB | G17: of:=20*LOG10([.G16]) -> 88.3502583266168
B18: Vd | C18: 0.9
B19: vout | C19: 180
B20: Risns | C20: of:=([.C15]*[.C17]*0.15)/(SQRT(2*[.C17]*[.C15]*[.C16]*([.C19]+[.C18]-5))) -> 0.00305837883016298
B22: Rfb | C22: 1000000
B23: Rbias | C23: of:=(0.7*[.C22])/([.C19]-0.7) -> 3904.07138873397
B26: Duty | C26: 0.41
B27: Ton | C27: of:=[.C26]/[.C15] -> 0.00000164
B29: Rfilt | C29: 1000
B30: Cfilt | C30: of:=(0.1*[.C27])/[.C29] -> 0.000000000164

Sheet: LM5155
B3: Fsw | C3: 250000 | E3: Vmax | F3: 40 | H3: RC Snubber
B4: Rt | C4: of:=(22100000000/[.C3])-955 -> 87445 | E4: Vin | F4: 5 | H4: Leakage | I4: 0.000000375
E5: Vclamp | F5: of:=[.F3]-[.F4] -> 35 | H5: Coss | I5: 0.000000000166
H6: Rsnub | I6: of:=SQRT([.I4]/[.I5]) -> 47.5293187893358
E7: Vout | F7: 180
E8: Ipeak | F8: 4.5 | H8: Csnub | I8: 0.00000000033
E9: Leakage | F9: 0.000000046 | H9: Ploss Snub | I9: of:=[.I8]*[.F7]^2*[.C3] -> 2.673
E10: n | F10: 8
E12: rclamp | F12: of:=(2*[.F5]*([.F5]-((1/[.F10])*[.F7])))/([.C3]*[.F9]*[.F8]^2) -> 3757.38056897477
E15: Cclamp | F15: of:=5/([.F12]*[.C3]) -> 0.00000000532285714285714
E17: Clamp Loss | F17: of:=0.5*[.F9]*[.F8]^2*[.C3]*([.F5]/([.F5]-((1/[.F10])*[.F7]))) -> 0.326025